67639048	Bar Cella, Piazza Caduti della Libertà, Stavoli Pallis, Tolmezzo, UD, FVG, 33022, Italia	46.45406775	13.036922598165	0.101
69616796	Bar Tassotti, Via Zara, Stavoli Pallis, Tolmezzo, UD, FVG, 33022, Italia	46.45464025	13.0365648521884	0.101
15435674	Barut, Via Val di Gorto, Case Gerin, Tolmezzo, UD, FVG, 33028, Italia	46.4026333	13.0049885	0.101
51974500	Bar alla Seggiovia, 15, Via Valcalda, Ravascletto, UD, FVG, 33020, Italia	46.5213285	12.9211125	0.101
15034825	Bar Lo Scoiattolo, Via di Sot, Cercivento, UD, FVG, 33026, Italia	46.5258014	12.9966472	0.101
15910037	Escobar, Via Cja' Manzòt, Cercivento, UD, FVG, 33026, Italia	46.5280454	12.9936431	0.101
67618472	Bar Erica, Via Nazionale, Englaro di Sotto, Paluzza, UD, FVG, 33026, Italia	46.5133791	13.0020330575671	0.101
66621542	Bar Pacai, Via Muses, Muse, Paluzza, UD, FVG, 33026, Italia	46.5662018	13.0078386732987	0.101
26376255	Bar Moderno, Via Caduti Due Maggio, Applis, Ovaro, UD, FVG, 33025, Italia	46.4831342	12.8651985	0.101
35008100	Bar del Cacciatore, Via Caduti Due Maggio, Applis, Ovaro, UD, FVG, 33025, Italia	46.4815932	12.8665721	0.101
16442114	Vicolo Baraz, Trasaghis, UD, FVG, Italia	46.3150694	13.052871	0.101
22033552	Bar Arvenis, Piazza Quattro Novembre, Sutrio, UD, FVG, 33026, Italia	46.5038371	12.9877784	0.101
16405739	Bar Gussetti, Piazza medaglia d'oro Anselmo Durigon, Rigolato, UD, FVG, 33023, Italia	46.5527587	12.8514732	0.101
16314250	Bar Alle Belle Arti, Via della Repubblica, Rigolato, UD, FVG, 33023, Italia	46.5492075	12.8543059	0.101
19127555	Baraonda, Via Umberto Primo, Borgo Scludizza, Braida d'Alzeri, Arta Terme, UD, FVG, 33022, Italia	46.4715578	13.0257098	0.101
69616754	Bar al Ponte, SS52bis, Borgo Scludizza, Arta Terme, UD, FVG, 33022, Italia	46.46443555	13.0284708189732	0.101
19286750	Bar Mistrizzi, Frazione Piedim, Stavoli Chiarzò, Arta Terme, UD, FVG, 33022, Italia	46.4706548	13.0642829	0.101
68122943	BarShangri-La, SS52bis, Arta Terme, UD, FVG, 33022, Italia	46.457596	13.0341928745318	0.101
66956894	Bar Al Fogolar, SR465, Frazione Luch, Prato Carnico, UD, FVG, Italia	46.51998635	12.8082063094727	0.101
26333890	Bar Commercio, Via della Libertà, Villa Santina, UD, FVG, 33029, Italia	46.4151028	12.9236801	0.101
25087746	Bar, Via della Libertà, Villa Santina, UD, FVG, 33029, Italia	46.4138163	12.9221735	0.101
21051512	Bar da Nila, Via Pinzano, Forgaria nel Friuli, UD, FVG, 33094, Italia	46.2112488	12.9554553	0.101
16323409	Via Divisione Osoppo, Case Gerin, Tolmezzo, UD, FVG, 33028, Italia	46.4040032	13.0092521	0.001
15857351	Tilly's Pub, Via Giacomo Matteotti, Case Gerin, Tolmezzo, UD, FVG, 33028, Italia	46.4083491	13.0112364	0.001
15709075	Via della Cooperativa, Case Gerin, Tolmezzo, UD, FVG, 33028, Italia	46.4058451	13.0126316	0.001
16163846	Piazza Venti Settembre, Case Gerin, Tolmezzo, UD, FVG, 33028, Italia	46.4060708	13.0150183	0.001
16378808	Via Quintiliano Ermacora, Case Gerin, Tolmezzo, UD, FVG, 33028, Italia	46.4065219	13.015064	0.001
15614745	Piazza Giuseppe Mazzini, Case Gerin, Tolmezzo, UD, FVG, 33028, Italia	46.4044173	13.0170731	0.001
15492514	Via del Fante, Case Gerin, Tolmezzo, UD, FVG, 33028, Italia	46.4040659	13.017958	0.001
15412335	Via Gio Batta Morgagni, Case Gerin, Tolmezzo, UD, FVG, 33028, Italia	46.40593	13.0098153	0.001
15464152	Via Carnia Libera 1944, Case Gerin, Tolmezzo, UD, FVG, 33028, Italia	46.4053051	13.0115475	0.001
16240588	Via Clemente Lequio, Case Gerin, Tolmezzo, UD, FVG, 33028, Italia	46.4052237	13.0142082	0.001
15451234	Via Cesare Battisti, Case Gerin, Tolmezzo, UD, FVG, 33028, Italia	46.4044247	13.0148788	0.001
15450506	Via Divisione Garibaldi, Case Gerin, Tolmezzo, UD, FVG, 33028, Italia	46.4048133	13.0127867	0.001
16240622	Viale Aldo Moro, Case Gerin, Tolmezzo, UD, FVG, 33028, Italia	46.4017576	13.0137257	0.001
15532895	Via Giacomo Matteotti, Case Gerin, Tolmezzo, UD, FVG, 33028, Italia	46.4073251	13.0130928	0.001
67639271	Viale Aldo Moro, Case Gerin, Tolmezzo, UD, FVG, 33028, Italia	46.4000476	13.009176563611	0.001
15465141	Via Porta di Sotto, Case Gerin, Tolmezzo, UD, FVG, 33028, Italia	46.4034555	13.0171053	0.001
15492438	Via Paluzza, Case Gerin, Tolmezzo, UD, FVG, 33028, Italia	46.4094626	13.0102493	0.001
16496023	Via Antonio Gramsci, Case Gerin, Tolmezzo, UD, FVG, 33028, Italia	46.401484	13.0117782	0.001
16164462	Via Renato Del Din, Case Gerin, Tolmezzo, UD, FVG, 33028, Italia	46.4050868	13.0154745	0.001
48565051	Simon's Pub, Via Rivoli, Osoppo, UD, FVG, Italia	46.2207213	13.0675475	0.001
15420735	Osteria Alpina, Via da Vile, Cercivento, UD, FVG, 33026, Italia	46.5279051	12.9823993	0.001
36731859	Martins, Via Caduti Due Maggio, Applis, Ovaro, UD, FVG, 33025, Italia	46.4820152	12.8660111	0.001
25133473	La Pieve, Via Cella, Applis, Ovaro, UD, FVG, 33025, Italia	46.478286	12.8619459	0.001
69141540	Cooperativa, Via Muina, Amboluzza di sopra, Ovaro, UD, FVG, 33025, Italia	46.4588344	12.8640665647251	0.001
35121332	Via Caduti Due Maggio, Applis, Ovaro, UD, FVG, 33025, Italia	46.4853166	12.8651265	0.001
16230952	Via Redentore, Trasaghis, UD, FVG, Italia	46.3169998	13.0532251	0.001
26326860	Via Roma, Località Centro Sportivo, Borgo Siega di Lungis, Socchieve, UD, FVG, 33021, Italia	46.4034872	12.8234172	0.001
15354271	Piazza Primo Maggio, Trasaghis, UD, FVG, Italia	46.3173258	13.0538849	0.001
