42068762	Via dei Cres, Sdricca di Sopra, Manzano, UD, FVG, 33044, Italia	46.0186937	13.3885375	0.001
21308535	Via Arturo Malignani, Casali Chiasalp, Moimacco, UD, FVG, 33047, Italia	46.0929329	13.3677624	0.001
20483771	Via Malina, Casali Chiasalp, Moimacco, UD, FVG, 33040, Italia	46.0904905	13.3767666	0.001
45017872	Via Carraria, Borgo Brossana, Madonna delle Grazie, Cividale del Friuli, UD, FVG, 33043, Italia	46.0919024	13.4436648	0.001
43423435	Piazzetta San Biagio, Borgo di Ponte, Località Pramalignano, Cividale del Friuli, UD, FVG, 33043, Italia	46.0941049	13.4340144	0.001
40545084	Via Alcide De Gasperi, Borgo di Ponte, Località Pramalignano, Cividale del Friuli, UD, FVG, 33043, Italia	46.091219	13.427772	0.001
41187268	Via Ermes da Colloredo, Borgo di Ponte, Località Pramalignano, Cividale del Friuli, UD, FVG, 33043, Italia	46.0916295	13.4288394	0.001
45930746	Via del Paradiso, Borgo Brossana, Madonna delle Grazie, Cividale del Friuli, UD, FVG, 33043, Italia	46.0929125	13.4424072	0.001
