34148602	Largo Mario de Appollonia, Località Case Pepe, Varmo, UD, FVG, Italia	45.900636	13.0180166	0.001
48326850	Piazza della Fontana, Località Comugnis, Camino al Tagliamento, UD, FVG, Italia	45.9104222	12.9367895	0.001
13728414	SP1, San Vito al Tagliamento, PN, FVG, 33078, Italia	45.9178294	12.8575212	0.001
22443722	Via Giuseppe Gastaldis, San Vito al Tagliamento, PN, FVG, 33078, Italia	45.9165463	12.8636619	0.001
22439836	Piazza Quattro novembre, San Vito al Tagliamento, PN, FVG, 33078, Italia	45.9164003	12.8747146	0.001
5560703	Piazza Italia, Località Turridetta, Località Comunale, Casarsa della Delizia, PN, FVG, 33072, Italia	45.9557713	12.8436187	0.001
