67086779	Farmacia Comunale, Via Aulo Manlio, Crosara, Monfalcone, GO, FVG, 34074, Italia	45.8036342	13.5250698644385	0.001
4669425	Farmacia Comunale n. 1 Monfalcone, 53, Via Aquileia, Crosara, Monfalcone, GO, FVG, 34074, Italia	45.8081806	13.5214735	0.001
4448323	Farmacia San Nicolò, Via Primo Maggio, San Polo, Monfalcone, GO, FVG, 34074, Italia	45.8129236	13.5164473	0.001
4658447	Farmacia Sant'Antonio, 52, Via Roma, Località Pradiziolo, Cervignano del Friuli, UD, FVG, 33052, Italia	45.8224647	13.337326	0.001
4679769	Farmacia Lovisoni, 27, Piazza Unità d'Italia, Località Pradiziolo, Cervignano del Friuli, UD, FVG, 33052, Italia	45.8213494	13.3328946	0.001
48333150	Farmacia Comunale, 7, Via Monfalcone, Località Pradiziolo, Cervignano del Friuli, UD, FVG, 33052, Italia	45.8133495	13.3499041	0.001
4450946	Farmacia Alla Stazione, Via Brigata Trieste, Ronchi dei Legionari, GO, FVG, 34077, Italia	45.8314626	13.5050904	0.001
4660033	Farmacia Al Lago, 13, Via Roma / Rimska ulica, Lago di Doberdò / Jezero, Doberdò del Lago / Doberdob, GO, FVG, 34070, Italia	45.8447836	13.5403878	0.001
68872778	Via Giacomo Matteotti, San Pier d'Isonzo, GO, FVG, 34075, Italia	45.8485755	13.4578298360979	0.001
