44011779	Farmacia Bechi, 12, Piazza Daniele Manin, Sacile, PN, FVG, 33077, Italia	45.9547	12.50273	0.001
46642228	Farmacia Esculapio Dottor Romor Gino, 21, Via Giuseppe Garibaldi, Sacile, PN, FVG, 33077, Italia	45.95366	12.50048	0.001
18965041	Farmacia Comunale, 4, Via Ettoreo, Sacile, PN, FVG, 33077, Italia	45.9560978	12.5008333	0.001
18827738	4, Via Ettoreo, Sacile, PN, FVG, 33077, Italia	45.9584272	12.5003793	0.001
45132446	Farmacia alla Stazione, 9, Via Giuseppe Bertolissi, Sacile, PN, FVG, 33077, Italia	45.94745	12.50012	0.001
16846896	Bonin dr. Attilio, Via Luigi Cadorna, Lama di Som, Caneva, PN, FVG, 33070, Italia	45.9841662	12.4764247	0.001
21254967	Via Enrico Chiaradia, Lama di Som, Caneva, PN, FVG, Italia	45.9683862	12.4478927	0.001
