8568977	Arma dei Carabinieri, Strada per Basovizza, Cattinara / Katinara, Trieste, TS, FVG, 34018, Italia	45.6405647	13.8579001	0.001
8110507	Guardia di Finanza, SS14, Cattinara / Katinara, Trieste, TS, FVG, 34018, Italia	45.6406128	13.8596563	0.001
69270179	Comando Regionale Carabinieri, Via dell'Istria, San Giacomo / Sveti Jakob, Trieste, TS, FVG, 34137, Italia	45.64055995	13.782933058397	0.001
68397327	Polizia di Stato, Via Pietro Mascagni, Coloncovez / Kolonkovec, Trieste, TS, FVG, 34147, Italia	45.62228485	13.8021145590509	0.001
9712849	Via Carlo Forlanini, Melara, Trieste, TS, FVG, 34149, Italia	45.640441	13.8231555	0.001
16116878	Guardia di Finanza, 6, Via delle Fiamme Gialle, Campo Marzio, Trieste, TS, FVG, 34123, Italia	45.6390456	13.7619883	0.001
67681463	Via Don Pietro Cenati, Borgo San Sergio, Trieste, TS, FVG, 34148, Italia	45.61948895	13.8232365956756	0.001
924420	Via Gabriele D'Annunzio, Muggia, TS, FVG, 34015, Italia	45.6019758	13.7667073	0.001
69421250	Dolina, San Dorligo della Valle / Dolina, TS, FVG, 34018, Italia	45.6007693	13.8589633	0.001
