15578411	Palmanova, Piazza Roma, Palmanova, UD, FVG, 33057, Italia	45.9068322	13.2965171	0.17714730829695
1248851	Cormòns, Via Filanda, La Boatina, Cormòns, GO, FVG, 34071, Italia	45.9574803	13.4614463	0.093055316314571
4465726	Santa Maria la Longa, Via Zompicco, Santa Maria la Longa, UD, FVG, 33057, Italia	45.9330617	13.2877533	0.07374459342567
4453381	Santo Stefano Udinese, Via della Stazione, Santa Maria la Longa, UD, FVG, Italia	45.953641	13.2749904	0.046527658157285
1280299	Mossa, Via Stazione, Codelli, Mossa, GO, FVG, Italia	45.9350699	13.5474919	0.001
16397183	Capriva, Via Dante Alighieri, Capriva del Friuli, Russiz di Sopra, Capriva del Friuli, GO, FVG, Italia	45.9388183	13.517559	0.001
