51942113	Via Cairoli, Sopramare, Levanto, SP, LIG, 19015, Italia	44.1691575	9.6103124	0.001
18047030	Piazza Cavour, Sopramare, Levanto, SP, LIG, 19015, Italia	44.1700106	9.6126509	0.001
50314873	Corso Italia, Sopramare, Levanto, SP, LIG, 19015, Italia	44.1691926	9.6101977	0.001
24265770	Via Guglielmo Marconi, Sopramare, Levanto, SP, LIG, 19015, Italia	44.1698235	9.611696	0.001
39538285	Carispezia, Strada Provinciale Castagnole - Framura, Foce del Prato, Framura, SP, LIG, 19011, Italia	44.2089815	9.5546406	0.001
44632173	Via Fegina, Monterosso al Mare, SP, LIG, 19016, Italia	44.1457139	9.6489664	0.001
