2601562296	Via Natale Gallino, Municipio V Val Polcevera, Genova, GE, LIG, 16164, Italia	44.5077266	8.9123981	0.001
42047488	Via Campomorone, Municipio V Val Polcevera, Genova, GE, LIG, 16164, Italia	44.5009668	8.903817	0.001
31728815	Piazzetta Don Raffaele Storace, Gazzo, Busalla, GE, LIG, 16012, Italia	44.5742322	8.9438906	0.001
52738814	Via Alla Chiesa, Prelo, Savignone, GE, LIG, 16015, Italia	44.5485034	8.9756676	0.001
51210700	Panchina della Lincia, Allacciamento Prelo Sentiero Cerisola-Gualdrà, Prelo, Savignone, GE, LIG, 16015, Italia	44.5415232	8.9715775	0.001
50744768	Sentiero FIE doppio rombo Giallo (Casella-Crocefieschi), Prelo, Savignone, GE, LIG, 16015, Italia	44.5559653	9.0082395	0.001
