37667895	Corso degli Inglesi, San Pietro, Sanremo, IM, LIG, 1838, Italia	43.815029	7.7720626	0.001
17476388	Piazza Eroi, Pampara, Taggia, IM, LIG, 18018, Italia	43.8609791	7.8532092	0.001
40143349	Via del Piano, Pampara, Taggia, IM, LIG, 18018, Italia	43.8465855	7.856688	0.001
17617288	Piazza IV Novembre, Pampara, Taggia, IM, LIG, 18018, Italia	43.8635619	7.8529738	0.001
18649084	Lungo Argentina Domenico Fornara, Pampara, Taggia, IM, LIG, 18018, Italia	43.8603334	7.8542686	0.001
44818255	Via Aurelia, Donego, Santo Stefano al Mare, IM, LIG, 18015, Italia	43.8388014	7.8912548	0.001
6583075	Corso Italia, Case Bertuzzo, Ceriana, IM, LIG, Italia	43.8802456	7.7738649	0.001
6579217	Asterix, Corso Italia, Case Bertuzzo, Ceriana, IM, LIG, Italia	43.8795661	7.7743878	0.001
