86589937	Scuola Artistico, Via Giobatta Ghio, Sanpierdicanne, Chiavari, GE, LIG, 16043, Italia	44.3192059	9.32548375490957	0.001
86703253	Viale Enrico Millo, Sanpierdicanne, Chiavari, GE, LIG, 16043, Italia	44.3201031	9.32299907793984	0.001
86227750	Via Sant'Antonio, Sanpierdicanne, Chiavari, GE, LIG, 16043, Italia	44.3171634	9.3236626800926	0.001
106403150	Via Raggio, Sanpierdicanne, Chiavari, GE, LIG, 16043, Italia	44.3186817	9.32370443037717	0.001
105842408	Scuola Pubblicitaria, Via Giobatta Ghio, Sanpierdicanne, Chiavari, GE, LIG, 16043, Italia	44.3189205	9.32486944076005	0.001
107080840	Istituto Tecnico Statale di Chiavari - Succursale, 15A, Via Castagnola, Sanpierdicanne, Chiavari, GE, LIG, 16043, Italia	44.3212047	9.3216065968674	0.001
87869043	Istituto Maria Luigia, Via Pianello, Sanpierdicanne, Chiavari, GE, LIG, 16043, Italia	44.32354655	9.32263276096231	0.001
