24249869	Via Provinciale Monesi, Case Pian del Lago, Mendatica, IM, LIG, 18025, Italia	44.0850291	7.7845325	0.001
28796155	Via Piano, Piano, Mendatica, IM, LIG, 18025, Italia	44.0776327	7.8075829	0.001
28314019	Piazza Roma, Mendatica, Piano, Mendatica, IM, LIG, 18025, Italia	44.0765857	7.8058402	0.001
28685990	Via Stabbi, Mendatica, Piano, Mendatica, IM, LIG, 18025, Italia	44.076246	7.805026	0.001
27824598	SP3, San Apollonia, Cosio di Arroscia, IM, LIG, 18025, Italia	44.0806894	7.8040204	0.001
7289696	Loc. Fontane, Via Sant'Anna, Montegrosso Pian Latte, IM, LIG, 18025, Italia	44.049208	7.8052927	0.001
