111632007	Ospedale San Carlo, Piazzale Efisio Gianasso, Municipio VII Ponente, Genova, GE, LIG, 16158, Italia	44.43018965	8.74585321772093	0.001
21706910	Pronto Soccorso, Piazzale Efisio Gianasso, Municipio VII Ponente, Genova, GE, LIG, 16158, Italia	44.4300105	8.7452734	0.001
77686892	La Colletta, Via del Giappone, Crocetta, Arenzano, GE, LIG, 16011, Italia	44.4003175	8.66366154161857	0.001
140983679	Via Molino, Rossiglione Inferiore, La Pessina, Rossiglione, GE, LIG, 16013, Italia	44.56176115	8.67084247070117	0.001
138807277	Via Roma, Rossiglione Inferiore, La Pessina, Rossiglione, GE, LIG, 16013, Italia	44.56175765	8.6707116951295	0.001
138348755	Via Angelo Serafino Rossi, Campo Ligure, GE, LIG, 16013, Italia	44.53592575	8.6994256147092	0.001
5547214	Opera Pia San Michele Arcangelo, Via Angelo Serafino Rossi, Campo Ligure, GE, LIG, 16013, Italia	44.5358519	8.6994053	0.001
