22564692	Biblioteca dell'Istituto Storico della Resistenza e dell'Et Contemporanea, Piazza Ricci, Porto Maurizio, Imperia, IM, LIG, 18100, Italia	43.8762388	8.0136054	0.001
23728964	Biblioteca dell'Istituto Magistrale Statale Amoretti, Via San Sebastiano, Porto Maurizio, Imperia, IM, LIG, 18100, Italia	43.8918683	8.0425317	0.001
24119209	Biblioteca del Gruppo Speleologico Imperiese C.A.I., SS1 Aurelia, Imperia, IM, LIG, 18100, Italia	43.8888662	8.0453569	0.001
23997359	Biblioteca Civica Leonardo Lagorio, Piazza Edmondo De Amicis, Porto Maurizio, Imperia, IM, LIG, 18100, Italia	43.8879982	8.0405957	0.001
47339236	Parrocchia S. Tommaso, Piazza San Tommaso, Magliani, Dolcedo, IM, LIG, 18020, Italia	43.9073061	7.9510202	0.001
48487389	Biblioteca comunale  Il geco sapiente, 12, Via Dottor Raineri, Costarainera, IM, LIG, 18017, Italia	43.8551772	7.9405652	0.001
