15744272	Pub Al Cantiere, Via Sant'Alberto, Municipio VI Medio Ponente, Genova, GE, LIG, 16155, Italia	44.4275089	8.8387736	0.101
20350525	Big Ben Pub, 108 rosso, Via Nicolò Daste, Municipio II Centro Ovest, Genova, GE, LIG, 16151, Italia	44.4121508	8.8906642	0.101
6067519	irish pub Molly Malone, Via dei Reggio, Municipio VII Ponente, Genova, GE, LIG, 16155, Italia	44.4270276	8.826559	0.101
19237930	Il Gallo Brillo, Via Alfredo Catalani, Municipio VI Medio Ponente, Genova, GE, LIG, 16154, Italia	44.4241589	8.8464557	0.001
1334199	Beer Corner, Via Pionieri e Aviatori d'Italia, Municipio VI Medio Ponente, Genova, GE, LIG, 16154, Italia	44.4154862	8.8376263	0.001
5715944	Tumbler, Via Ramiro Ginocchio, Municipio VI Medio Ponente, Genova, GE, LIG, 16154, Italia	44.4240635	8.8525596	0.001
