215003	Genova Sampierdarena, Via Eustachio Degola, Municipio II Centro Ovest, Genova, GE, LIG, 16151, Italia	44.4135258	8.8867733	0.32976304828016
220724	Genova Cornigliano, Piazza Ernesto Savio, Municipio VI Medio Ponente, Genova, GE, LIG, 16152, Italia	44.4147497	8.8650115	0.18177847009039
10423376	Genova Pegli, Via Martiri della Libertà, Municipio VII Ponente, Genova, GE, LIG, 16156, Italia	44.4262178	8.8169327	0.16679990974024
616630	Genova Pra, Piazzale 334° Brigata Est-Sap, Le lavatrici, Pra', Genova, GE, LIG, 15157, Italia	44.4253621	8.7891659	0.154561534822
863070	Genova Borzoli, Piazza Don Carlo Bruzzone, Municipio VI Medio Ponente, Genova, GE, LIG, 16153, Italia	44.4346933	8.8665563	0.14748918685134
8530570	Genova Rivarolo, Via alla Stazione di Rivarolo, Municipio V Val Polcevera, Genova, GE, LIG, 16159, Italia	44.4361132	8.8910333	0.13958297447186
10331263	Genova Sestri Ponente - Aeroporto, Via Giacomo Puccini, Municipio VI Medio Ponente, Genova, GE, LIG, 16154, Italia	44.4223542	8.8480524	0.001
