18189063	Via Francesco Petrarca, La Cinella, Umbertide, PG, UMB, 06019, Italia	43.2634026	12.3900216	0.001
16041199	Farmacia Burelli, Via Ruggero Cane Ranieri, Umbertide, PG, UMB, 06019, Italia	43.3047664	12.3319504	0.001
17281949	Farmacia Comunale 2, Via del Vignola, Umbertide, PG, UMB, 06019, Italia	43.3012798	12.3416271	0.001
19387056	Farmacia Comunale 1, Piazza Giacomo Matteotti, Umbertide, PG, UMB, 06019, Italia	43.3064896	12.3270429	0.001
45084329	Farmacia Cima, 25, Strada Provinciale 104 di Morra, Città di Castello, PG, UMB, 060100, Italia	43.3744958	12.2009786	0.001
6587076	Via della Fratta, Città di Castello, PG, UMB, 06018, Italia	43.3777207	12.2581835	0.001
19083383	Farmacia S. Bartolomeo, Via del Santuario, Castel Rigone, Passignano sul Trasimeno, PG, UMB, 06065, Italia	43.1983348	12.2236977	0.001
