31056702	Bar la Cupola, 10, Piazza del Lino, Borgo Ticino, Pavia, PV, LOM, 27100, Italia	45.1848402	9.1557059	0.101
31988236	Bar Vittoria 2, 2, Piazza della Vittoria, Borgo Ticino, Pavia, PV, LOM, 27100, Italia	45.1857774	9.1547187	0.101
10333069	Pub del Broletto, Piazza della Vittoria, Borgo Ticino, Pavia, PV, LOM, 27100, Italia	45.1848286	9.1540772	0.001
8328860	Radio Aut (ARCI), Viale Lungoticino Sforza, Borgo Ticino, Pavia, PV, LOM, 27100, Italia	45.1814194	9.154654	0.001
37337790	Osteria Sottovento, 8, Via Siro Comi, Borgo Ticino, Pavia, PV, LOM, 27100, Italia	45.1834492	9.1554937	0.001
5776444	Corso Famiglia Cairoli, Città Giardino, Pavia, PV, LOM, 27100, Italia	45.1896593	9.1614156	0.001
15534951	Via Severino Boezio, Ponte di Pietra, Pavia, PV, LOM, 27100, Italia	45.1894076	9.1513625	0.001
5777547	Viale Partigiani, San Giovannino, Pavia, PV, LOM, 27100, Italia	45.1820591	9.1731947	0.001
