50416053	Il Forno - Pra dell'Oro, Alpe Cagarozza, Sorico, CO, LOM, Italia	46.2071548	9.4175937	0.001
49272520	Strada Statale 36 del lago di Como e dello Spluga, Verceia, Comunità Montana della Valchiavenna, SO, LOM, Italia	46.2017972	9.453617	0.001
48325114	Via al Piano, Coloredo, Gordona, Comunità Montana della Valchiavenna, SO, LOM, 23027, Italia	46.2745973	9.3772939	0.001
13470525	Trivulzia, Samolaco, Comunità Montana della Valchiavenna, SO, LOM, Italia	46.2146045	9.439749	0.001
38365691	Via Val Di Mello, Val Masino, Comunità Montana della Valtellina di Morbegno, SO, LOM, Italia	46.2441351	9.6348346	0.001
48623176	Strada Statale 36 del lago di Como e dello Spluga, Mezzolpiano, Novate Mezzola, Comunità Montana della Valchiavenna, SO, LOM, Italia	46.212023	9.4463025	0.001
18872889	Via Roma, Val Masino, Comunità Montana della Valtellina di Morbegno, SO, LOM, Italia	46.2179385	9.6391307	0.001
