17098948	Via Giuseppe Mazzini, Tirano, Comunità Montana della Valtellina di Tirano, SO, LOM, 23037, Italia	46.2157316	10.1672835	0.001
16264761	Buffet della Stazione, Via Giuseppe Mazzini, Tirano, Comunità Montana della Valtellina di Tirano, SO, LOM, 23037, Italia	46.215419	10.1674501	0.001
16054342	Via XX Settembre, Tirano, Comunità Montana della Valtellina di Tirano, SO, LOM, 23037, Italia	46.2158869	10.1750735	0.001
18500270	Strada Statale dello Stelvio, Tirano, Comunità Montana della Valtellina di Tirano, SO, LOM, 23037, Italia	46.2178195	10.1568936	0.001
16265142	Bar Il Glicine, Via San Giacomo, Tirano, Comunità Montana della Valtellina di Tirano, SO, LOM, 23037, Italia	46.2168602	10.1721443	0.001
50438586	Via 11 Febbraio, Ponte di Legno, Comunità montana della valle Camonica, BS, LOM, 25056, Italia	46.2591644	10.5083289	0.001
17545912	Corso Trieste, Ponte di Legno, Comunità montana della valle Camonica, BS, LOM, 25056, Italia	46.2611047	10.5104937	0.001
