24347530	Cafe Pierrot, Piazza del Comune, Centro Storico, Cremona, CR, LOM, 26100, Italia	45.1339147	10.0249006	0.101
23696176	Gelateria XXV Aprile, Piazza Roma, Centro Storico, Cremona, CR, LOM, 26100, Italia	45.134934	10.0228281	0.001
24118064	Galleria Kennedy, Centro Storico, Cremona, CR, LOM, 26100, Italia	45.1374494	10.0190505	0.001
27236905	La Combricola, Via Boschetto, Boschetto, Cremona, CR, LOM, 26100, Italia	45.1645239	10.0276769	0.001
18283702	Corso Giuseppe Garibaldi, Zona Castello, Cremona, CR, LOM, 26100, Italia	45.1375858	10.0182803	0.001
7641849	Pasticceria Bar San Remo, Via Mantova, Vecchia Dogana, Cremona, CR, LOM, 26100, Italia	45.1371738	10.0326016	0.001
23484978	Gelateria Principe, Viale Trento e Trieste, Vecchia Dogana, Cremona, CR, LOM, 26100, Italia	45.137179	10.0309378	0.001
22778753	Flora, Piazza Stradivari, Centro Storico, Cremona, CR, LOM, 26100, Italia	45.133266	10.0228236	0.001
