14403088	Via Crocifissa di Rosa, Circoscrizione Brescia Centro, Brescia, BS, LOM, 25128, Italia	45.5517518	10.2274993	0.001
113749859	Piazzale Camillo Golgi, Circoscrizione Brescia Centro, Brescia, BS, LOM, 25128, Italia	45.5518265	10.2282420297861	0.001
198111929	Doctor Carwash, Via Filippo Corridoni, Circoscrizione Brescia Nord, Brescia, BS, LOM, 25128, Italia	45.55943125	10.2129989	0.001
112053231	Via delle Bettole, Circoscrizione Brescia Est, Brescia, BS, LOM, 25129, Italia	45.50017945	10.2642985131811	0.001
104894436	Via Giuseppe Mazzini, Rezzato, BS, LOM, 25135, Italia	45.5143138	10.30383615	0.001
16045303	Via Le Brede, Bovezzo, Comunità montana della valle Trompia, BS, LOM, 25136, Italia	45.591661	10.2337738	0.001
16760624	Via dei Prati, Bovezzo, Comunità montana della valle Trompia, BS, LOM, 25136, Italia	45.5907035	10.2342236	0.001
121428115	Autolavaggio Arcobaleno, Via Don Filippo Bassi, Nave, Comunità montana della valle Trompia, BS, LOM, 25073, Italia	45.58502425	10.2601455941572	0.001
