20621045	Cinema Teatro Gloria, 1, Via San Pietro, Montichiari, BS, LOM, 25018, Italia	45.4134115	10.3909049	0.101
33336626	Cinema San Filippo Neri, Via Giuseppe Borghini, Collebeato, BS, LOM, 25062, Italia	45.5845394	10.2141996	0.101
6517449	Sociale, Corsia Gambero, Circoscrizione Brescia Centro, Brescia, BS, LOM, 25122, Italia	45.5359266	10.2204787	0.001
6896870	Astra, Via Dieci Giornate, Circoscrizione Brescia Centro, Brescia, BS, LOM, 25122, Italia	45.5391742	10.2202902	0.001
6498884	Multisala Wiz, 31, Viale Italia, Circoscrizione Brescia Centro, Brescia, BS, LOM, 25126, Italia	45.534661	10.2077766	0.001
6514134	Moretto, Piazzetta Sant'Alessandro, Circoscrizione Brescia Centro, Brescia, BS, LOM, 25121, Italia	45.5354417	10.2231163	0.001
17795680	Nuovo Eden, 9, Via Nino Bixio, Circoscrizione Brescia Centro, Brescia, BS, LOM, 25122, Italia	45.544402	10.2173856	0.001
