50785609	Key Clinic, 176, Viale Antonio Gramsci, Sesto San Giovanni, MI, LOM, 20099, Italia	45.5392779	9.2362251	0.101
50651435	Casa di Cura San Camillo, 5, Via Mauro Macchi, Zona 2, Milano, MI, LOM, 20124, Italia	45.4818539	9.2044739	0.001
24998180	Centro Medicina Biologica - CEMBIO, 6, Via Giuseppe Ferrari, Sobborghi, Cederna, Monza, MB, LOM, 20900, Italia	45.5819493	9.2896041	0.001
38925937	Centro Fisioterapico Sinthesis, 9, Via Giuseppe Sirtori, San Gottardo, San Biagio, Monza, MB, LOM, 20900, Italia	45.5901758	9.2626144	0.001
117653351	CAM, 1, Via Martiri delle Foibe, Rondò dei Pini, Cazzaniga, Monza, MB, LOM, 20900, Italia	45.59533205	9.25069620201511	0.001
25769344	Politerapico Monza, 87/B, Via Gerolamo Borgazzi, San Lorenzo, San Giuseppe, Monza, MB, LOM, 20900, Italia	45.5664045	9.2619437	0.001
24674354	Centro Analisi Monza, 9, Via Giuseppe Missori, Centro, Monza, MB, LOM, 20900, Italia	45.5848329	9.2710451	0.001
