51229019	Studio dentistico dottor Stefano Alicchio, Piazza Vittorio Veneto, Magenta, MI, LOM, 20013, Italia	45.4654661	8.8860854	0.101
37592493	GTO odontotecnica, 99, Via Giuseppe Garibaldi, Canegrate, MI, LOM, 20010, Italia	45.5639242	8.9147859	0.001
2601861429	Easydental, Via Giovanni Brocca, Magenta, MI, LOM, 20013, Italia	45.4677526	8.8811685	0.001
50491619	Via fratelli Sanchioli, Magenta, MI, LOM, 20013, Italia	45.4646911	8.8907584	0.001
40931095	Michele dr.Magni odontoiatra, Via Giuseppe Fornaroli, Magenta, MI, LOM, 20013, Italia	45.4675287	8.88613	0.001
24622256	Azzurro Med, Via don Pompeo Beretta, Magenta, MI, LOM, 20013, Italia	45.464579	8.8790759	0.001
39450635	Odontoiatria medica B.L. S.r.l., Via Giuseppe Fornaroli, Magenta, MI, LOM, 20013, Italia	45.467973	8.886377	0.001
41066569	Eugenio Baitini, 6, Via Luciano Manara, Cerro Maggiore, MI, LOM, 20023, Italia	45.5759331	8.982805	0.001
