13860972	Habilita San Marco, Piazzale della Repubblica, Città Alta, Bergamo, BG, LOM, 24100, Italia	45.6984192	9.6671085	0.001
144516081	ASL Bergamo, Via Borgo Palazzo, Celadina, Bergamo, BG, LOM, 24125, Italia	45.6933899	9.69813471193179	0.001
4033408	Centro trasfusionale - AVIS, Via Leonardo da Vinci, Monterosso, Bergamo, BG, LOM, 24124, Italia	45.7181767	9.6847791	0.001
8641000	Athaena, 3, Via Pietro Ronzoni, San Tommaso, Bergamo, BG, LOM, 24128, Italia	45.6902456	9.6587493	0.001
94364844	Ambulatorio, Via Chiesa, Luzzana, BG, LOM, Italia	45.71601865	9.88062208187251	0.001
10093398	Il Punto Medico Sportivo, Via Daste e Spalenga, Gorle, BG, LOM, 24125, Italia	45.6969264	9.7108574	0.001
4749778	Studio Medico, Viale Trieste, Azzano San Paolo, BG, LOM, 24052, Italia	45.6608755	9.6744859	0.001
