52548953	Centro medico Torri Bianche, Via Torri Bianche, Quartiere Torri Bianche, Vimercate, MB, LOM, 20871, Italia	45.600745	9.3609792	0.001
16086894	Via Alessandro Manzoni, Cascina Pila, Missaglia, LC, LOM, 23873, Italia	45.6892052	9.3531621	0.001
49784237	Strada Provinciale ex Strada Statale 342 Briantea, Cisano Bergamasco, BG, LOM, 24034, Italia	45.7394734	9.4778057	0.001
46797197	Piazza della Vittoria, Paderno d'Adda, LC, LOM, 23877, Italia	45.6813628	9.4450529	0.001
19148663	Via dei Tre Re, Verderio Inferiore, Verderio, LC, LOM, 23879, Italia	45.6625008	9.4360701	0.001
19519291	0, Via Fontanile, Verderio Superiore, Verderio, LC, LOM, 23879, Italia	45.669391	9.4401283	0.001
