4287461	Via del Foscagno, Livigno, Comunità Montana Alta Valtellina, SO, LOM, Italia	46.5265615	10.1761447	0.001
33168482	Via Sant Antonio, Valfurva, Comunità Montana Alta Valtellina, SO, LOM, 23032, Italia	46.4579944	10.4258649	0.001
4242831	Via Fraccari, Valdisotto, Comunità Montana Alta Valtellina, SO, LOM, Italia	46.4340692	10.3577259	0.001
14428495	Via Roma, Valdisotto, Comunità Montana Alta Valtellina, SO, LOM, Italia	46.4386132	10.3566013	0.001
4275246	Piazza Fonte Levissima, Valdisotto, Comunità Montana Alta Valtellina, SO, LOM, Italia	46.4284606	10.3551651	0.001
2602465467	SP delle Motte di Oga, Valdisotto, Comunità Montana Alta Valtellina, SO, LOM, Italia	46.4622305	10.3452517837291	0.001
