12668959	Sgarella, Via Umberto Olevano, Città Giardino, Pavia, PV, LOM, 27100, Italia	45.1998573	9.1592522	0.001
17640299	Gardini, Via Mirabello, Mirabello, Pavia, PV, LOM, 27100, Italia	45.217094	9.1656337	0.001
90482136	AMA Rozzano Spa, Viale Don Angelo Lonni, Rozzano, MI, LOM, 20089, Italia	45.38027695	9.15461864999999	0.001
14614983	Farmacia comunale, Via dei Garofani, Pontesesto, Rozzano, MI, LOM, 20089, Italia	45.3849477	9.1579871	0.001
17923983	Via Roma, Basiglio, MI, LOM, 20089, Italia	45.3494217	9.1643133	0.001
16970212	Farmacia Remotti, Via Alessandro Manzoni, Basiglio, MI, LOM, 20089, Italia	45.3593792	9.1577577	0.001
9440965	Via Carlo Alberto Dalla Chiesa, Casarile, MI, LOM, 20084, Italia	45.3196902	9.1013683	0.001
50376994	Farmacia Santa Corinna, Via 25 aprile, Noviglio, MI, LOM, 20082, Italia	45.3381153	9.0941285	0.001
10286822	Vicolo San Michele, Certosa di Pavia, PV, LOM, 27012, Italia	45.2529243	9.1299394	0.001
