17973678	Via Regina, Sorico, CO, LOM, 23823, Italia	46.1723058	9.3815103	0.001
46715097	Farmacia Piazza, Via Case Sparse, Domaso, CO, LOM, 22013, Italia	46.1503743	9.3270124	0.001
18978563	Via Case Sparse, Domaso, CO, LOM, 22013, Italia	46.1503247	9.3271993	0.001
21685825	Vecchia Menaggio, Via IV Novembre, Monti di Pastura, Menaggio, CO, LOM, 22017, Italia	46.0193278	9.237365	0.001
32603430	Farmacia Santa Rita, SP72, Colico, LC, LOM, 23823, Italia	46.1329981	9.3660884	0.001
40837178	Via Giovanni Polvani, Varenna, LC, LOM, 23829, Italia	46.0102659	9.2838334	0.001
41048168	Strada Provinciale 67 Alta Valsassina e Valvarrone, Casargo, LC, LOM, 23831, Italia	46.038264	9.3880986	0.001
14185342	Via Statale Regina, Gera Lario, CO, LOM, 23823, Italia	46.1696406	9.3710199	0.001
