6945794	Via delle Forze Armate, Zona 7, Milano, MI, LOM, 20153, Italia	45.4610494	9.0920354	0.001
7093127	Farmacia Comunale, Via Maffeo Bagarotti, Zona 7, Milano, MI, LOM, 20153, Italia	45.4564182	9.0914563	0.001
18935305	Piazza Anita Garibaldi, Zona 7, Milano, MI, LOM, 20153, Italia	45.4633147	9.0872841	0.001
7131760	Via delle Forze Armate, Baggio, Milano, MI, LOM, 20153, Italia	45.460219	9.0979494	0.001
7486186	Via Tommaso Edison, Settimo Milanese, MI, LOM, 20019, Italia	45.4725058	9.0608007	0.001
7474231	Farmacia Culzoni SNC del dott. Eugenio Culzoni, Via Antonio Bianchi, Settimo Milanese, MI, LOM, 20019, Italia	45.4873556	9.0532696	0.001
