5960402	Carabinieri, 10, Piazza della Cittadella, Città Alta, Bergamo, BG, LOM, 24129, Italia	45.7054791	9.659438	0.001
91177166	Guardia di Finanza, Via Angelo Cassina, Borgo Palazzo, Bergamo, BG, LOM, 24124, Italia	45.69781245	9.68274264006079	0.001
44896184	Circoscrizione 1 e Polizia Locale, Via Alessandro Furietti, Campagnola, Bergamo, BG, LOM, 24126, Italia	45.6824519	9.6760162	0.001
72646704	Caserma Carabinieri Bergamo, Via Monviso, Boccaleone, Bergamo, BG, LOM, 24125, Italia	45.69657945	9.69336531468645	0.001
77139648	Polizia Locale, Via Francesco Coghetti, San Tommaso, Bergamo, BG, LOM, 24128, Italia	45.69210635	9.65612035501999	0.001
74059315	Questura, Via Alessandro Noli, Borgo Palazzo, Bergamo, BG, LOM, 24124, Italia	45.70153305	9.68153214769934	0.001
