46990689	Guardia di Finanza - Comando provinciale, Viale delle Rimembranze, Lodi, LO, LOM, 26900, Italia	45.308029	9.5050789	0.001
134435264	Polizia, Piazza 15° Cavalleggeri di Lodi, Lodi, LO, LOM, 26900, Italia	45.31886465	9.50209735994963	0.001
18147256	Questura, Via di Porta Regale, Lodi, LO, LOM, 26900, Italia	45.3122495	9.4990863	0.001
46576435	Comando Polizia Locale Città S.Angelo Lodigiano, Piazza Dante Alighieri, Sant'Angelo Lodigiano, LO, LOM, 26866, Italia	45.238022	9.4108423	0.001
6538112	Comando Stazione Carabinieri S.Angelo Lodigiano, Via San Martino e Solferino, Sant'Angelo Lodigiano, LO, LOM, 26866, Italia	45.2387196	9.4150232	0.001
81323369	Carabinieri, Via Roma, Lodi Vecchio, LO, LOM, 26838, Italia	45.3050045	9.41341176813859	0.001
