1514103	Murphy's Pub, Via Cesare Tallone, Città Studi, Zona 3, Milano, MI, LOM, 20133, Italia	45.4696964	9.2280645	0.101
17083126	Harp Pub, Piazza Leonardo da Vinci, Città Studi, Zona 3, Milano, MI, LOM, 20100, Italia	45.4772546	9.2255218	0.101
21234125	Diana Pub, 58, Viale Umbria, Calvairate, Zona 4, Milano, MI, LOM, 20135, Italia	45.4536701	9.215598	0.101
23559993	Nirvana Pub, 14/A, Via Carlo Rota, Sobborghi, Regina Pacis, Monza, MB, LOM, 20900, Italia	45.5816042	9.2843578	0.101
11183176	Birreria Pub  Vecchia Brianza, 2/A, Viale Alfonso Casati, Taccona, Muggiò, MB, LOM, 20835, Italia	45.5942347	9.2258991	0.101
42029721	Public House, 27/f, Viale della Repubblica, Taccona, Muggiò, MB, LOM, 20835, Italia	45.5914163	9.2317244	0.101
45159859	Madrigal Irish Pub, 280, Via Giuseppe Rovani, Sesto San Giovanni, MI, LOM, 20099, Italia	45.5357949	9.2201308	0.101
46615445	CONSORZIO BIRRE PUB, 10, Via Giuseppe Rovani, Sesto San Giovanni, MI, LOM, 20099, Italia	45.5358515	9.2222331	0.101
1449738	Le Coq, 13, Piazza Francesco Guardi, Città Studi, Zona 3, Milano, MI, LOM, 20133, Italia	45.470509	9.2268801	0.001
5972670	JJ's corner, 2587_47627, Lambrate, Zona 3, Milano, MI, LOM, 20133, Italia	45.4811644	9.2352638	0.001
877133	Tempi moderni, Via Luigi Emanueli, Segnano, Zona 9, Milano, MI, LOM, 20126, Italia	45.5141993	9.208342	0.001
15032080	La Nuova Milano, Via Bruno Cassinari, Taliedo, Zona 4, Milano, MI, LOM, 20138, Italia	45.4380631	9.2436657	0.001
18563667	L'osteria di Lambrate, Via degli Orombelli, Lambrate, Zona 3, Milano, MI, LOM, 20131, Italia	45.4831972	9.2360635	0.001
23870577	Paperoga, Via Lomellina, Porta Vittoria, Zona 4, Milano, MI, LOM, 20137, Italia	45.4648651	9.2300155	0.001
20598614	JustCafé, Via Giovanni Pacini, Casoretto, Zona 3, Milano, MI, LOM, 20131, Italia	45.4819285	9.2278179	0.001
46234396	Cascina Martesana, Via Luigi Bertelli, Zona 2, Milano, MI, LOM, 20128, Italia	45.5034655	9.2292077	0.001
18766154	La Belle Aurore, 1, Via privata Giuseppe Abamonti, Buenos Aires, Zona 3, Milano, MI, LOM, 20129, Italia	45.4719305	9.214541	0.001
16994326	Birrificio Lambrate, Via Camillo Golgi, Città Studi, Zona 3, Milano, MI, LOM, 20133, Italia	45.4796769	9.2344697	0.001
3889660	Canto VI, Viale Umbria, Calvairate, Zona 4, Milano, MI, LOM, 20135, Italia	45.4489554	9.2110082	0.001
16095033	Birreria Stella, Viale Argonne, Città Studi, Zona 3, Milano, MI, LOM, 20133, Italia	45.4685247	9.2262905	0.001
18088160	Blender, Piazzale Susa, Città Studi, Zona 3, Milano, MI, LOM, 20100, Italia	45.4686909	9.2235692	0.001
45514214	Rock'n'Roll Milano, 11, Via Giuseppe Bruschetti, Ponte Seveso, Zona 2, Milano, MI, LOM, 20125, Italia	45.4925338	9.2075644	0.001
1329683	Outback café, Via Carlo Tenca, Maggiolina, Zona 2, Milano, MI, LOM, 20124, Italia	45.4803007	9.2016606	0.001
18365503	Brasserie Bruxelles, 33, Viale Abruzzi, Buenos Aires, Zona 3, Milano, MI, LOM, 20131, Italia	45.4787762	9.2167222	0.001
835972	Il gatto e la volpe, Piazzale Giuseppe Massari, Mirabello, Zona 2, Milano, MI, LOM, 20124, Italia	45.4949167	9.198145	0.001
18211446	Mary Rose, Via Lambrate, Casoretto, Zona 3, Milano, MI, LOM, 20131, Italia	45.490367	9.2247833	0.001
21148717	Maga Furla, 50, Via Roberto Cozzi, Segnano, Zona 9, Milano, MI, LOM, 20125, Italia	45.5095876	9.2118674	0.001
19025025	Kofler, Via Tito Livio, Calvairate, Zona 4, Milano, MI, LOM, 20135, Italia	45.4523978	9.2146671	0.001
19787575	Hemingway Café, Via Vallazze, Casoretto, Zona 3, Milano, MI, LOM, 20131, Italia	45.4850744	9.2315908	0.001
17133604	East End, Via Canelli, Quartiere Feltre, Zona 3, Milano, MI, LOM, 20134, Italia	45.4883522	9.2541041	0.001
1266314	Matricola, Via Giovanni Pascoli, Città Studi, Zona 3, Milano, MI, LOM, 20100, Italia	45.4757092	9.2233689	0.001
1418018	Batik, Via Degli Organi Filippino, Calvairate, Zona 4, Milano, MI, LOM, 20135, Italia	45.4547927	9.2164769	0.001
38204880	Je suis Jambon, 4a, Piazza della Trivulziana, Segnano, Zona 9, Milano, MI, LOM, 20126, Italia	45.5148526	9.2122145	0.001
5022053	Neon, Via Carlo Valvassori Peroni, Lambrate, Zona 3, Milano, MI, LOM, 20133, Italia	45.4807579	9.2364606	0.001
2305331	Mom, Viale Monte Nero, Guastalla, Zona 1, Milano, MI, LOM, 20135, Italia	45.4587087	9.2061643	0.001
5900498	Barbarian's, 9, Via Giovanni Briosi, Città Studi, Zona 3, Milano, MI, LOM, 20133, Italia	45.470696	9.2282944	0.001
4793975	Osteria delle Erbe, Via Piero Caldirola, Segnano, Zona 9, Milano, MI, LOM, 20126, Italia	45.5145989	9.2111691	0.001
689794	Pogue Mahone, Via Vittorio Salmini, Zona 5, Milano, MI, LOM, 20122, Italia	45.4506704	9.2037648	0.001
1305424	Sohos, Via Carlo Tenca, Maggiolina, Zona 2, Milano, MI, LOM, 20124, Italia	45.4801747	9.2015922	0.001
840709	King's Cross Café, Via Luigi Pulci, Segnano, Zona 9, Milano, MI, LOM, 20125, Italia	45.5144784	9.2077108	0.001
23240454	Speedy, 22, Via Andrea Appiani, Borghetto, San Biagio, Monza, MB, LOM, 20900, Italia	45.5869275	9.2703664	0.001
23923002	Officine Libra, 72, Via Michelangelo Buonarroti, Sobborghi, Buonarroti, Monza, MB, LOM, 20900, Italia	45.5732672	9.2830804	0.001
40810127	34 Strasse, 34, Via Gerolamo Borgazzi, San Lorenzo, San Giuseppe, Monza, MB, LOM, 20900, Italia	45.570944	9.265797	0.001
25420121	Gulliver, 7/B, Via Giovanni Raiberti, Borgo Bergamo, San Gerardo, Monza, MB, LOM, 20900, Italia	45.5864363	9.2844268	0.001
24672715	Borgo Caffè, 9, Via Bergamo, Borgo Bergamo, San Gerardo, Monza, MB, LOM, 20900, Italia	45.5837479	9.2836226	0.001
24624020	Birreria La Baita, 104, Via Lecco, Grazie Vecchie, Libertà, Monza, MB, LOM, 20900, Italia	45.5922357	9.2904593	0.001
39684184	Sun Moon, 14, Via Luciano Manara, San Gottardo, San Biagio, Monza, MB, LOM, 20900, Italia	45.5889366	9.2632418	0.001
23621671	Woody, 27, Via Vittorio Emanuele II, Centro, Monza, MB, LOM, 20900, Italia	45.5841425	9.2795466	0.001
23531482	Modicia's, 8, Via Cortelonga, Centro, Monza, MB, LOM, 20900, Italia	45.584491	9.2716513	0.001
42504619	Birrificio del Carrobiolo, 1, Piazza Indipendenza, Molinetto, San Carlo, Monza, MB, LOM, 20900, Italia	45.5785003	9.2697769	0.001
