2300111	Pizzeria L'Altra Piedigrotta, Via dello Stadio, Circoscrizione Brescia Nord, Brescia, BS, LOM, 25133, Italia	45.5693412	10.2349684	0.001
14911297	Al Granaio, 15, Piazzale Arnaldo, Circoscrizione Brescia Centro, Brescia, BS, LOM, 25121, Italia	45.5360645	10.2297359	0.001
6873938	Trattoria Le Ferriere, Via San Zeno, Circoscrizione Brescia Sud, Brescia, BS, LOM, 25125, Italia	45.5001658	10.2140008	0.001
24413675	Konnichiwa, Via Caleppe, Circoscrizione Brescia Sud, Brescia, BS, LOM, 25126, Italia	45.5286288	10.206442	0.001
3068833	Il Ghiottone, Via Porta Pile, Circoscrizione Brescia Centro, Brescia, BS, LOM, 25122, Italia	45.5447374	10.2193736	0.001
14942500	Ristorante Il Polentone, 1b, Via Porta Pile, Circoscrizione Brescia Centro, Brescia, BS, LOM, 25122, Italia	45.5445893	10.2195328	0.001
25664468	Osteria Pizzeria Zio Beppe e Zia Ida, 45, Via Conicchio, Circoscrizione Brescia Nord, Brescia, BS, LOM, 25136, Italia	45.5831717	10.2393806	0.001
25446925	Ristorante Birreria Spiller, 49, Via Cefalonia, Circoscrizione Brescia Sud, Brescia, BS, LOM, 25122, Italia	45.5259545	10.2139816	0.001
15670115	La Primavolta, 12, Via Paolo Signorini, Circoscrizione Brescia Sud, Brescia, BS, LOM, 25121, Italia	45.5168039	10.2230515	0.001
22869706	Ristorante Pizzeria Laguna Blu, 76, Via San Zeno, Circoscrizione Brescia Sud, Brescia, BS, LOM, 25124, Italia	45.5262665	10.2205482	0.001
16424260	Piazzale Stazione, Circoscrizione Brescia Centro, Brescia, BS, LOM, 25122, Italia	45.5329876	10.2138215	0.001
1342462	Pizzeria Amalfitana, Via Pastrengo, Circoscrizione Brescia Nord, Brescia, BS, LOM, 25126, Italia	45.5473308	10.2136115	0.001
2477664	Pizzeria Take Away, Via Monte Grappa, Circoscrizione Brescia Nord, Brescia, BS, LOM, 25128, Italia	45.549235	10.2159268	0.001
3071309	Ristorante Pizzeria Bella Napoli, Via Montebello, Circoscrizione Brescia Ovest, Brescia, BS, LOM, 25126, Italia	45.545803	10.2078064	0.001
22257077	Trattoria Caprese, Piazza Loggia, Circoscrizione Brescia Centro, Brescia, BS, LOM, 25122, Italia	45.5400283	10.2200316	0.001
26083893	Trattoria Campagnola, Via Val Di Fassa, Circoscrizione Brescia Nord, Brescia, BS, LOM, 25123, Italia	45.557063	10.2431449	0.001
26483570	i Dù dela Contrada, 18b, Contrada del Carmine, Circoscrizione Brescia Centro, Brescia, BS, LOM, 25122, Italia	45.5430029	10.2179525	0.001
2312251	Pizzeria Ristorante La Serenella, Via Massimo D'Azeglio, Circoscrizione Brescia Nord, Brescia, BS, LOM, 25128, Italia	45.5516817	10.2187586	0.001
2477381	Bierhaus, Via Triumplina, Circoscrizione Brescia Nord, Brescia, BS, LOM, 25136, Italia	45.5719577	10.2312804	0.001
24383764	Osteria Vecchia Pusterla, Via Filippo Turati, Circoscrizione Brescia Centro, Brescia, BS, LOM, 25123, Italia	45.5434229	10.2312351	0.001
20349053	Osteria I Capitelli, Via Guido Zadei, Circoscrizione Brescia Nord, Brescia, BS, LOM, 25128, Italia	45.5574445	10.2219169	0.001
3082373	Ludwigs Garten, Via Gorizia, Circoscrizione Brescia Ovest, Brescia, BS, LOM, 25126, Italia	45.54698	10.2122197	0.001
15938490	Ristorante Pizzeria Agerolese, Via Giuseppe Verginella, Circoscrizione Brescia Nord, Brescia, BS, LOM, 25133, Italia	45.5706041	10.2388421	0.001
20328737	Ristorante Vita Nova, 48, Via Stretta, Circoscrizione Brescia Nord, Brescia, BS, LOM, 25128, Italia	45.565138	10.22225	0.001
3304505	La Piadineria, 20, Via Fausto Gamba, Circoscrizione Brescia Nord, Brescia, BS, LOM, 25128, Italia	45.5571345	10.2187901	0.001
18177319	Trattoria Tavernando Di De Vivo Raffaela, Via della Volta, Circoscrizione Brescia Sud, Brescia, BS, LOM, 25121, Italia	45.5146918	10.2249978	0.001
25532437	Piadineria GianGusto, 25c, Via Benedetto Castelli, Circoscrizione Brescia Nord, Brescia, BS, LOM, 25133, Italia	45.572772	10.2319186	0.001
19508501	Trattoria Rigoletto, Via Fontane, Circoscrizione Brescia Nord, Brescia, BS, LOM, 25133, Italia	45.5742214	10.2428194	0.001
24675102	Niu Niu Sushi Wok, 175, Via Triumplina, Circoscrizione Brescia Nord, Brescia, BS, LOM, 25136, Italia	45.574707	10.2297727	0.001
23802428	Cà Nöa Antica Trattoria, Via Branze, Circoscrizione Brescia Nord, Brescia, BS, LOM, 25133, Italia	45.5639962	10.2299658	0.001
20735301	Ristorante Pizzeria Emy 012, Via Stretta, Circoscrizione Brescia Nord, Brescia, BS, LOM, 25136, Italia	45.5715097	10.224258	0.001
16205684	Taverna Mille Miglia, Viale della Rimembranza, Circoscrizione Brescia Est, Brescia, BS, LOM, 25135, Italia	45.5244985	10.2672857	0.001
14829073	Mensa ISU, Via Senatore Diogene Valotti, Circoscrizione Brescia Nord, Brescia, BS, LOM, 25133, Italia	45.5649807	10.2353796	0.001
3071975	Ristorante Pizzeria I Sorrentino, 21, Via Baldassare Zamboni, Circoscrizione Brescia Ovest, Brescia, BS, LOM, 25126, Italia	45.546962	10.2078392	0.001
843614	Ristorante Pizzeria Da Matteo, Via San Donino, Circoscrizione Brescia Nord, Brescia, BS, LOM, 25128, Italia	45.5590589	10.213786	0.001
22136007	Faro, 60, Via Mantova, Montichiari, BS, LOM, 25018, Italia	45.4125893	10.3968828	0.001
21228711	Carpe Diem, 20/B, Via Guglielmo Marconi, Montichiari, BS, LOM, 25018, Italia	45.4174827	10.3831971	0.001
20157613	Pizzeria Aquila d'oro, 18, Corso Martiri della Libertà, Montichiari, BS, LOM, 25018, Italia	45.4127734	10.3904865	0.001
6878703	Trattoria Fascia d'Oro, Via Luigi Pirandello, Montichiari, BS, LOM, 25014, Italia	45.4539858	10.3242465	0.001
23673553	Ristorante Bar Pizzeria Al cervo, 33, Piazza Treccani, Montichiari, BS, LOM, 25018, Italia	45.413005	10.3924875	0.001
23382822	Osteria Antica Colombina, 42, Via Felice Cavallotti, Montichiari, BS, LOM, 25018, Italia	45.4138015	10.3920904	0.001
21481928	Il Toscano, Via Agnetti, Montichiari, BS, LOM, 25018, Italia	45.4178965	10.3863742	0.001
20104683	Osteria Rossa, SPBS668, Ghedi, BS, LOM, 25016, Italia	45.3999892	10.3089197	0.001
10777386	La Rotonda Risto Pizza Dancing, 8, Via Borgosatollo, Ghedi, BS, LOM, 25016, Italia	45.4464678	10.2508216	0.001
10818523	Nuova Trattoria Inferno, Via Borgosatollo, Ghedi, BS, LOM, 25016, Italia	45.4466144	10.2502813	0.001
15769002	Osteria Dei Boci, Via Alcide De Gasperi, Rezzato, BS, LOM, 25086, Italia	45.5143578	10.3168835	0.001
16573565	La Sosta, Via Alcide De Gasperi, Rezzato, BS, LOM, 25086, Italia	45.51421	10.3202271	0.001
5570825	Befed, Via Nikolajewka, Concesio, Comunità montana della valle Trompia, BS, LOM, 25062, Italia	45.595743	10.2258844	0.001
15777943	Osteria Antica Pieve, 43, Via Pontenove, Bedizzole, BS, LOM, 25081, Italia	45.4984748	10.4002624	0.001
3072038	Pizzeria Principessa Menna, Piazza 28 Maggio, Bovezzo, Comunità montana della valle Trompia, BS, LOM, 25073, Italia	45.5906994	10.2377241	0.001
