44495045	ReTrip Cafè, Via Valsabbia, Lumezzane, Comunità montana della valle Trompia, BS, LOM, 25065, Italia	45.6552809	10.2822867	0.001
46378913	Ristorante La Perla del Monte, 45, Via Prati Comuni, Lumezzane, Comunità montana della valle Trompia, BS, LOM, 25065, Italia	45.6446454	10.286459	0.001
2597611268	Ristorante Da Ugo, 53, Via Faidana, Lumezzane, Comunità montana della valle Trompia, BS, LOM, 25065, Italia	45.6411647	10.2692937	0.001
26137786	Trattoria Mario e Maria, 15, Via Sant'Antonio, Lumezzane, Comunità montana della valle Trompia, BS, LOM, 25065, Italia	45.6576645	10.2302774	0.001
48933713	Rifugio Rosa di Baremone, Ponte di Romanterra, Fontana, Bagolino, Comunità montana della valle Sabbia, BS, LOM, 25072, Italia	45.7910059	10.4644121	0.001
26885233	Trattoria Al Cacciatore, Via Sant'Antonio, Gavardo, Comunità montana della valle Sabbia, BS, LOM, 25085, Italia	45.6130283	10.4250981	0.001
27735699	Trattoria Bussi, Via Sant'Antonio, Gavardo, Comunità montana della valle Sabbia, BS, LOM, 25085, Italia	45.6178704	10.4321452	0.001
105667204	Agriturismo Castello, 8, Via Castello, Concesio, Comunità montana della valle Trompia, BS, LOM, 25062, Italia	45.60869365	10.225921091	0.001
25329647	Agriturismo alla Griglia, 37, Via Cadizzone, Concesio, Comunità montana della valle Trompia, BS, LOM, 25062, Italia	45.6067138	10.2289256	0.001
45361610	Bar Ristorante Il Cavallino Nero, Via Europa, Concesio, Comunità montana della valle Trompia, BS, LOM, 25062, Italia	45.6139534	10.2051222	0.001
27722100	Cartabianca Drinkeria e Cucina, 1, Via Roncaglie, Concesio, Comunità montana della valle Trompia, BS, LOM, 25062, Italia	45.6002002	10.2228341	0.001
20040304	Trattoria Sant'Emiliano, Via Cagnaghe, Sarezzo, Comunità montana della valle Trompia, BS, LOM, 25068, Italia	45.6647687	10.220165	0.001
2599442667	Via Paolo VI, Sarezzo, Comunità montana della valle Trompia, BS, LOM, 25068, Italia	45.6582631	10.1986475	0.001
27214221	Ristorante Pizzeria La Corte di Marina, 1, Via Cimabue, Sarezzo, Comunità montana della valle Trompia, BS, LOM, 25068, Italia	45.6570046	10.2193816	0.001
19612418	Bar Trattoria Cascata, SPBS345, Marcheno, Comunità montana della valle Trompia, BS, LOM, 25060, Italia	45.7240504	10.2311601	0.001
24150338	Trattoria Rosy da Gino e Gina, SPBS345, Marcheno, Comunità montana della valle Trompia, BS, LOM, 25060, Italia	45.721739	10.2302153	0.001
114250869	Agriturismo La Valle, 37, Via Caregno, Marcheno, Comunità montana della valle Trompia, BS, LOM, 25060, Italia	45.72560425	10.2070035757465	0.001
106947427	Hotel Trattoria Marcheno, SPBS345, Marcheno, Comunità montana della valle Trompia, BS, LOM, 25060, Italia	45.7133271	10.2213046	0.001
27605139	Trattoria Pineta, Via Pietro Ghidini, Marcheno, Comunità montana della valle Trompia, BS, LOM, 25060, Italia	45.7147255	10.2825855	0.001
20801365	Bar Ristorante Pizzeria La Posta, SPBS345, Marcheno, Comunità montana della valle Trompia, BS, LOM, 25060, Italia	45.7480591	10.2407035	0.001
98347767	Bar Ristorante Albergo La Fabbrica, Via Caregno, Marcheno, Comunità montana della valle Trompia, BS, LOM, 25060, Italia	45.7245571	10.20933645	0.001
106922293	Agriturismo Dazze, Sentiero Valle Larga, Marcheno, Comunità montana della valle Trompia, BS, LOM, 25063, Italia	45.69817045	10.2120651758326	0.001
116589385	Bar Ristorante Albergo Bassù, Via Provinciale, Bozzoline di sotto, Bovegno, Comunità montana della valle Trompia, BS, LOM, 25061, Italia	45.79344105	10.2767454823827	0.001
116209446	Agriturismo Piccole Dolomiti, Strada dei Soldati, Lavenone, Comunità montana della valle Sabbia, BS, LOM, 25047, Italia	45.7848648	10.4160233	0.001
35190700	Trattoria Bar Al Tre Sette, Strada provinciale Tavernole - Nozza, Marmentino, Comunità montana della valle Trompia, BS, LOM, 25061, Italia	45.7526054	10.27871	0.001
26644404	Trattoria Genzianella, Via Melle, Marmentino, Comunità montana della valle Trompia, BS, LOM, 25061, Italia	45.7209841	10.2820604	0.001
96654886	Agriturismo Ranch Vaghezza Gilberto, Via Ecolo Basso, Marmentino, Comunità montana della valle Trompia, BS, LOM, 25061, Italia	45.7583302	10.3076354867945	0.001
26860590	Bar Trattoria Al Cacciatore, Strada della Cavallina, Pezzaze, Comunità montana della valle Trompia, BS, LOM, Italia	45.7850669	10.211123	0.001
25133204	Bar Ponte Trattoria, Via Guglielmo Marconi, Pezzaze, Comunità montana della valle Trompia, BS, LOM, 25061, Italia	45.7774275	10.2350078	0.001
28220946	Osteria Trattoria Baìtèi, Strada della Cavallina, Pezzaze, Comunità montana della valle Trompia, BS, LOM, Italia	45.7860173	10.2068463	0.001
114820021	Agriturismo Belvedere, Strada della Cavallina, Pezzaze, Comunità montana della valle Trompia, BS, LOM, Italia	45.783997	10.203537353038	0.001
19918839	Trattoria Leone, 65, Via Nazionale, Caino, Comunità montana della valle Trompia, BS, LOM, 25070, Italia	45.6131656	10.3219289	0.001
46699879	Non Solo Bar, 3, Piazza Trieste, Caino, Comunità montana della valle Trompia, BS, LOM, 25070, Italia	45.6131182	10.316733	0.001
18093535	Via Roberto Bertini, Lemprato, Idro, Comunità montana della valle Sabbia, BS, LOM, 25074, Italia	45.7337968	10.4615593	0.001
17794195	Via Trento, Idro, Comunità montana della valle Sabbia, BS, LOM, 25074, Italia	45.7349575	10.4586196	0.001
45848492	Ristorante La Cascina dei Gelsi, Via Rovedolo, Inzino, Gardone Val Trompia, Comunità montana della valle Trompia, BS, LOM, 25063, Italia	45.6985229	10.1987625	0.001
46992418	Trattoria La Bresciana, 89, Via Valtrompia, Inzino, Gardone Val Trompia, Comunità montana della valle Trompia, BS, LOM, 25063, Italia	45.6996421	10.1969113	0.001
27128973	Bar Trattoria Rifugio Caregno, 93, Via Caregno, Inzino, Gardone Val Trompia, Comunità montana della valle Trompia, BS, LOM, 25060, Italia	45.7219505	10.2071851	0.001
27104768	Bar Trattoria Discepoli, Via Francesco Glisenti, Villa Carcina, Comunità montana della valle Trompia, BS, LOM, 25069, Italia	45.6317574	10.1998185	0.001
44803249	La Sosta, Viale Brescia, Villanuova sul Clisi, Comunità montana della valle Sabbia, BS, LOM, 25085, Italia	45.5996809	10.4504647	0.001
54043205	Locanda Dancelli, 64, Via San Carlo, Tavernole sul Mella, Comunità montana della valle Trompia, BS, LOM, Italia	45.7620047	10.2174904	0.001
28744428	Bar Trattoria San Rocco, Strada provinciale Forno D'Ono - Livemmo, Pertica Bassa, Comunità montana della valle Sabbia, BS, LOM, 25047, Italia	45.7392937	10.3539946	0.001
115271872	Ristorante Albergo Rocca del Rovere, Via Brescia, Vallio Terme, Comunità montana della valle Sabbia, BS, LOM, 25070, Italia	45.62781295	10.3760884377848	0.001
27309991	Ristorante Colle Sant'Eusebio, 34, Via Cavaliere Vigilio Zambelli, Vallio Terme, Comunità montana della valle Sabbia, BS, LOM, 25080, Italia	45.6097103	10.3619561	0.001
26769826	Ristorante Campagnola, Via Brescia, Vallio Terme, Comunità montana della valle Sabbia, BS, LOM, 25070, Italia	45.6306166	10.3670649	0.001
26466788	Hosteria da Ettore, Strada provinciale Tavernole - Nozza, Pertica Alta, Comunità montana della valle Sabbia, BS, LOM, 25047, Italia	45.7424129	10.3436962	0.001
28064958	Bar Trattoria Bongi, Strada provinciale Tavernole - Nozza, Pertica Alta, Comunità montana della valle Sabbia, BS, LOM, Italia	45.7307646	10.3297853	0.001
27698244	Ristoro Marilisa, Strada Provinciale Aiale - Irma - Marmentino, Irma, Comunità montana della valle Trompia, BS, LOM, 25061, Italia	45.7796254	10.3027788	0.001
