73401895	Teatro Sociale, 3, Via Vincenzo Bellini, Camerlata, Como, CO, LOM, 22100, Italia	45.81152695	9.08486876676875	0.20748690992775
125357928	Teatro della Società, Piazza Giuseppe Garibaldi, Castello, Lecco, LC, LOM, 23900, Italia	45.85271385	9.38928654819588	0.13061965013967
37283658	La Lucernetta, Piazza Medaglie d'Oro, Camerlata, Como, CO, LOM, 22100, Italia	45.8086039	9.0858986	0.001
130233211	Sala Don Ticozzi, Via Giuseppe Ongania, Castello, Lecco, LC, LOM, 23900, Italia	45.85782535	9.39091885154812	0.001
128491851	Cenacolo Francescano, 3, Piazza dei Capuccini, Castello, Lecco, LC, LOM, 23900, Italia	45.86371315	9.38522724517168	0.001
23292341	Arena, Via Sant'Antonio, Caglio, CO, LOM, 22030, Italia	45.8719604	9.239911	0.001
1420965	Teatro all'aperto  Licinium, Via Crotto Rosa, Erba, CO, LOM, 22036, Italia	45.8125791	9.22044	0.001
