45348683	Saletta Ottavia, 17, Viale Pietro Cadeo, Chiari, BS, LOM, 25032, Italia	45.5342973	9.9261776	0.001
44409053	Auditorium Bettolini, 17, Viale Pietro Cadeo, Chiari, BS, LOM, 25032, Italia	45.5343759	9.9260153	0.001
71313208	Auditoriom San Fedele, Piazza Tamanza, Piazza, Palazzolo sull'Oglio, BS, LOM, 25036, Italia	45.59795415	9.8839404114218	0.001
75573133	Teatro Sociale, Via Canonico Bussolati, Piazza, Palazzolo sull'Oglio, BS, LOM, 25036, Italia	45.59774655	9.88424262274584	0.001
68080055	Cinema Teatro Aurora, Via Bergamo, Mura, Palazzolo sull'Oglio, BS, LOM, 25036, Italia	45.596928	9.87696302776899	0.001
76251957	La Casa della Musica, Piazzale Dante Alighieri, Sacro Cuore, Palazzolo sull'Oglio, BS, LOM, 25036, Italia	45.5988232	9.88911355865146	0.001
41094753	Via Martinelli, Cologne, BS, LOM, 25033, Italia	45.5842911	9.9417947	0.001
