5870495	Banca delle Marche, Via Ugo Bassi, Senigallia, AN, MAR, 60019, Italia	43.7139484	13.2261595	0.001
40776649	Viale dei Gerani, Senigallia, AN, MAR, 60019, Italia	43.7081101	13.2258485	0.001
43029900	Poste Italiane, Via Genova, Piano Marina, Mondolfo, PU, MAR, 61037, Italia	43.769187	13.131231	0.001
17016445	Poste Italiane, Via Giacomo Leopardi, Corinaldo, AN, MAR, 60013, Italia	43.6499552	13.0468516	0.001
21499333	Poste Italiane, Strada Provinciale Jesi Monterado, Trecastelli, AN, MAR, Italia	43.6555587	13.1226006	0.001
23303652	Via Antonelli, Trecastelli, AN, MAR, Italia	43.6584959	13.1528315	0.001
22320242	Banca delle Marche, Via Umberto I, Trecastelli, AN, MAR, Italia	43.6704918	13.1063948	0.001
