12992231	Istituto D'Arte Cantalamessa, Via Pietro e Lorenzo Cioci, Fonte Scodella, Macerata, MC, MAR, 62110, Italia	43.3002859	13.4413219	0.001
14002718	Istituto Tecnico Commerciale  Alberico Gentili, Via Pietro e Lorenzo Cioci, Fonte Scodella, Macerata, MC, MAR, 62110, Italia	43.299901	13.4410586	0.001
105969678	Istituto Professiona Statale Industria e Agricoltura Filippo Corridoni, Via Achille Barilatti, Tribunale, Macerata, MC, MAR, 62100, Italia	43.29321145	13.4459301054811	0.001
13853749	Istituto Tecnico per le Attività Sociali Matteo Ricci, Piazza Cesare Battisti, Centro Storico, Macerata, MC, MAR, 62100, Italia	43.3003571	13.4521647	0.001
112178465	Istituto Tecnico Agrario e Istituto professionale servizi per l'agricoltura e lo sviluppo rurale - Giuseppe Garibaldi, 6, Contrada Lornano, Colleverde, Macerata, MC, MAR, 62100, Italia	43.28729715	13.4216820758883	0.001
71353495	Liceo Classico Statale  Giacomo Leopardi, Via Mario Morbiducci, Fonte Scodella, Macerata, MC, MAR, 62110, Italia	43.30110025	13.442281777883	0.001
82482740	Istituto Tecnico Attività Sociali  Matteo Ricci, Via Giovanni Di Pietro, San Francesco, Macerata, MC, MAR, 62100, Italia	43.29274165	13.4400031902004	0.001
15029465	Liceo Scientifico Galileo Galilei, Via Alessandro Manzoni, Tribunale, Macerata, MC, MAR, 62100, Italia	43.2958463	13.4472171	0.001
4872157	Istituto Professionale e Commerciale per i servizi turistici  Ivo Pannaggi, Via Arturo Ciccolini, Tribunale, Macerata, MC, MAR, 62100, Italia	43.2949971	13.4483898	0.001
