129099568	Fontana dei Leoni, Piazza del Duca, Cesano, Senigallia, AN, MAR, 60019, Italia	43.71507695	13.2195746544151	0.001
127817328	Via Zara, Senigallia, AN, MAR, 60019, Italia	43.7154773	13.2245282531008	0.001
3798138	Via Zara, Senigallia, AN, MAR, 60019, Italia	43.7154681	13.22453	0.001
16054264	Fontana delle Oche, Via Baroccio, Cesano, Senigallia, AN, MAR, 60019, Italia	43.7130087	13.220007	0.001
40683289	Lungomare Cristoforo Colombo, Piano Marina, Mondolfo, PU, MAR, 61037, Italia	43.7740433	13.1319771	0.001
115639815	Viale Giosuè Carducci, Piano Marina, Mondolfo, PU, MAR, 61037, Italia	43.771677	13.1353231930406	0.001
117212554	Piazza Roma, Piano Marina, Mondolfo, PU, MAR, 61037, Italia	43.7683639	13.1406617550882	0.001
