40199361	Via Giuseppe Mazzini, Urbino, PU, MAR, 61029, Italia	43.7262936	12.6360921	0.001
50096895	13, Piazza della Repubblica, Urbino, PU, MAR, 61029, Italia	43.7264008	12.6363993	0.001
52461057	Via Pitino Mergente, Acqualagna, PU, MAR, 61110, Italia	43.6134126	12.6316562	0.001
50055148	Farmacia Fattori, Via Santa Lucia, Acqualagna, PU, MAR, 61041, Italia	43.6184777	12.6726318	0.001
5613316	Piazza Garibaldi, Fermignano, PU, MAR, 61029, Italia	43.6766366	12.6457058	0.001
127293440	Via Kennedy, Viale John Fitzgerald Kennedy, Fermignano, PU, MAR, 61029, Italia	43.6891342	12.6430651222078	0.001
