24852190	Via Risorgimento, Paese Alto, San Benedetto del Tronto, AP, MAR, 63074, Italia	42.9510366	13.8797752	0.001
6116172	Farmacia Colonnella, Via Giuseppe Garibaldi, Offida, AP, MAR, 63032, Italia	42.9360122	13.692575	0.001
23447576	Dottor Cocci Grifoni, 19, Piazza Giosuè Carducci, Ischia, Grottammare, AP, MAR, 63066, Italia	42.9633648	13.8752664	0.001
18009892	Farmacia Comunale, Strada Provinciale 54 Monteprandone, Monteprandone, AP, MAR, 63077, Italia	42.9202137	13.8372731	0.001
14854497	Strada Provinciale 23 Cuprense, Cossignano, AP, MAR, 63034, Italia	42.9884512	13.6088437	0.001
43094300	Via Paolo Assalti, Acquaviva Picena, AP, MAR, Italia	42.9439745	13.8122635	0.001
