830113	Fabriano, Piazzale 20 settembre, Campo Sportivo, Fabriano, AN, MAR, 60044, Italia	43.345501	12.905456	0.16095925177046
3696414	Albacina, Strada Statale 76 della Val d'Esino, Fabriano, AN, MAR, Italia	43.3457144	12.9862468	0.07374459342567
11697978	Tolentino, Piazza Guglielmo Marconi, Tolentino, MC, MAR, 62029, Italia	43.2145952	13.2904665	0.046527658157285
3562901	Matelica, Viale Roma, Matelica, MC, MAR, 62024, Italia	43.2540168	13.0150687	0.001
3526605	Castelraimondo, Strada Provinciale 361 Septempedana, Castelraimondo, MC, MAR, Italia	43.2105065	13.0572746	0.001
6890988	San Severino Marche, Strada Provinciale 127, San Severino Marche, MC, MAR, Italia	43.2299556	13.1834929	0.001
3561180	Cerreto d'Esi, Via Francesco Morea, Cerreto d'Esi, AN, MAR, 62024, Italia	43.3220644	12.9831719	0.001
