23807780	Unicredit, Via Martiri della Libertà, Cavagnolo, TO, PIE, Italia	45.1537032	8.0555027	0.001
24407168	Vicolo Alessandria, Villadeati, AL, PIE, 15021, Italia	45.055122	8.1619612	0.001
20888292	Via Roma, Villadeati, AL, PIE, 15021, Italia	45.0722503	8.1693394	0.001
24484786	Banca C.R.Asti, Via Umberto Primo, Tigliole, AT, PIE, Italia	44.8869478	8.0748655	0.001
40628619	Banca C.R. Asti, SP458, Cortanze, AT, PIE, 14020, Italia	45.0431539	8.0427273	0.001
49728602	Banca Cr Asti, SP75, Monale, AT, PIE, 14013, Italia	44.9355003	8.0717155	0.001
23758057	Strada Valperosa, Tigliole, AT, PIE, 14018, Italia	44.8864682	8.0574239	0.001
21560703	Banca C.R. Asti filiale 31, 16, Piazza Santanera, Villafranca d'Asti, AT, PIE, 14018, Italia	44.9129369	8.0353911	0.001
