51174111	Via Roma, Soglio, Chialamberto, TO, PIE, 10070, Italia	45.362881	7.3455219	0.001
38867721	Biblioteca Civica di Bairo, 6, Via Principe Tommaso, Cascina Furno, Bairo, TO, PIE, 10010, Italia	45.3858016	7.754696	0.001
136568674	Biblioteca Civica di Cuorgnè, Via Garibaldi, Cuorgnè, TO, PIE, 10082, Italia	45.39101195	7.64942217468504	0.001
50174252	Biblioteca Comunale, Corso Giacomo Matteotti, Favria, TO, PIE, 10083, Italia	45.3330108	7.6903607	0.001
24992431	Biblioteca civica, Via Regina Margherita, Corio, TO, PIE, Italia	45.3126821	7.5324423	0.001
18434387	Biblioteca Comunale, Via Luigi Palma di Cesnola, Rivarolo Canavese, TO, PIE, 10086, Italia	45.3331418	7.7245832	0.001
2598047861	Biblioteca civica Augusto Cavallari Murat, 1, Via San Giovanni Bosco, Lanzo Torinese, TO, PIE, 10074, Italia	45.27308265	7.47500252144085	0.001
