30628821	Pub Marconi, Via Querro, Cascine Vica, Rivoli, TO, PIE, 10098, Italia	45.06779	7.5113073	0.101
18337337	Mister Gipson Pub, 34, Via Sestriere, Cascine Vica, Rivoli, TO, PIE, 10090, Italia	45.0744696	7.5443756	0.101
17957177	Saint George Music Pub, 196, Corso Francia, Cascine Vica, Rivoli, TO, PIE, 10098, Italia	45.071296	7.5466882	0.101
52909150	New Duke, 25, Via Castellazzo, Orbassano, TO, PIE, 10043, Italia	45.0055797	7.5379415	0.001
42246775	Jamaika, 8, Via Aldo Moro, Pianezza, TO, PIE, 10044, Italia	45.1070503	7.5544301	0.001
125003298	L'oca ceca, 23, Via Alcide de Gasperi, Druento, TO, PIE, 10040, Italia	45.138288	7.57539899535784	0.001
125170005	Bistrot Rigatony, Corso Susa, Cascine Vica, Rivoli, TO, PIE, 10098, Italia	45.078677	7.51173505479722	0.001
40299487	La Brigata del Birraio, 49, Corso Moncenisio, Rosta, TO, PIE, 10090, Italia	45.0842603	7.4708606	0.001
