18643185	Via Giovanni Amendola, Avigno, Masnago, Varese, VA, LOM, 21100, Italia	45.8285344	8.797984	0.001
6044539	Civico liceo musicale Riccardo Malipiero, Via Giuseppe Garibaldi, Valle Olona, Biumo Inferiore, Varese, VA, LOM, 21100, Italia	45.8210603	8.8334062	0.001
21231362	Istituto Vinci, 30, Via Camillo Benso Conte di Cavour, Valle Olona, Biumo Inferiore, Varese, VA, LOM, 21100, Italia	45.8192135	8.8299074	0.001
9846628	Scuola elementare  Giuseppe Mazzini, Via Como, Valle Olona, Biumo Inferiore, Varese, VA, LOM, 21100, Italia	45.8185906	8.8309695	0.001
9859461	Via Carlo Rainoldi, Valle Olona, Biumo Inferiore, Varese, VA, LOM, 21100, Italia	45.8192231	8.8306739	0.001
21437046	Via Felicita Morandi, Biumo Superiore, Varese, VA, LOM, 21100, Italia	45.8224523	8.8225533	0.001
38626262	Istituto Athena, Via Vincenzo Dandolo, Valle Olona, Biumo Inferiore, Varese, VA, LOM, 21100, Italia	45.8207977	8.8307435	0.001
39142835	Piazza Carlo Leone Fabbri, Intra, Verbania, VB, PIE, 28921, Italia	45.937511	8.5652593	0.001
1304693	Scuola Media, Via Dante Alighieri, Angera, VA, LOM, 21021, Italia	45.7755149	8.5759975	0.001
10807378	Via Giuseppe Verdi, Bostano, Laveno-Mombello, Comunità Montana Valli del Verbano, VA, LOM, 21038, Italia	45.8899036	8.6250289	0.001
2605807957	Scuola Elementare Giovanni Pascoli, Via Cavour, Besozzo, VA, LOM, 21023, Italia	45.8423092	8.66856020396419	0.001
2598968277	Scuola Secondaria di Primo Grado di Germignaga “Vittorio Sereni”, 3, Via ai Ronchi, Germignaga, Comunità Montana Valli del Verbano, VA, LOM, 21016, Italia	45.9894163	8.7237891	0.001
7150730	Via della Giovinezza, Gavirate, Comunità Montana Valli del Verbano, VA, LOM, 21026, Italia	45.8277205	8.7411322	0.001
7849124	Viale Rimembranze, Gavirate, Comunità Montana Valli del Verbano, VA, LOM, 21026, Italia	45.8432501	8.7094974	0.001
4696723	Largo XXV Aprile, Besnate, VA, LOM, 21044, Italia	45.699319	8.7700195	0.001
4762079	Scuola Primaria Dante Alighieri, Via Don Angelo Molteni, Besnate, VA, LOM, 21044, Italia	45.6973896	8.7697673	0.001
2600837813	Scuola Materna Statale di Quinzano, Via Sandro Pertini, Sumirago, VA, LOM, 21041, Italia	45.72540575	8.77480750608609	0.001
2600811898	Scuola elementare di Crugnola, Via Cesare Battisti, Mornago, VA, LOM, 21010, Italia	45.73026295	8.75112559659575	0.001
16447522	Scuola primaria, Via Giuseppe Mazzini, Bisuschio, Comunità Montana del Piambello, VA, LOM, 21059, Italia	45.871957	8.8718784	0.001
16448053	Scuola secondaria, Via Roma, Bisuschio, Comunità Montana del Piambello, VA, LOM, 21059, Italia	45.8722857	8.8721037	0.001
14173564	Scuola media, Via Provinciale, Cittiglio, Comunità Montana Valli del Verbano, VA, LOM, 21033, Italia	45.8954216	8.6663578	0.001
14215233	Via Nazario Sauro, Cittiglio, Comunità Montana Valli del Verbano, VA, LOM, 21033, Italia	45.8972998	8.6657051	0.001
11129068	Contrada Motto dei Grilli, Cocquio Trevisago, Comunità Montana Valli del Verbano, VA, LOM, 21034, Italia	45.8606824	8.6831153	0.001
3412888	Elementari di Casciago, Largo Alcide De Gasperi, Casciago, VA, LOM, Italia	45.8349141	8.7818222	0.001
6748489	Scuola Primaria Statale Giovanni Pascoli, 15, Via Cesare Battisti, Lozza, VA, LOM, 21040, Italia	45.775996	8.8589983	0.001
4402193	Via Giacomo Matteotti, Bardello, VA, LOM, 21026, Italia	45.835293	8.6969166	0.001
2600248098	Scuola Primaria  Enrico Fermi, Via Giuseppe Verdi, Daverio, VA, LOM, 21022, Italia	45.7752167	8.76972710060774	0.001
23625778	Scuole Medie Magni, Via Guglielmo Marconi, Cà da Rondo, Borgosesia, VC, PIE, 13011, Italia	45.716223	8.2798402	0.001
23707597	Via Prevosto Bocciolone, Cà da Rondo, Borgosesia, VC, PIE, 13011, Italia	45.7170208	8.2770024	0.001
23664458	Via Guglielmo Marconi, Cà da Rondo, Borgosesia, VC, PIE, 13011, Italia	45.7141854	8.2852475	0.001
23969096	Liceo Scientifico  Gaudenzio Ferrari, 152, Viale Varallo, Cà da Rondo, Borgosesia, VC, PIE, 13011, Italia	45.7271478	8.2645913	0.001
27334794	Scuola elementare e media, Largo Gaudenzio Ferrari, Cascina Sasso Bianco, Grignasco, NO, PIE, Italia	45.6827003	8.3417536	0.001
6494842	Scuola Elementare, 2, Via delle Scuole, Postua, VC, PIE, 13010, Italia	45.7125525	8.2310448	0.001
40463909	Istituto Alberghiero, SP232, Trivero, BI, PIE, 13822, Italia	45.6775709	8.1490756	0.001
21046335	scuola elementare Gattico, Strada Provinciale, Gattico, NO, PIE, 28010, Italia	45.7088466	8.520672	0.001
2600447505	Scuola Media Gattico, Viale Borgarino, Gattico, NO, PIE, 28010, Italia	45.71185005	8.51783918551077	0.001
39760501	Via Due Riviere, Miasino, NO, PIE, 28016, Italia	45.8008394	8.4309906	0.001
40645215	Scuole Elementari e Medie Coggiola, SP118, Coggiola, BI, PIE, 13833, Italia	45.6844416	8.1868743	0.001
5829842	Via alle Scuole, Ghiffa, VB, PIE, 28823, Italia	45.9596223	8.6186446	0.001
9162945	Scuola media, Via Sergio Jonghi, Alpe Cuna, Ornavasso, VB, PIE, 28802, Italia	45.9713945	8.4137904	0.001
9131751	Scuola elementare, Via Guglielmo Marconi, Alpe Cuna, Ornavasso, VB, PIE, 28802, Italia	45.9714066	8.411026	0.001
21111551	Scuole Elementari di Gargallo, Piazza S. Pietro, Gargallo, NO, PIE, 28024, Italia	45.7285296	8.4291393	0.001
2600590134	Scuola secondaria di I grado  Giovanni XXIII, Via Monte Rosa, Arona, NO, PIE, 28041, Italia	45.75438655	8.55271980115645	0.001
2600460677	Liceo Enrico Fermi, Via Monte Nero, Mercurago, Arona, NO, PIE, 28041, Italia	45.74978275	8.55457091362063	0.001
2600458379	Scuola Primaria  Dante Alighieri, Via Monte Nero, Mercurago, Arona, NO, PIE, 28041, Italia	45.749615	8.54822164527027	0.001
40777494	Istituto Marcelline, 2, Via Camillo Cavour, Arona, NO, PIE, 28041, Italia	45.7599548	8.5612923	0.001
2600589018	Scuola Primaria  G.F. Usellini  e Scuola dell'Infanzia Via Piave, Via Piave, Arona, NO, PIE, 28041, Italia	45.758489	8.54937662979592	0.001
27823736	Scuola primaria, Via Giuseppe Mazzola, Case Sparse sopra il Sacro Monte, Varallo, VC, PIE, 13019, Italia	45.8173131	8.2516552	0.001
27498342	Scuola Secondaria, Via D'Adda, Case Sparse sopra il Sacro Monte, Varallo, VC, PIE, 13019, Italia	45.8195675	8.2488925	0.001
27920114	Via Mario Tancredi Rossi, Case Sparse sopra il Sacro Monte, Varallo, VC, PIE, 13019, Italia	45.8157016	8.2484216	0.001
