79735490	Alessandria, Piazza Eugenio Curiel, Alessandria, AL, PIE, 15100, Italia	44.9086955	8.60753314780107	0.33359981948048
17648403	Alessandria Smistamento, RFI, Alessandria, AL, PIE, 15100, Italia	44.9048754	8.5955576	0.001
23950303	Terminal DB Autozug, rampa carico auto su treni, Alessandria, AL, PIE, 15100, Italia	44.9111912	8.6047222	0.001
21341958	Spinetta, Via Perfumo, Alessandria, AL, PIE, 15122, Italia	44.8823725	8.6831661	0.001
18339266	Tortona, Piazza Fiume, Passalacqua, Tortona, AL, PIE, Italia	44.9000204	8.8619694	0.001
16692763	Rivalta Scrivia, SP148, Tortona, AL, PIE, Italia	44.8541111	8.8100874	0.001
131281509	Stazione di Frugarolo Bosco Marengo, Via Battisti, Frugarolo, AL, PIE, Italia	44.84157725	8.68258500194498	0.001
49122398	Castellazzo-Casalcermelli, Via Casal Cermelli, Cedacri Group, Castellazzo Bormida, AL, PIE, 15073, Italia	44.8433901	8.5895904	0.001
