19105573	Cuneo, SS20, Madonna dell'Olmo, Cuneo, CN, PIE, 12100, Italia	44.3878005	7.5363418	0.32301894165642
19534994	Cuneo Gesso, Via Vecchia Stazione, Madonna dell'Olmo, Cuneo, CN, PIE, 12100, Italia	44.3942607	7.5559013	0.19764611922243
618780	Mondovì, Corso Armando Diaz, Mondovì, CN, PIE, 12084, Italia	44.3983529	7.8161467	0.13958297447186
19532466	Borgo San Dalmazzo, Corso Nizza, Tetto Turutun sottano, Borgo San Dalmazzo, CN, PIE, 12011, Italia	44.3263841	7.4860999	0.10803387666472
15247498	Roccavione, Viale Caduti in Guerra, Casot Brindur, Roccavione, CN, PIE, 12011, Italia	44.3144412	7.4852688	0.046527658157285
15656934	Vicoforte-San Michele, SS28, San Michele Mondovì, CN, PIE, Italia	44.3740329	7.8947661	0.001
16150516	Margarita, San Biagio, Margarita, CN, PIE, Italia	44.380147	7.6857431	0.001
