633846	Chivasso, Piazza Giuseppe Garibaldi, Chivasso, TO, PIE, 10034, Italia	45.1933872	7.8899206	0.17714730829695
39304860	Pessione, SP128, Chieri, TO, PIE, 10023, Italia	44.9651263	7.841336	0.093055316314571
37697792	Villanova d'Asti, Strada Bianchi, Villanova d'Asti, AT, PIE, 14019, Italia	44.9631328	7.9470577	0.046527658157285
120964266	Pessione, SP128, Chieri, TO, PIE, 10023, Italia	44.96522035	7.8413456786647	0.001
20329965	Brandizzo, Piazza della Stazione, Brandizzo, TO, PIE, 10032, Italia	45.1787318	7.8411549	0.001
46646428	Verolengo, strada esterna del Molinatto, Verolengo, TO, PIE, Italia	45.1930107	7.9695153	0.001
109883115	Villanova, Via alla Stazione, Villanova d'Asti, AT, PIE, 14019, Italia	44.96301195	7.9471016	0.001
3528038	San Paolo Solbrito, Via Vittorio Veneto, San Paolo Solbrito, AT, PIE, 14019, Italia	44.951733	7.9757298	0.001
