2606329562	Via Giovanni Giolitti, Murassone, Dronero, CN, PIE, Italia	44.46745585	7.36141382223343	0.001
44180987	Teatro, Via Umberto I, Narzole, CN, PIE, Italia	44.59359	7.8700212	0.001
2571387067	teatro civico, Via 4 Novembre, Busca, CN, PIE, 12022, Italia	44.51440015	7.47542627770438	0.001
91402926	Anfiteatro, Via Monserrato, Tetto Turutun sottano, Borgo San Dalmazzo, CN, PIE, 12011, Italia	44.32608005	7.47979522938044	0.001
15528815	Teatro F. Garelli, Via del Teatro, Villanova Mondovì, CN, PIE, Italia	44.3447054	7.7622627	0.001
110340846	Centro Congressi Cinema - Teatro Sangiacomo, Viale Pianfei, San Giacomo di Roburent, CN, PIE, 12080, Italia	44.2940675	7.87599300508345	0.001
