24611974	Tunnel du Grand-Saint-Bernard - Traforo del Gran San Bernardo, Barral, Saint-Rhémy-en-Bosses, AO, VDA, Italia	45.8563312	7.1627328	0.001
48391342	Banche Credito Cooperativo, Via Corrado Gex, Arvier, AO, VDA, 11011, Italia	45.7033371	7.1679672	0.001
47192326	Strada regionale della Valsavarenche, Arpilles, Introd, AO, VDA, 11018, Italia	45.6913713	7.1871875	0.001
39363666	SR26, La Ravoire, Avise, AO, VDA, 11011, Italia	45.7321268	7.1468016	0.001
7297517	SR26, Le Cré, Avise, AO, VDA, 11011, Italia	45.7260555	7.1414013	0.001
7603995	Belvedere, Strada Regionale 22 Saint Nicolas, Ferrere, Saint-Nicolas, AO, VDA, 11011, Italia	45.7111335	7.1681519	0.001
24258473	Strada Hotel Notre Maison, Saint-Pierre, AO, VDA, 11011, Italia	45.7571885	7.1796568	0.001
7725997	Strada Regionale 22 Saint Nicolas, Ferrere, Saint-Nicolas, AO, VDA, 11011, Italia	45.7136488	7.1663823	0.001
40919946	SR41, Ferrere, Saint-Nicolas, AO, VDA, 11018, Italia	45.730407	7.1908842	0.001
