16376491	SS27, Ponty, Saint-Rhémy-en-Bosses, AO, VDA, Italia	45.8552732	7.1496113	0.001
25056842	Vertosan, Tunnel du Grand-Saint-Bernard, Ponty, Saint-Rhémy-en-Bosses, AO, VDA, Italia	45.7721762	7.1395652	0.001
8320670	Avalon, 4, Frazione Delliod, Arpilles, Introd, AO, VDA, 11018, Italia	45.6861086	7.1880705	0.001
50681839	Grand Sarriod, SR41, Ferrere, Saint-Nicolas, AO, VDA, 11018, Italia	45.7232022	7.1885507	0.001
10268167	Vetan, Strada Hotel Notre Maison, Saint-Pierre, AO, VDA, 11011, Italia	45.7305232	7.1904759	0.001
49582486	Strada Regionale 22 Saint Nicolas, Ferrere, Saint-Nicolas, AO, VDA, 11011, Italia	45.7156592	7.1662006	0.001
2596836808	Le Foyer Du Fond, Strada Regionale 22 Saint Nicolas, Ferrere, Saint-Nicolas, AO, VDA, 11011, Italia	45.7154086	7.1669635	0.001
