53027502	Banco del Venziano, SP23, Fusina, Venezia, VE, VEN, Italia	45.4196791	12.256334	0.001
52389381	Via Orlanda, Favaro Veneto, Venezia, VE, VEN, 30173, Italia	45.4868417	12.2956278	0.001
19485082	Banca Popolare Friuladria, Piazza Baldassare Galuppi, Venezia, VE, VEN, 30142, Italia	45.484893	12.4193079	0.001
44908693	Fondamenta San Simon Piccolo, Santa Croce, Venezia, VE, VEN, 30121, Italia	45.4407409	12.322716	0.001
47530851	Via Canal Bernardo, Gazzera, Marghera, Venezia, VE, VEN, 30175, Italia	45.4764168	12.2232234	0.001
49159213	Cash Machine, 151, Rio Terà Lista di Spagna, Cannaregio, Venezia, VE, VEN, 30121, Italia	45.4421028	12.3233024	0.001
47595274	Forexchange, Rio Terà Lista di Spagna, Cannaregio, Venezia, VE, VEN, 30121, Italia	45.4427086	12.324318	0.001
35635510	Banco San Marco, Rivalonga, Venezia, VE, VEN, 30141, Italia	45.4562072	12.35436	0.001
41488849	Via Torino, Marghera, Venezia, VE, VEN, 30170, Italia	45.4837012	12.2411633	0.001
32606470	Venezia Marghera, Piazzale Cesare Rossarol, Marghera, Venezia, VE, VEN, 30175, Italia	45.4750159	12.2277656	0.001
38776981	Poste Italiane, Calle Larga de l'Ascension, San Marco, Venezia, VE, VEN, 30124, Italia	45.4336964	12.3368838	0.001
50316461	Ramo de l'Anzolo, San Marco, Venezia, VE, VEN, 30122, Italia	45.4356694	12.340022	0.001
46539716	1108, Calle Larga dei Bari, Santa Croce, Venezia, VE, VEN, 30135, Italia	45.4404638	12.3250641	0.001
50692787	Via Amerigo Vespucci, Carpenedo, Venezia, VE, VEN, 30172, Italia	45.4951466	12.251402	0.001
51697696	Postamat, Via Giuseppe Garibaldi, Castello, Venezia, VE, VEN, 30122, Italia	45.4320289	12.3521721	0.001
4334597	Unicredit Banca, Via Edoardo Plinio Masini, Forcellini, Padova, PD, VEN, 35131, Italia	45.4097324	11.9015335	0.001
15711945	Piazza Insurrezione, Arcella, Padova, PD, VEN, 35137, Italia	45.409769	11.874322	0.001
15991563	Banco Popolare di Marostica, Via Roberto Marin, Madonna Pellegrina, Padova, PD, VEN, 35122, Italia	45.398612	11.8716294	0.001
15782815	Poste Italiane, Via Cernaia, Paltana, Padova, PD, VEN, 35141, Italia	45.403552	11.8630186	0.001
15758775	42, Via Santa Lucia, Arcella, Padova, PD, VEN, 35137, Italia	45.4086455	11.8747244	0.001
18104451	Poste Italiane, Via Livorno, Paltana, Padova, PD, VEN, 35141, Italia	45.3955557	11.8630495	0.001
16794646	Cassa di Risparmio del Veneto, Piazzale della Stazione, Arcella, Padova, PD, VEN, 35132, Italia	45.4175888	11.8806766	0.001
14967269	11A, Via Giuseppe Verdi, Arcella, Padova, PD, VEN, 35137, Italia	45.4091671	11.8739514	0.001
14795181	Via Giuseppe Verdi, Arcella, Padova, PD, VEN, 35137, Italia	45.4091718	11.8744704	0.001
18643395	Via Egidio Forcellini, Forcellini, Padova, PD, VEN, 35128, Italia	45.3971377	11.8982911	0.001
16041989	Via Cristoforo Moro, Paltana, Padova, PD, VEN, 35141, Italia	45.404336	11.864601	0.001
15744189	Banca Popolare di Milano, Via del Carmine, Arcella, Padova, PD, VEN, 35137, Italia	45.4130234	11.8771513	0.001
19166950	FriulAdria, Via Livorno, Paltana, Padova, PD, VEN, 35141, Italia	45.3953495	11.8630833	0.001
14956030	Via San Fermo, Arcella, Padova, PD, VEN, 35137, Italia	45.411128	11.8747217	0.001
18319898	Cassa del Veneto, Piazza Gaetano Salvemini, Arcella, Padova, PD, VEN, 35121, Italia	45.4140925	11.883567	0.001
22364869	Credem, Corso Milano, Arcella, Padova, PD, VEN, 35139, Italia	45.4095951	11.8706579	0.001
17451116	Via Carlo Rezzonico, Arcella, Padova, PD, VEN, 35121, Italia	45.4139946	11.8839317	0.001
14966896	Superflash, Piazza Cavour, Arcella, Padova, PD, VEN, 35121, Italia	45.407926	11.8775948	0.001
16145517	Unicredit, Piazza del Duomo, Arcella, Padova, PD, VEN, 35122, Italia	45.4064956	11.8726521	0.001
15032940	10, Via Flavio Busonera, Arcella, Padova, PD, VEN, 35137, Italia	45.4089994	11.8757282	0.001
25647689	Deutsche Bank, Piazza delle Erbe, Arcella, Padova, PD, VEN, 35122, Italia	45.4065794	11.8758389	0.001
15182110	Via Trieste, Arcella, Padova, PD, VEN, 35100, Italia	45.4120015	11.8851368	0.001
23916552	Piazza delle Erbe, Arcella, Padova, PD, VEN, 35122, Italia	45.4067933	11.8748457	0.001
14956629	Unicredit Banca, Via Sant'Andrea, Arcella, Padova, PD, VEN, 35137, Italia	45.408234	11.8773986	0.001
15783932	Piazzetta Amedeo Sartori, Arcella, Padova, PD, VEN, 35137, Italia	45.4114248	11.8761908	0.001
16078685	Via Palestro, Cave, Padova, PD, VEN, 35141, Italia	45.4071137	11.8628081	0.001
45826971	Via Salboro, Crocifisso, Padova, PD, VEN, 35124, Italia	45.3585358	11.8936249	0.001
25236859	Monte dei Paschi, Via del Municipio, Arcella, Padova, PD, VEN, 35122, Italia	45.4068738	11.8765135	0.001
16152866	Via Alessandro Prosdocimi, Forcellini, Padova, PD, VEN, 35128, Italia	45.3969943	11.9005883	0.001
15736983	Banca Popolare di Verona, Piazza del Santo, Madonna Pellegrina, Padova, PD, VEN, 35123, Italia	45.401597	11.879633	0.001
16194568	Via Monte di Pietà, Arcella, Padova, PD, VEN, 35122, Italia	45.4070223	11.8727096	0.001
15734827	Postamat, Viale Felice Cavallotti, Guizza, Padova, PD, VEN, 35125, Italia	45.386856	11.868042	0.001
15927288	Piazza dei Signori, Arcella, Padova, PD, VEN, 35137, Italia	45.407448	11.8727346	0.001
16696149	Via Benedetto Cairoli, Arcella, Padova, PD, VEN, 35137, Italia	45.416552	11.878881	0.001
15956575	Largo Europa, Arcella, Padova, PD, VEN, 35137, Italia	45.4108684	11.8779249	0.001
