14956604	Corso Milano, Arcella, Padova, PD, VEN, 35139, Italia	45.409271	11.8722482	0.001
15638520	Parcheggio Boschetti, Via Gaspare Gozzi, Arcella, Padova, PD, VEN, 35121, Italia	45.4119743	11.8824924	0.001
16514447	Stazione FS, Piazzale della Stazione, Arcella, Padova, PD, VEN, 35137, Italia	45.4174881	11.8787962	0.001
16170266	Comune / Prefettura / Università, Riviera Tito Livio, Madonna Pellegrina, Padova, PD, VEN, 35122, Italia	45.4059429	11.8776116	0.001
17144212	Prato Della Valle, Prato della Valle, Madonna Pellegrina, Padova, PD, VEN, 35123, Italia	45.3999503	11.8763517	0.001
15957850	Carsharing Padova, Piazza Giuseppe Garibaldi, Arcella, Padova, PD, VEN, 35121, Italia	45.4094252	11.8778073	0.001
