15163287	Liceo statale Carlo Montanari, Stradone Scipione Maffei, Quinzano, Verona, VR, VEN, 37125, Italia	45.4372926	10.9963259	0.001
15206305	Istituto Seghetti, Vicolo Volto Cittadella, Quinzano, Verona, VR, VEN, 37125, Italia	45.4362016	10.9924854	0.001
89021655	Istituto salesiano San Zeno, Via Lorenzo Casarini, Chievo, San Massimo all'Adige, Verona, VR, VEN, 37138, Italia	45.4419372	10.9543577040595	0.001
83854725	ITIS Alessandro Rossi, Via Francesco Muttoni, Barche, Parco Città, Vicenza, VI, VEN, 36100, Italia	45.55268745	11.5554667484222	0.001
1750883	I.I.S. Liceo Scienze Sociali   A. Martini, Via Petitti di Roreto, Magrè, Schio, VI, VEN, 36015, Italia	45.715721	11.3542183	0.001
78970489	Istituto Musicale Città di Thiene, Via Carlo Del Prete, Thiene, VI, VEN, 36016, Italia	45.70394535	11.4770236175756	0.001
