51983026	Studio di psicologia dell'età evolutiva e dell'apprendimento, 63, Via Luigi Einaudi, Tassina, Rovigo, RO, VEN, 45100, Italia	45.0497656	11.7827963	0.101
16220338	Studio Tecnico Pretin, 163, Viale Mediterraneo, Brondolo, Chioggia, VE, VEN, 30015, Italia	45.1974901	12.2958452	0.101
45764747	Marco d'Agostino - Studio Grafico, 14, Via Angelo Scarsellini, Legnago, VR, VEN, 37045, Italia	45.1963264	11.3176531	0.101
13988473	Studio Tenda Arredamenti, Via Gregorio Barbarigo, Tribano, PD, VEN, Italia	45.2129149	11.8334833	0.101
26148450	Studio legale, 4, Corso Italia, Quartiere Bisognero, Cavarzere, VE, VEN, 30014, Italia	45.1354272	12.0837095	0.101
23557907	Studio Dentistico Il Sorriso, Largo Don Quirino Maestrello, Villa Bartolomea, VR, VEN, 37049, Italia	45.1386119	11.392428	0.101
