23215518	Teatro Alcuni, Via Ugo Bassi, Santa Maria del Rovere, Treviso, TV, VEN, 31100, Italia	45.6814027	12.2530119	0.001
5080867	Eden, Via 15 Luglio, Stiore, Quartiere Sant'Angelo, Treviso, TV, VEN, 31100, Italia	45.6653101	12.227127	0.001
23215719	Cinema Teatro  Cristallo, Via Giuseppe Garibaldi, Oderzo, TV, VEN, 31046, Italia	45.7806385	12.4916649	0.001
18511279	Teatro Luigi Russolo, Via degli Spalti, Portogruaro, VE, VEN, 30026, Italia	45.777651	12.8391984	0.001
23161400	Auditorium Mario del Monaco, Piazza Europa, Villorba, TV, VEN, Italia	45.7366461	12.2666154	0.001
23050988	Via Cave, Villorba, TV, VEN, 31100, Italia	45.7029351	12.2502539	0.001
43828579	Teatro, Via Giacomo Puccini, San Michele al Tagliamento, VE, VEN, 30028, Italia	45.6312007	13.0186169	0.001
125311304	Teatro Metropolitano Astra, Via Giannino Ancillotto, San Donà di Piave, VE, VEN, 30027, Italia	45.6307327	12.5648222705793	0.001
