30780130	Taxi, Strada S.Maurizio, Caselle Torinese, TO, PIE, 10077, Italia	45.1913349	7.6430449	0.101
17847721	Taxi, Via Lanzo, Ceres, TO, PIE, 100760, Italia	45.311121	7.3896291	0.101
10672655	Corso Costantino Nigra, Borghetto, Ivrea, TO, PIE, 10015, Italia	45.4616346	7.8757349	0.001
100065577	Piazza Roma, Centro, Vercelli, VC, PIE, 13100, Italia	45.3292065	8.41663895	0.001
72758216	Piazza Vittorio Veneto, Porta Milano, Casale Monferrato, AL, PIE, 15033, Italia	45.13399255	8.45974557466777	0.001
17634077	Viale Roma, Venaria Reale, TO, PIE, 10078, Italia	45.1327356	7.6335924	0.001
30675850	NCC, Strada S.Maurizio, Caselle Torinese, TO, PIE, 10077, Italia	45.1924764	7.6431386	0.001
