20050430	Banco di Napoli, Corso Giuseppe Garibaldi, Fragola, Trescene, Benevento, BN, CAM, 82100, Italia	41.1313029	14.778012	0.001
20118680	BNL, Via Traiano, Fragola, Porta Rufina, Benevento, BN, CAM, 82100, Italia	41.1318575	14.7784557	0.001
18715507	Via del Pomerio, Fragola, Trescene, Benevento, BN, CAM, 82100, Italia	41.133261	14.7777174	0.001
35752298	POSTE iTALIANE, Via Maestri del lavoro, Caserta, Tredici, Caserta, CE, CAM, 81100, Italia	41.0777139	14.3600262	0.001
13419782	Piazza della Seta, Caserta, Briano, Caserta, CE, CAM, 81022, Italia	41.0986191	14.3156356	0.001
20745975	Poste Italiane, Via Ferrarecce, Caserta, San Benedetto, Caserta, CE, CAM, 81100, Italia	41.066464	14.3374354	0.001
