28541152	BCC, Via Nazionale, Tolve, PZ, BAS, 85017, Italia	40.6959819	16.0196164	0.001
33401629	Alberga, Pietrapertosa, PZ, BAS, Italia	40.5045119	16.1048688	0.001
129501477	Piazza Emilio Caizzo, Castelmezzano, PZ, BAS, Italia	40.5302569	16.0466537	0.001
2597580558	bper, Via della Matine, Tricarico, MT, BAS, 75019, Italia	40.618869	16.1493079602788	0.001
2596487260	Piazza Raffaello delle Nocche, Tricarico, MT, BAS, 75019, Italia	40.6242417	16.1438007	0.001
2597793819	via r. scotellaro, Tricarico, MT, BAS, 75019, Italia	40.6195703	16.148103	0.001
