40685594	Via dei Cappuccini, Peccioli, PI, TOS, 56037, Italia	43.55665	10.71925	0.001
49467384	Via Silvestro Lega, Peccioli, PI, TOS, Italia	43.555723	10.7113036	0.001
50762687	Via di Legoli, Peccioli, PI, TOS, 56037, Italia	43.5721518	10.7965079	0.001
41482523	Via San Sebastiano, Peccioli, PI, TOS, 56036, Italia	43.55682	10.71923	0.001
51931822	Via l'altare, Podere l'altare, Peccioli, PI, TOS, 56037, Italia	43.5746407	10.7921371	0.001
6418501	Via Gotti, Lajatico, PI, TOS, Italia	43.4757729	10.7285108	0.001
