24928310	Cafe Piazetta, Via Calvino, Castiglione della Pescaia, GR, TOS, 58043, Italia	42.7637999	10.8812563	0.101
28279637	Via della Seppia, Grosseto, GR, TOS, 58046, Italia	42.6970512	11.0027552	0.001
25297459	Sol caffé, Piazza Gioberti, Grosseto, GR, TOS, 58100, Italia	42.7596303	11.1121929	0.001
28249681	Via del Tirreno, Grosseto, GR, TOS, 58046, Italia	42.6974317	11.003305	0.001
52128444	ce lhai fata, Viale della Repubblica, Grosseto, GR, TOS, 58100, Italia	42.756312	11.1026422	0.001
24264232	Caffé Carducci, Corso Carducci, Grosseto, GR, TOS, 58100, Italia	42.7605961	11.1132098	0.001
4183661	Hawaii, 35, Piazza del Combattente, Alberese, Podere Le Tofane, Grosseto, GR, TOS, Italia	42.668732	11.1049702	0.001
942677	Bar Pizzeria La Corte, Via del Borgo, Castiglione della Pescaia, GR, TOS, Italia	42.7901342	10.8229587	0.001
24178291	Via IV Novembre, Castiglione della Pescaia, GR, TOS, 58043, Italia	42.7641012	10.8825171	0.001
