130046962	via Dorsale, Massa, MS, TOS, 54100, Italia	44.0250318	10.1107488163735	0.001
143280900	Via degli Artigiani, Massa, MS, TOS, 54100, Italia	44.02706315	10.1102586	0.001
43989005	Viale Risorgimento, Massa, MS, TOS, 54100, Italia	44.0297385	10.1441378	0.001
19585349	SP Calavorno Campia, Molazzana, LU, TOS, 55020, Italia	44.081296	10.4431191	0.001
20050127	SP Calavorno Campia, Gallicano, LU, TOS, 55027, Italia	44.067173	10.440866	0.001
38585403	Viale Umberto I, Paretaio, Desertoli, Bagni di Lucca, LU, TOS, 55022, Italia	44.0045294	10.5837345	0.001
