90369019	Croce Verde Viareggio, Corso Giuseppe Garibaldi, Viareggio, LU, TOS, 55049, Italia	43.8685864	10.254595851516	0.001
50438695	Misericordia di Vecchiano, Via XX Settembre, Castello, Vecchiano, PI, TOS, 56019, Italia	43.780789	10.3856103	0.001
28351138	Pubblica Assistenza Valdiserchio, 70, Via Alcide De Gasperi, San Giuliano Terme, PI, TOS, 56019, Italia	43.7819581	10.402434	0.001
24232675	Via Statale Abetone, San Giuliano Terme, PI, TOS, 56017, Italia	43.795017	10.4226054	0.001
28751846	Pubblica Assistenza San Giuliano Terme, 4, Via Martin Luther King, Cafaggio, San Giuliano Terme, PI, TOS, 56017, Italia	43.7633582	10.4375569	0.001
28658928	Pubblica Assistenza Gello, 83, Via Giacomo Matteotti, Cafaggio, San Giuliano Terme, PI, TOS, 56010, Italia	43.7575197	10.4267731	0.001
101508492	A.S.L. 5, 5, Via Martin Luther King, Cafaggio, San Giuliano Terme, PI, TOS, 56010, Italia	43.7627362	10.4371090520143	0.001
