139446321	Viale dei Ponti, Le Cetine, Volterra, PI, TOS, 56048, Italia	43.40032765	10.8599437618269	0.001
139649537	Fonti di San Felice, Viale Trento e Trieste, Le Cetine, Volterra, PI, TOS, 56048, Italia	43.40315685	10.855842678676	0.001
140152979	Via Giusto Landini, Il Crocifisso, Volterra, PI, TOS, 56048, Italia	43.39884155	10.8562185300419	0.001
136903312	Via Luigi Scabia, Pagliaio, Volterra, PI, TOS, 56048, Italia	43.40663755	10.87451645	0.001
138709372	Fontanella, Via Giusto Landini, Il Crocifisso, Volterra, PI, TOS, 56048, Italia	43.39883355	10.8563824638889	0.001
142003396	Fonte del Pino, Via dei Cappuccini, Le Cetine, Volterra, PI, TOS, 56048, Italia	43.39853115	10.8613462045583	0.001
138877452	Fonti di Docciola, Via delle Fonte, Le Cetine, Volterra, PI, TOS, 56048, Italia	43.40268175	10.863037	0.001
