6603339	Viale Luchini, Radicofani, SI, TOS, Italia	42.8966737	11.7664812	0.001
15600790	Farmacia Speroni, Viale Antonio Gramsci, Piancastagnaio, SI, TOS, 53025, Italia	42.8491888	11.6905797	0.001
51326874	Via Emilio Alessandrini, Caldana, Casetta Nova, Gavorrano, GR, TOS, 58023, Italia	42.8942404	10.9239787	0.001
16812347	Farmacia Petitto, Strada Provinciale 152 Aurelia Vecchia, Santa Croce, Gavorrano, GR, TOS, Italia	42.9444695	10.8371873	0.001
47053447	Via Isidoro Maggi, Podere dei Nobili, Arcidosso, GR, TOS, 58032, Italia	42.8719345	11.5390064	0.001
11451784	Ugurgeri, Via Federico Hamman, Abbadia San Salvatore, SI, TOS, 53021, Italia	42.8817902	11.6725715	0.001
41529036	Via Sant'Anna, Castiglione d'Orcia, SI, TOS, 53023, Italia	42.9330911	11.6408737	0.001
7386957	Piazza Giuseppe Garibaldi, Santa Fiora, GR, TOS, 58037, Italia	42.8314925	11.5857531	0.001
7642333	Castel del Piano, Via Dante Alighieri, Castel del Piano, GR, TOS, Italia	42.8909745	11.5354772	0.001
