17992569	River Pub, 160, Via Covona, Quarrata, PT, TOS, 51039, Italia	43.8387774	10.9675418	0.101
6987089	Via Manrico Ducceschi, Case Bergamo, Pistoia, PT, TOS, 2, Italia	43.9304325	10.920771	0.001
7022247	Via Campo Marzio, Case Bergamo, Pistoia, PT, TOS, 2, Italia	43.930193	10.920028	0.001
18524605	La Degna Tana, Piazza della Sala, Case Bergamo, Pistoia, PT, TOS, 2, Italia	43.9328033	10.9162532	0.001
26706601	La Vecchia Praga, Piazza della Sala, Case Bergamo, Pistoia, PT, TOS, 2, Italia	43.9329336	10.9165938	0.001
18081373	The Wall Taverna Fantasy, Via Pisa, Pistoia, PT, TOS, 2, Italia	43.9119061	10.9176159	0.001
18502377	Caffè Sotto i Portici, Piazza del Grano, Cafaggio, Pescia, PT, TOS, 51017, Italia	43.9016778	10.6885079	0.001
17012769	Victoria, Via di Montalbano, Lamporecchio, PT, TOS, 51036, Italia	43.8370726	10.9193292	0.001
2597832149	Murphy's, Via Antonio Gramsci, Massa e Cozzile, PT, TOS, 51016, Italia	43.8711311	10.7607067	0.001
