823374	Scuola media Giovanni Pascoli, Via Elio Bernabei, Monte Melio, Montepulciano, SI, TOS, 53045, Italia	43.0982093	11.7887259	0.001
49142540	European Academy for Music and Performing Arts Montepulciano, 11, Via Ricci, San Salvagio di Sopra, Montepulciano, SI, TOS, 53045, Italia	43.0932466	11.7807806	0.001
108256000	Istituto Superiore Poliziano, Via San Martino, Monte Melio, Montepulciano, SI, TOS, 53045, Italia	43.09806665	11.7945314230044	0.001
103161538	Scuola Media 'Virgilio', Via Roma, Montepulciano, SI, TOS, Italia	43.13363835	11.8565257496842	0.001
81531998	Scuola elementare Edmondo De Amicis, Viale Primo Maggio, Monte Melio, Montepulciano, SI, TOS, 53045, Italia	43.09508575	11.7851841865155	0.001
118418358	Scuola Media, Via dello Stadio, Chianciano Terme, SI, TOS, 53042, Italia	43.05781525	11.826606488646	0.001
