14937954	Terontola-Cortona, Via XX Settembre, Terontola, Cortona, AR, TOS, 52044, Italia	43.2103599	12.0077932	0.18177847009039
3979430	Camucia-Cortona, Viale Regina Elena, Cortona, AR, TOS, 52044, Italia	43.2611368	11.9712386	0.001
654957	Sinalunga, Piazza della Repubblica, Logo, Sinalunga, SI, TOS, 53048, Italia	43.2161839	11.7449215	0.001
6495910	Rigomagno, Via Walter Tobagi, Castelvecchio di Farnetella, Sinalunga, SI, TOS, Italia	43.256726	11.7064586	0.001
17972982	Lucignano, Strada Provinciale della Misericordia, Molino della Vescina, Lucignano, AR, TOS, 52047, Italia	43.2866339	11.773885	0.001
14515864	Castiglion Fiorentino, Via Misericordia, Castiglion Fiorentino, AR, TOS, Italia	43.3408433	11.9143232	0.001
8064738	Monte San Savino, Costa del Giardino, Monte San Savino, AR, TOS, Italia	43.3320808	11.7316865	0.001
