19577505	Banca Carime, Via Indipendenza, Catanzaro, Siano, Catanzaro, CZ, CAL, 88100, Italia	38.9122254	16.5870788	0.001
19577459	Banco di Napoli, Via Milano, Catanzaro, Pontepiccolo, Catanzaro, CZ, CAL, 88100, Italia	38.9126658	16.5862899	0.001
33386041	Via Cristoforo Colombo, Catanzaro, CZ, CAL, Italia	38.8187791	16.6121467	0.001
120031306	BCC del Lametino, Via Mazzini, Pianopoli, CZ, CAL, 88040, Italia	38.95153635	16.3877181099082	0.001
49468408	Monte dei Paschi di Siena, Via del Mare, Sant'Eufemia Lamezia, Lamezia Terme, CZ, CAL, 88046, Italia	38.9215699	16.253214	0.001
51931672	SP13, Sellia, CZ, CAL, 88050, Italia	38.982459	16.6276216	0.001
129895024	Banca credito cooperativo, Via Tesoro, Villaggio Stumio, Isola di Capo Rizzuto, KR, CAL, 88841, Italia	38.95953405	17.0948870992514	0.001
38513886	Contrada Mendolicchia, Villaggio Stumio, Isola di Capo Rizzuto, KR, CAL, 88841, Italia	38.9205598	17.1220788	0.001
39812496	Strada Statale 106 Jonica, Campolongo, Villaggio Serenè, CAL, Italia	38.9407786	16.9645416	0.001
