50807601	Via Simone da Bisignano, Bisignano, CS, CAL, Italia	39.5145278	16.2867625	0.001
1516980	Farmacia Cotroneo, 54, Corso Vittorio Veneto, Bisignano, CS, CAL, Italia	39.5136698	16.2844052	0.001
1530672	Farmacia Berlingieri Andrea, 5, Via Principe di Piemonte, Bisignano, CS, CAL, Italia	39.5126273	16.2872674	0.001
6268319	Corso Italia, Bisignano, CS, CAL, Italia	39.5024236	16.2682875	0.001
47035753	Farmacia Antica Normanna Sas di Lipari Alessandra & C., SP94, San Marco Argentano, CS, CAL, 87018, Italia	39.5555649	16.1191729	0.001
48550608	Farmacia Pisano Anna, SP94, San Marco Argentano, CS, CAL, 87018, Italia	39.5575499	16.1178331	0.001
49068133	Parafarmacia, SS283, San Marco Argentano, CS, CAL, 87017, Italia	39.5976466	16.1953048	0.001
