137148113	Rossano, Piazza Leonardo da Vinci, Rossano, CS, CAL, 87068, Italia	39.60286495	16.6408599866959	0.001
49137879	Mongrassano-Cervicati, SP241 ex SS19, Bisignano, CS, CAL, Italia	39.5385246	16.2225065	0.001
142258066	Cetraro, via Stazione, Cetraro, CS, CAL, Italia	39.5126302	15.9393632842891	0.001
129501280	Calopezzati, Strada Statale 106 Jonica, Calopezzati, CS, CAL, Italia	39.5789942	16.8192401432347	0.001
130539067	Mandatoriccio-Campana, Strada Statale 106 Jonica, Mandatoriccio, CS, CAL, Italia	39.52530325	16.8930787	0.001
128484862	Mirto-Crosia, Strada Statale 106 Jonica, Crosia, CS, CAL, Italia	39.60472405	16.7773438561631	0.001
15907118	San Marco Roggiano, SS283, San Marco Argentano, CS, CAL, 87017, Italia	39.6052324	16.2086759	0.001
98398491	Capo Bonifati, SP263, Sant'Agata di Esaro, CS, CAL, Italia	39.55841175	15.8741668695417	0.001
44052655	Torano-Lattarico, SP106, Torano Castello, CS, CAL, Italia	39.4945511	16.2104697	0.001
