143648480	Teatro Belluscio, Via Balbia, Altomonte, CS, CAL, Italia	39.6983787	16.1306634689719	0.001
106032202	SS18, Diamante, CS, CAL, 87023, Italia	39.71722655	15.8216996719651	0.001
18976785	Strada Statale 106 Jonica, Cassano allo Ionio, CS, CAL, Italia	39.7532533	16.4841744	0.001
2601524112	Via Pitagora, Cassano allo Ionio, CS, CAL, Italia	39.7484135	16.4922074073403	0.001
101704886	Strada Statale 106 Jonica, Cassano allo Ionio, CS, CAL, Italia	39.74908965	16.4827612500275	0.001
19363415	Via Toledo, Cassano allo Ionio, CS, CAL, Italia	39.7431113	16.4810509	0.001
