46714620	Monte dei Paschi di Siena, Viale Europa, Quartiere Lombardo, Messina, ME, SIC, 98123, Italia	38.1797651	15.5491068	0.001
42798528	Credem, 57, Via Camiciotti, IV Circoscrizione, Messina, ME, SIC, 98123, Italia	38.1839401	15.5539818	0.001
43262781	Banca Intesa, 81, Via Bixio, IV Circoscrizione, Messina, ME, SIC, 98123, Italia	38.1830125	15.5528672	0.001
46894985	BPER, Via Cesare Battisti, IV Circoscrizione, Messina, ME, SIC, 98123, Italia	38.1825966	15.5492978	0.001
47123306	Banco di Sicilia, Via Garibaldi, IV Circoscrizione, Messina, ME, SIC, 98122, Italia	38.1900228	15.5566768	0.001
46478925	Intesa Sanpaolo, Via Manara, IV Circoscrizione, Messina, ME, SIC, 98123, Italia	38.1828009	15.554893	0.001
43117128	Banca Carige, 75, Via Bixio, IV Circoscrizione, Messina, ME, SIC, 98123, Italia	38.182953	15.5529756	0.001
