26801789	Autolavaggio Inter Club, 317, Via Venezia, Gela, Albani Roccella, Gela, CL, SIC, 93012, Italia	37.0744911	14.2454451	0.001
21132820	Via Venezia, Gela, Scavone, Gela, CL, SIC, 93012, Italia	37.0805065	14.2199134	0.001
135686298	Largo Pompei, Gela, Albani Roccella, Gela, CL, SIC, 93012, Italia	37.06595915	14.2556729448681	0.001
10827028	Via Salso, Comiso, RG, SIC, Italia	37.0235625	14.5754779	0.001
10215268	Autolavaggio Saraceno, Corso Umberto I, Acate, RG, SIC, 97011, Italia	37.0259115	14.4979538	0.001
10264241	Roccuzzo G., Strada provinciale Comiso-Chiaramonte, Chiaramonte Gulfi, RG, SIC, 97012, Italia	37.0249767	14.6553113	0.001
2602810419	Via Giuseppe Campailla, Casa Famolio, Palazzolo Acreide, SR, SIC, Italia	37.06988105	14.9136390344839	0.001
