79338698	Scuola D'Arte, Via Galileo Galilei, Casa Arezzo, Comiso, RG, SIC, 97013, Italia	36.95193915	14.6089842511398	0.001
11602034	Via Roma, Casa Nifosì, Comiso, RG, SIC, 97013, Italia	36.9407799	14.6017702	0.001
71295290	Via Giovanni Falcone, Casa Arezzo, Comiso, RG, SIC, 97013, Italia	36.95820945	14.6034410538862	0.001
5783656	Istituto Tecnico Commerciale, Via Giovanni Falcone, Casa Arezzo, Comiso, RG, SIC, 97013, Italia	36.9581644	14.6034843	0.001
72235302	Licero Classico G.Curcio, Via Vittorio Veneto, Scorsone Modica, Ispica, RG, SIC, 97014, Italia	36.7867174	14.9038846	0.001
70715115	Liceo Classico  G.Curcio, Via Leonardo da Vinci, Casa Lanzagallo di Sopra, Ispica, RG, SIC, 97014, Italia	36.78826045	14.8955462263266	0.001
774934	Liceo Linguistico J.F.Kennedy, Corso Giuseppe Garibaldi, Scorsone Modica, Ispica, RG, SIC, 97014, Italia	36.7871822	14.9098296	0.001
