99715266	Palazzetto della sanità, Via Emilio Bufardeci, Tiche, Siracusa, SR, SIC, 96100, Italia	37.08491955	15.277695507516	0.001
2601812704	Asp Siracusa - area ex Onp, Traversa La Pizzuta, Tiche, Siracusa, SR, SIC, 96100, Italia	37.08672265	15.2665127891834	0.001
100658436	Traversa La Pizzuta, Tiche, Siracusa, SR, SIC, 96100, Italia	37.0865304	15.2665577118085	0.001
44123314	Via Leonardo Sciascia, Gela, Caposoprano, Gela, CL, SIC, 93012, Italia	37.0721601	14.233674	0.001
47818900	Ambulatorio Medico Cinardo Finuccia, 95, Via Nicolò Minardi, Gela, Fondo Iozza, Gela, CL, SIC, 93012, Italia	37.0695523	14.240012	0.001
10893858	Guardia Medica, Via Salso, Comiso, RG, SIC, Italia	37.0240815	14.5832909	0.001
14499217	guardia medica, Via Nazionale, Casa Famolio, Palazzolo Acreide, SR, SIC, Italia	37.0591965	14.9111398	0.001
