24529816	Centro Studi  F. Rossitto, Via Ducezio, Selvaggio, Ragusa, RG, SIC, 97100, Italia	36.9144792	14.726529	0.001
23245801	Biblioteca  G. Verga, Via Pompei, Selvaggio, Ragusa, RG, SIC, 97100, Italia	36.915321	14.7216082	0.001
17223008	Biblioteca La Rocca, Via Nazionale, Casa Emmolo, Scicli, RG, SIC, 97018, Italia	36.7955236	14.7077909	0.001
5608642	Via Unità, Vitanovella, Pachino, SR, SIC, 96018, Italia	36.7179563	15.0897354	0.001
3964210	Biblioteca Comunale Luigi Capuana, Corso Giuseppe Garibaldi, Scorsone Modica, Ispica, RG, SIC, 97014, Italia	36.7869861	14.9097553	0.001
41045915	Biblioteca Comunale di Pozzallo, 79, Via Scaro, Carpintera, Pozzallo, RG, SIC, 97016, Italia	36.7321975	14.8539192	0.001
