27402950	Polizia Stradale, Viale Ferdinando Magellano, Caltagirone, CT, SIC, Italia	37.2148886	14.5237449	0.001
22261779	Carabinieri, Viale Ferdinando Magellano, Caltagirone, CT, SIC, Italia	37.2147759	14.5233978	0.001
23219180	Commissariato Polizia di Stato, Via Circonvallazione, Caltagirone, CT, SIC, Italia	37.2351087	14.5127498	0.001
22751787	Carabinieri, Piazza Regina Margherita, Scordia, CT, SIC, 95068, Italia	37.2925765	14.84284	0.001
17863149	Carabinieri, Piazza del Carmine, Augusta, SR, SIC, 96011, Italia	37.2310317	15.2220244	0.001
17427250	Compagnia Guardia di Finanza, Via Xifonia, Augusta, SR, SIC, 96011, Italia	37.2262066	15.2230916	0.001
21798383	Carabinieri, Piazza Giuseppe Garibaldi, Francofonte, SR, SIC, Italia	37.2308913	14.8806778	0.001
20960003	Carabinieri, Via Roma, Mineo, CT, SIC, 95044, Italia	37.2698356	14.6930187	0.001
