19438510	Pub Bonadies, Piazza Duomo, Giarre, CT, SIC, 95014, Italia	37.7270914	15.1831911	0.101
16144864	The Viking, 16, Via Girolamo Gravina, Centro San Giovanni Galermo-Trappeto-Cibali, Catania, CT, SIC, 95123, Italia	37.5503819	15.052723	0.001
117735678	Giza, 11, Via Finocchiaro, Acireale, CT, SIC, 95024, Italia	37.62709345	15.1540169823193	0.001
69502094	La Caverna del Mastro Birraio, 40, Via Sclafani, Acireale, CT, SIC, 95020, Italia	37.6219632	15.1465965382439	0.001
126822387	Solarium BoraBora, Via Molino, Acireale, CT, SIC, 95024, Italia	37.6135258	15.1737979338241	0.001
26914344	Giaca, Via Giuseppe Garibaldi, Cava, Viagrande, CT, SIC, 95039, Italia	37.6110214	15.099024	0.001
1287966	Albatros, Via Raffaello Sanzio, Gravina di Catania, CT, SIC, 95037, Italia	37.5637204	15.0597163	0.001
