2602851341	Scuola primaria Capizzi, Via Roma, Capizzi, ME, SIC, 98031, Italia	37.84977535	14.4812975671077	0.001
2602851330	Scuola secondaria di primo grado  Luigi Sanzo, Via Sandro Pertini, Capizzi, ME, SIC, 98031, Italia	37.8515327	14.4812322	0.001
39243866	Scuola Primaria Comunale, Strada Provinciale 168, Casa Pantanoscuro, Caronia, ME, SIC, Italia	38.0239063	14.442205	0.001
128394452	Largo San Luca, Pettineo, ME, SIC, Italia	37.9664289	14.2942088441778	0.001
129055632	Scuola Media, SP176, Pettineo, ME, SIC, Italia	37.96857985	14.2894849382948	0.001
2598440238	Scuola Media  Giovanni Zizolfi, Via Ugo Bassi, Mirto, ME, SIC, Italia	38.0852449	14.7523195	0.001
120113274	Istituto Comprensivo n° 1  Tomasi di Lampedusa, Via Roma, Capo d'Orlando, ME, SIC, 98071, Italia	38.1589975	14.744324870451	0.001
121529485	Istituto Tecnico Commerciale statale Francesco Paolo Merendino, lungomare Andrea Doria, Capo d'Orlando, ME, SIC, 98071, Italia	38.15735555	14.7395002986342	0.001
51716787	Istituto Regionale d'Arte per la Ceramica, Via Paolo Perez, Santo Stefano di Camastra, ME, SIC, 98077, Italia	38.0129935	14.3480116	0.001
