51455288	Via Fratelli Ceci, Marsciano, PG, UMB, 06055, Italia	42.9855128	12.2803928	0.001
45831000	Largo Goldoni, Marsciano, PG, UMB, 06055, Italia	42.9098696	12.3373819	0.001
35520409	Banca Popolare di Ancona, Corso Vittorio Emanuele II, Collazzone, PG, UMB, 06050, Italia	42.9000623	12.4359407	0.001
124768620	Banca Popolare di Spoleto, Via della Circonvallazione, Gualdo Cattaneo, PG, UMB, 06035, Italia	42.91091845	12.556265618135	0.001
25422347	Largo Alcide de Gasperi, San Felice, Giano dell'Umbria, PG, UMB, 06030, Italia	42.8711511	12.5597918	0.001
25149147	Casse di Risparmio dell Umbria, 22, Via Roma, San Felice, Giano dell'Umbria, PG, UMB, 06030, Italia	42.8704149	12.5586619	0.001
25243104	Banca popolare di Ancona, Via Roma, San Felice, Giano dell'Umbria, PG, UMB, 06030, Italia	42.8678082	12.5543108	0.001
