10304671	Cassa di Risparmio di Terni e Narni, Via Giacomo Brodolini, Vocabolo Pentima Bassa, Terni, TR, UMB, 05100, Italia	42.5436642	12.6449585	0.001
6194204	Casse di Risparmio dell'Umbria, Corso Cornelio Tacito, Vocabolo Pentima Bassa, Terni, TR, UMB, 05100, Italia	42.5641793	12.6482717	0.001
22546026	Corso del Popolo, Vocabolo Pentima Bassa, Terni, TR, UMB, 05100, Italia	42.5590014	12.6459494	0.001
8513068	BNL - Gruppo BNP Paribas, Viale Cesare Battisti, Vocabolo Pentima Bassa, Terni, TR, UMB, 05100, Italia	42.5663734	12.6486154	0.001
6115145	Cassa di Risparmio Terni, Via del Rivo, Terni, TR, UMB, 05100, Italia	42.5810172	12.6211526	0.001
7852157	Carit, Viale Donato Bramante, Vocabolo Pentima Bassa, Terni, TR, UMB, 05100, Italia	42.5710632	12.6343766	0.001
8338110	Casse di Risparmio dell'Umbria, Viale Giuseppe Mazzini, Vocabolo Pentima Bassa, Terni, TR, UMB, 05100, Italia	42.5658804	12.6520318	0.001
6192858	Casse di Risparmio dell'Umbria, Via Nazario Sauro, Vocabolo Pentima Bassa, Terni, TR, UMB, 05100, Italia	42.5659608	12.642748	0.001
7983638	Cassa di Risparmio di Terni e Narni, Piazzale Tristano di Jannuccio, Vocabolo Pentima Bassa, Terni, TR, UMB, 05100, Italia	42.555604	12.6575878	0.001
