21481491	Santi Peccatori Café, Via delle Lettere, Spoleto, PG, UMB, 06049, Italia	42.7428874	12.7416438	0.001
20153348	Da Sergio Caffé, Piazza della Vittoria, Spoleto, PG, UMB, 06049, Italia	42.7403659	12.7380221	0.001
46407198	Caffé Tropicana, Strada Regionale 418 Spoletina, Spoleto, PG, UMB, 06049, Italia	42.7254517	12.6640844	0.001
26584398	Caffé Letterario, Via Fiordespina Lauri, Spoleto, PG, UMB, 06049, Italia	42.7327404	12.7366647	0.001
35794952	Strada Regionale 320dir di Cascia, Cascia, PG, UMB, 06043, Italia	42.721529	13.0184904	0.001
26999012	Bar, Via di Borgo, Scheggino, PG, UMB, 06040, Italia	42.7124272	12.8307096	0.001
24192259	Bar, Via della Stazione, Sant'Anatolia di Narco, PG, UMB, 06040, Italia	42.7329639	12.8353391	0.001
4054123	Bar Alberto, Ex ferrovia Spoleto-Norcia, Sant'Anatolia di Narco, PG, UMB, 06040, Italia	42.7356794	12.8355456	0.001
7533056	Snack bar valnerina, Strada Statale 685 delle Tre Valli Umbre, Vallo di Nera, PG, UMB, 06040, Italia	42.7680844	12.8627157	0.001
