16530362	Ristorante Da Elio, Strada Regionale 220 Pievaiola, Piegaro, PG, UMB, 06066, Italia	42.9745269	12.0874858	0.001
42723695	Ristorante  La Bettola del Buttero, Via dei Pini, Fabro, TR, UMB, 05015, Italia	42.8740725	12.0210858	0.001
41952547	La Taverna di Lanzi Genoveffa, Via del Castello, Fabro, TR, UMB, 05015, Italia	42.8637921	12.0131865	0.001
45821092	Ristorante  Il Focolare, Strada provinciale del casello autostradale di Fabro, Fabro, TR, UMB, 05015, Italia	42.8752065	12.0222192	0.001
44053246	Mondo Pizza, Contrada della Stazione, Fabro, TR, UMB, 05015, Italia	42.8727181	12.0169085	0.001
18144503	Strada provinciale di Città della Pieve, Città della Pieve, PG, UMB, 06062, Italia	42.9326571	11.9676756	0.001
49014338	Il Fornello Country House, Strada provinciale di Moiano, Città della Pieve, PG, UMB, 06062, Italia	42.9895047	12.0355564	0.001
49511539	Dandy's rist. piz., 20, Via Giuseppe Garibaldi, historic center, Città della Pieve, PG, UMB, 06062, Italia	42.9515885	12.0016391	0.001
