15431048	Posteitaliane, Via Braccianense, Galeria (Rovine), Roma, RM, LAZ, 00123, Italia	42.0362489	12.3091736	0.001
18579157	Banca di Capranica, SP3B, Tolfa, RM, LAZ, 00051, Italia	42.1497522	11.9375451	0.001
18128994	Banca Popolare di Milano, Viale d'Italia, Tolfa, RM, LAZ, 00051, Italia	42.150153	11.9381508	0.001
31481025	Strada Statale 1 Aurelia, Colfiorito, Santa Marinella, RM, LAZ, 00058, Italia	42.0351644	11.8638564	0.001
30703320	Via Carso, Colfiorito, Santa Marinella, RM, LAZ, 00058, Italia	42.0356609	11.8663864	0.001
620914	Via Leonardo da Vinci, Bassano Romano, VT, LAZ, Italia	42.2222779	12.1895725	0.001
