145133345	Corte Suprema di Cassazione, Piazza Cavour, Prati, Municipio Roma I, Roma, RM, LAZ, 00193, Italia	41.9041557	12.4704397389962	0.20436424356534
95014812	Corte di Appello di Roma, Via Antonio Varisco, Della Vittoria, Municipio Roma I, Roma, RM, LAZ, 00136, Italia	41.9155305	12.4503989473705	0.001
6770271	Tribunale, Via Golametto, Della Vittoria, Municipio Roma I, Roma, RM, LAZ, 00195, Italia	41.9158361	12.4522998	0.001
14106568	Tribunale Civile di Roma, Via Lepanto, Prati, Municipio Roma I, Roma, RM, LAZ, 00196, Italia	41.9122422	12.4659627	0.001
18713522	Tribunal Vaticana, Quadratum Sancti Stephani, 00120, Civitatis Vaticanæ	41.9013235	12.4521648	0.001
70834572	Praetorium et officia Gendarmerie, Quadratum Sancti Stephani, 00120, Civitatis Vaticanæ	41.90130255	12.4521478324976	0.001
