14790175	Studio Dentistico, Via Anneo Floro, Balduina, Trionfale, Municipio Roma XIV, Roma, RM, LAZ, 00136, Italia	41.9110929	12.4413866	0.101
19823093	Studio Dentistico Dot. Carmine Parisi, 15, Via Pollenza, San Basilio, Municipio Roma IV, Roma, RM, LAZ, 00156, Italia	41.9420778	12.5741778	0.101
45106432	Bludental, 30, Piazza Carlo Mazzaresi, Balduina, Trionfale, Municipio Roma XIV, Roma, RM, LAZ, 00136, Italia	41.9203582	12.4415981	0.001
15501014	Ospedale Odontoiatrico George Eastman, Viale Regina Elena, Nomentano, Municipio Roma II, Roma, RM, LAZ, 00161, Italia	41.9072699	12.514512	0.001
38240661	Studio Elianto Odontoiatria, 289, Via Conca d'Oro, Monte Sacro, Municipio Roma III, Roma, RM, LAZ, 00141, Italia	41.9438327	12.5188923	0.001
16085425	Giancotti, Viale Regina Margherita, Nomentano, Municipio Roma II, Roma, RM, LAZ, 00161, Italia	41.9101929	12.5105433	0.001
