6164642	Biblioteca comunale, Piazza Giuseppe Verdi, Viterbo, VT, LAZ, 01100, Italia	42.4208418	12.1077517	0.001
52171245	Biblioteca Comunale Vincenzo Cardarelli, 34, Via Umberto I, Tarquinia, VT, LAZ, 01016, Italia	42.2520989	11.7559242	0.001
50648465	Biblioteca Comunale Dante Alighieri, 5, via Umberto I, Tarquinia, VT, LAZ, 01016, Italia	42.2528556	11.7558173	0.001
44649642	Biblioteca Comunale, Piazza della Vittoria, Valentano, VT, LAZ, 01018, Italia	42.5682577	11.8193267	0.001
125415626	via dei Pozzi, Blera, Puntoni, Blera, VT, LAZ, 01010, Italia	42.2752011	12.0252836925364	0.001
39638430	Biblioteca  Domenico Mantovani, via Roma, Blera, Puntoni, Blera, VT, LAZ, 01010, Italia	42.2752439	12.0256124	0.001
132998779	Biblioteca Comunale, Via Guido Rossa, Canepina, VT, LAZ, 01030, Italia	42.3835174	12.2311073846802	0.001
626002	Via degli Anguillara, Capranica, VT, LAZ, 01012, Italia	42.2557921	12.1817222	0.001
