5982037	Priverno-Fossanova, Via dello Staturo, Pontinia, LT, LAZ, Italia	41.4216823	13.186832	0.20748690992775
8280698	Latina, Piazzale Lelia Caetani, Latina, LT, LAZ, 04013, Italia	41.538182	12.9462886	0.20108919297929
6001394	Sezze Romano, Piazza della Repubblica, Sezze, LT, LAZ, 04018, Italia	41.4955675	13.0384018	0.18611063262914
4194991	Terracina, Stradone della Valle, Porto Badino, Terracina, LT, LAZ, 04019, Italia	41.2980922	13.2407416	0.046527658157285
16881439	La Fiora, Strada Consolare, Borgo Hermada, Terracina, LT, LAZ, 04019, Italia	41.3329895	13.1986098	0.001
6822692	Frasso, Via Maurizio Subiaco, Terracina, LT, LAZ, Italia	41.3660848	13.2008602	0.001
6568911	Ruderi di Sibilla, Via Ruderi di Sibilla, Sonnino, LT, LAZ, Italia	41.3852907	13.1994921	0.001
6828766	Capocroce, Via Stazione di Capocroce, Sonnino, LT, LAZ, Italia	41.4006382	13.2047522	0.001
