17706256	Viale Japigia, Libertà, Bari, BA, PUG, 70126, Italia	41.1159404	16.8912675	0.001
12402701	Unicredit, Viale Papa Giovanni XXIII, Libertà, Bari, BA, PUG, 70124, Italia	41.1068634	16.8618518	0.001
17537024	Corso Cavour, Libertà, Bari, BA, PUG, 70121, Italia	41.1211756	16.87268	0.001
45825261	Via Gioacchino Toma, Libertà, Bari, BA, PUG, 70125, Italia	41.1089014	16.8738413	0.001
11077150	UniCredit Banca, Via Don Luigi Guanella, Santa Rita, Bari, BA, PUG, 70124, Italia	41.0948226	16.8623414	0.001
46895309	Viale Luigi Sturzo, Libertà, Bari, BA, PUG, 70125, Italia	41.1072301	16.8736578	0.001
47449149	Unicredit Banca, 118, Via Giovanni Amendola, Carbonara, Bari, BA, PUG, 70126, Italia	41.1127223	16.8821439	0.001
2529373	San Paolo Banco di Napoli, 56/A, Viale della Repubblica, Libertà, Bari, BA, PUG, 70125, Italia	41.1106985	16.8742757	0.001
10113058	Banca Monte dei Paschi di Siena, Via Arcidiacono Giovanni, Libertà, Bari, BA, PUG, 70124, Italia	41.1031804	16.8598454	0.001
46838658	Viale della Repubblica, Libertà, Bari, BA, PUG, 70125, Italia	41.1080385	16.873903	0.001
3676599	San Paolo Banco di Napoli, Via Caduti di Via Fani, Libertà, Bari, BA, PUG, 70121, Italia	41.1183123	16.8711443	0.001
831634	Banca Nazionale del Lavoro, Via Giuseppe Capruzzi, Libertà, Bari, BA, PUG, 70126, Italia	41.1168016	16.8690638	0.001
45937035	Via Bona Sforza, Libertà, Bari, BA, PUG, 70125, Italia	41.1082992	16.8743509	0.001
11232876	BNL, Via Camillo Rosalba, Santa Rita, Bari, BA, PUG, 70124, Italia	41.0971066	16.8552091	0.001
11215504	UniCredit Banca, Via Papa Pio XII, Libertà, Bari, BA, PUG, 70124, Italia	41.102489	16.8596546	0.001
18276980	Via Giuseppe Fanelli, Libertà, Bari, BA, PUG, 70125, Italia	41.1040582	16.8791363	0.001
28800324	UniCredit, Via Giuseppe Re David, Libertà, Bari, BA, PUG, 70125, Italia	41.116992	16.87347	0.001
14499050	Via Venezia, Libertà, Bari, BA, PUG, 70122, Italia	41.1278726	16.8726485	0.001
28044327	Banca Popolare di Bari, Via Giuseppe Re David, Libertà, Bari, BA, PUG, 70125, Italia	41.1122473	16.8765127	0.001
16756819	Via Giovanni Gentile, Libertà, Bari, BA, PUG, 70126, Italia	41.1137158	16.8966208	0.001
65239279	Banca d'Italia, Corso Cavour, Libertà, Bari, BA, PUG, 70121, Italia	41.1242348	16.8730048523326	0.001
48547669	BNL, Via della Costituente, Libertà, Bari, BA, PUG, 70125, Italia	41.1065751	16.8734488	0.001
10654061	UBI Banca Carime, Via Papa Pio XII, Libertà, Bari, BA, PUG, 70124, Italia	41.1029601	16.8596845	0.001
48195578	Banca Popolare di Novara, Viale della Repubblica, Libertà, Bari, BA, PUG, 70125, Italia	41.1090096	16.8738106	0.001
13205437	Unicredit, Via Luigi Einaudi, Carbonara, Bari, BA, PUG, 70125, Italia	41.1027243	16.8862706	0.001
3474297	Monte dei Paschi di Siena, Parcheggio - Politecnico di Bari, Libertà, Bari, BA, PUG, 70126, Italia	41.1104835	16.8861439	0.001
17384700	Via Peucetia, Libertà, Bari, BA, PUG, 70126, Italia	41.1126407	16.8944536	0.001
15706671	Via Lama Del Duca, Santa Rita, Bari, BA, PUG, 70129, Italia	41.0716972	16.8552239	0.001
10474662	McDrive, Casato Martino, Bari, BA, PUG, 70124, Italia	41.0991978	16.8296506	0.001
26765440	Percorso all'aperto Museo di Scienze della Terra Di Bari, Libertà, Bari, BA, PUG, 70126, Italia	41.109176	16.8803645	0.001
15182386	Viale del Concilio Vaticano II, Libertà, Bari, BA, PUG, 70124, Italia	41.1044059	16.8651762	0.001
14871646	Via Venezia, Libertà, Bari, BA, PUG, 70122, Italia	41.1303729	16.8708793	0.001
14981382	Piazza Mercantile, Libertà, Bari, BA, PUG, 70122, Italia	41.1281009	16.8714928	0.001
16523017	Piazzetta S.Rita, Santa Rita, Bari, BA, PUG, 70129, Italia	41.0732737	16.8577267	0.001
20886279	Piazza Cesare Battisti, Libertà, Bari, BA, PUG, 70122, Italia	41.1206867	16.8676508	0.001
10524333	Strada Santa Caterina, Casato Martino, Bari, BA, PUG, 70124, Italia	41.0988304	16.8307908	0.001
7509709	Strada Adriatica, Bari, BA, PUG, 70126, Italia	41.1131781	16.914069	0.001
12857381	Parcheggio motocicli, Libertà, Bari, BA, PUG, 70123, Italia	41.1355689	16.845222	0.001
17401231	Viale Gaetano Salvemini, Libertà, Bari, BA, PUG, 70125, Italia	41.1048315	16.882001	0.001
18478522	Monte dei Paschi di Siena, Via Paradiso, Casa Paradiso, Modugno, BA, PUG, 70026, Italia	41.0849626	16.7897035	0.001
2314214	Banco di Napoli, Via J. F. Kennedy, Terlizzi, BA, PUG, 70038, Italia	41.1311153	16.54188	0.001
4780033	Banca Popolare di Bari, Via Guglielmo Marconi, Terlizzi, BA, PUG, 70038, Italia	41.1320801	16.5422989	0.001
2485809	San Paolo Banco di Napoli, Viale Roma, Terlizzi, BA, PUG, 70039, Italia	41.1299291	16.5523591	0.001
4680955	Banca di Roma, Largo Don Pietro Pappagallo, Terlizzi, BA, PUG, 70038, Italia	41.1308742	16.545393	0.001
4786428	Monte dei Paschi di Siena, Via Armando Diaz, Terlizzi, BA, PUG, 70038, Italia	41.1328136	16.5427178	0.001
13534057	Viale dei Garofani, Terlizzi, BA, PUG, 70038, Italia	41.1332424	16.5464701	0.001
3846467	Banca Carime, Via Gorizia, Terlizzi, BA, PUG, 70038, Italia	41.1335012	16.5454288	0.001
4294920	Lungomare Esercito Italiano, Giovinazzo, BA, PUG, 70054, Italia	41.1873124	16.6760939	0.001
12935525	Viale Aldo Moro, Terlizzi, BA, PUG, 70039, Italia	41.1318635	16.5519749	0.001
20840469	Viale dei Garofani, Terlizzi, BA, PUG, 70038, Italia	41.130491	16.5512168	0.001
