51501341	Pin Bar, Via Raffaele Nannarone, Foggia, FG, PUG, 71121, Italia	41.465497	15.5656787	0.101
137490270	Glamour, Corso del Mezzogiorno, Foggia, FG, PUG, 71100, Italia	41.45260955	15.5639902479424	0.001
49634178	Gran Caffè Moderno, 11, Via di Salpi, Foggia, FG, PUG, 71121, Italia	41.4667486	15.5629497	0.001
21855270	Wasabi Café, 85, Via Antonio Gramsci, Foggia, FG, PUG, 71122, Italia	41.4499223	15.5663631	0.001
16275501	Via dell'Arcangelo Michele, Foggia, FG, PUG, 71100, Italia	41.4402795	15.5628153	0.001
16071823	Zapoj, Via Grecia, Foggia, FG, PUG, 71100, Italia	41.4432235	15.5616826	0.001
14566155	SS544, Cerignola, FG, PUG, Italia	41.3910763	15.8582786	0.001
