45675225	Bluebeat Bar, 58, Via Egidio Reale, Lecce, LE, PUG, 73100, Italia	40.3516882	18.1636405	0.101
25343328	Alex Bar, 41, Via Amerigo Vespucci, Lecce, LE, PUG, Italia	40.3844624	18.3046968	0.101
17968808	Bar Rosso & Nero, 1, Viale Gallipoli, Lecce, LE, PUG, 73100, Italia	40.3503967	18.1635119	0.101
43475246	Misvago Lounge Bar, 22, Piazza Sant'Oronzo, Lecce, LE, PUG, 73100, Italia	40.3524766	18.173127	0.101
98191528	Bar pasticceria Ivone, Piazzale Adriano, Lecce, LE, PUG, Italia	40.39060725	18.3058070811285	0.101
43021408	Bar Royal, Via Margarito Da Brindisi, Lecce, LE, PUG, 73100, Italia	40.391061	18.297365	0.101
17935804	Bar Moro, 11, Via degli Ammirati, Lecce, LE, PUG, 73100, Italia	40.3518376	18.1699874	0.101
21450572	Bar delle Rose, Piazza Dante Alighieri, Galatina, LE, PUG, 73013, Italia	40.1747997	18.1687691	0.101
21703686	Bar del Corso, Via Roma, Galatina, LE, PUG, 73013, Italia	40.1746655	18.1667861	0.101
20927003	Eros Bar, Piazza San Pietro, Galatina, LE, PUG, 73013, Italia	40.1745107	18.1694638	0.101
49227900	Bar Kiros, via M. D'Azeglio, Melendugno, LE, PUG, 73026, Italia	40.274917	18.3374601	0.101
51252502	Bar Belloco, Via Roca, Melendugno, LE, PUG, 73026, Italia	40.2719014	18.3382615	0.101
50031490	Bar Piper next, Via G. Gioberti, Melendugno, LE, PUG, 73026, Italia	40.2726907	18.3382341	0.101
4484501	Jack Bar, Via Vittorio Emanuele II, Zollino, LE, PUG, 73020, Italia	40.2056941	18.2496799	0.101
4268427	Bar Top Orange, Vico Asilo, Zollino, LE, PUG, 73020, Italia	40.2055193	18.2512532	0.101
4502677	Phoenix Bar, Viale Regina Elena, Zollino, LE, PUG, 73020, Italia	40.2049736	18.247182	0.101
4533903	Bar Krifò, Via Montello, Zollino, LE, PUG, 73020, Italia	40.2074502	18.2492838	0.101
47047712	Bar Central, 13, Piazza Pio XII, Cursi, LE, PUG, 73020, Italia	40.1501412	18.3147909	0.101
45456557	Bar Orion, 29, Piazza Pio XII, Cursi, LE, PUG, 73020, Italia	40.1504434	18.3150952	0.101
45636125	Bar Sport, 6, Piazza Pio XII, Cursi, LE, PUG, 73020, Italia	40.1499696	18.3142793	0.101
18654999	La Cantina delle Streghe, Piazzetta Duca d'Atene, Lecce, LE, PUG, 73100, Italia	40.3515816	18.1658344	0.001
23978795	Caledonia Tavern, 7/9, Via Liborio Romano, Lecce, LE, PUG, 73100, Italia	40.354294	18.1767347	0.001
4302785	Celtic Pub, 39a, Via Antonio Salandra, Lecce, LE, PUG, 73100, Italia	40.3537834	18.18488	0.001
17191760	Prophet Pub, 4, Via Luigi Maggiulli, Lecce, LE, PUG, 73100, Italia	40.359509	18.1752471	0.001
36260887	Orient Express, 31, Via Giuseppe Palmieri, Lecce, LE, PUG, 73100, Italia	40.3536501	18.1686648	0.001
7902325	Malibù, 70, Via di Porcigliano, Lecce, LE, PUG, 73100, Italia	40.3561114	18.1774383	0.001
17402498	RossoDivino, Via Domenico Tommaso Albanese, Lecce, LE, PUG, 73100, Italia	40.3562152	18.1906312	0.001
47194330	Tennent's Grill, Via Taranto, Lecce, LE, PUG, 73100, Italia	40.3605404	18.1574051	0.001
15660792	Via Umberto I, Lecce, LE, PUG, 73100, Italia	40.3552999	18.1727134	0.001
48133439	Caffè Letterario, 46, Via Guglielmo Paladini, Lecce, LE, PUG, 73100, Italia	40.3501031	18.1698347	0.001
48020346	Tacco 12, 1, Via Ludovico Maremonti, Lecce, LE, PUG, 73100, Italia	40.3515894	18.1723348	0.001
49598912	Coffee and Cigarettes, 23, Via Guglielmo Paladini, Lecce, LE, PUG, 73100, Italia	40.3507478	18.1696733	0.001
52538107	Twin Towers Cafè, 63, Viale Japigia, Lecce, LE, PUG, 73100, Italia	40.3516351	18.1861036	0.001
45872181	quanto basta, 17, Via Guglielmo Paladini, Lecce, LE, PUG, 73100, Italia	40.350981	18.1695622	0.001
52464573	Shui Wine, 21a, Via Umberto I, Lecce, LE, PUG, 73100, Italia	40.3555908	18.1726547	0.001
16823128	Via dei Palumbo, Lecce, LE, PUG, 73100, Italia	40.3627153	18.1831285	0.001
46387813	92, Viale Giacomo Leopardi, Lecce, LE, PUG, 73100, Italia	40.3613561	18.1799557	0.001
47037981	Nené Beer, 8/10, Via Ascanio Grandi, Lecce, LE, PUG, 73100, Italia	40.3514165	18.1728152	0.001
26012734	Caffè Alvino, 30, Piazza Sant'Oronzo, Lecce, LE, PUG, 73100, Italia	40.352832	18.1730936	0.001
46855783	La Sapore, 36, Via Marco Basseo, Lecce, LE, PUG, 73100, Italia	40.3509828	18.169471	0.001
17292544	Strada Provinciale SP286 Santa Caterina - Sant'Isidoro - Porto Cesareo, Nardò, LE, PUG, Italia	40.1693657	17.9451284	0.001
20818715	Pub La Staffa, Piazzeta Piertro Cavoti, Galatina, LE, PUG, 73013, Italia	40.1754266	18.1720741	0.001
20767526	Corso Re D'Italia, Galatina, LE, PUG, 73013, Italia	40.1755677	18.1674615	0.001
21033016	Via Filippo Turati, Galatina, LE, PUG, 73013, Italia	40.1749821	18.1692251	0.001
20631644	Piazza Dante Alighieri, Galatina, LE, PUG, 73013, Italia	40.1757178	18.1683507	0.001
20308158	Cremeria Moscara, Via Roma, Galatina, LE, PUG, 73013, Italia	40.1746517	18.164029	0.001
20366886	Pasticceria Ascalone, Via Vittorio Emanuele, Galatina, LE, PUG, 73013, Italia	40.1739238	18.1703082	0.001
7953445	Babilonia, SP366, Melendugno, LE, PUG, Italia	40.2548361	18.4445769	0.001
50375922	Via Berlinguer, Galatone, LE, PUG, Italia	40.1514978	18.0786089	0.001
2596737501	Largo Margherita, Trepuzzi, LE, PUG, 73019, Italia	40.4051439	18.0710354097826	0.001
