25795458	Kaos Bar (Kaos Cafe), Via Di Palma, Taranto, TA, PUG, 74123, Italia	40.4704204	17.2482729	0.101
20337649	Via Garibaldi, Taranto, TA, PUG, Italia	40.4082475	17.2809497	0.001
130040254	Calm Beach, Viale del Tramonto, Taranto, TA, PUG, Italia	40.42286555	17.2162727992715	0.001
2602746584	Royal Bar, Viale Virgilio, Taranto, TA, PUG, 74122, Italia	40.4605739	17.2497086	0.001
124473494	Prima Colazione, Via Martiri d'Ungheria, Grottaglie, TA, PUG, 74023, Italia	40.533676	17.4278751821956	0.001
128278316	Via Giacomo Leopardi, Maruggio, TA, PUG, Italia	40.29937495	17.5579046369048	0.001
128277737	Via salentina, Maruggio, TA, PUG, Italia	40.2991137	17.554087852881	0.001
2599919328	Chapeau, 3, Via 11 Febbraio, Sava, TA, PUG, Italia	40.4052745	17.5584539	0.001
