3633636	San Nicola Pellegrino, Viale Padre Pio, Trani, BT, PUG, 70059, Italia	41.2674854	16.4296805	0.001
65317239	Ufficio Igiene, Via Gammarota, Andria, BT, PUG, 70031, Italia	41.2262609	16.29543365	0.001
3893530	Guardia Medica, Via Antonio Canal, Andria, BT, PUG, 70031, Italia	41.236186	16.3046502	0.001
68790919	Ospedale Lorenzo Bonomo, Via Cappuccini, Andria, BT, PUG, 70031, Italia	41.2293454	16.3034918412812	0.001
72067920	Ospedale Umberto I, Via Ruvo, Corato, BA, PUG, 70033, Italia	41.14620845	16.4240683465502	0.001
143137471	Obitorio, Via Ruvo, Corato, BA, PUG, 70033, Italia	41.1474901	16.4238817154719	0.001
139973521	Ospedale Civile di Canosa di Puglia, Via Fontana dei Tartari, Canosa di Puglia, BT, PUG, Italia	41.2263333	16.0723605341448	0.001
5523405	Corso Piave, Ruvo di Puglia, BA, PUG, 70037, Italia	41.1201512	16.487242	0.001
46593914	Diagnostica s.r.l., 10, Via Pietro Gobetti, Ruvo di Puglia, BA, PUG, 70037, Italia	41.1183678	16.4847086	0.001
