14584138	Ospedale Militare Marittimo, Via Pitagora, Taranto, TA, PUG, 74123, Italia	40.473025	17.2478859	0.001
112802449	Via Pietro Nenni, Quartiere Paolo VI, Taranto, TA, PUG, Italia	40.53970365	17.2775054178713	0.001
116804993	Casa di cura  Villa Verde, Via Lago di Montepulciano, Taranto, TA, PUG, 74121, Italia	40.4477239	17.2752429090086	0.001
86378181	Santissima Annunziata, Via Francesco Bruno, Taranto, TA, PUG, 74123, Italia	40.46441815	17.2484741123985	0.001
14827576	Ospedale G. Moscati, Via Pietro Nenni, Quartiere Paolo VI, Taranto, TA, PUG, Italia	40.5390474	17.2769765	0.001
116126780	Ospedale Civile  San Marco, Viale Gaspare Pignatelli, Grottaglie, TA, PUG, 74023, Italia	40.53877705	17.4258504535743	0.001
24113526	Pronto Soccorso 118, Viale Gaspare Pignatelli, Grottaglie, TA, PUG, 74023, Italia	40.538985	17.4261942	0.001
115284639	Ospedale, Via Ceglie, Francavilla Fontana, BR, PUG, 72021, Italia	40.5393741	17.5771740930909	0.001
