3704543	Questura, 1, Via Antonio Gramsci, Foggia, FG, PUG, 71100, Italia	41.4519102	15.5633474	0.001
43718514	Guardia di Finanza, Via Maggiore Vincenzo Della Rocca, Foggia, FG, PUG, 71121, Italia	41.4611653	15.551464	0.001
92643849	Caserma provinciale Carabinieri, 4, Via Alfredo Guglielmi, Foggia, FG, PUG, 71121, Italia	41.4575137	15.5592521820319	0.001
21854108	Polizia Locale, Viale Manfredi, Foggia, FG, PUG, 71121, Italia	41.4679286	15.5483256	0.001
3083575	Carabinieri, Chianconi, Pietramontecorvino, FG, PUG, Italia	41.5437339	15.1313793	0.001
4965259	Carabinieri, Strada Statale 17 dell'Appennino Abruzzese e Appulo Sannitico, Volturara Appula, FG, PUG, Italia	41.4970613	15.0543389	0.001
14240689	Carabinieri, Strada Statale 17 dell'Appennino Abruzzese e Appulo Sannitico, Motta Montecorvino, FG, PUG, Italia	41.5073113	15.1136768	0.001
