44272376	Studio Musarò, Via San Tommaso D'Aquino, Tutino, Tricase, LE, PUG, 73039, Italia	39.9323291	18.3501285	0.101
43374015	Aprile Studio Tributario, Via Leonardo Botallo, Tutino, Tricase, LE, PUG, 73039, Italia	39.9402867	18.3528095	0.101
48623321	Hair Studio, Via San Demetrio, Caprarica di Tricase, Tricase, LE, PUG, 73039, Italia	39.9320105	18.3597723	0.101
52079919	Studio Mastria, 3a, Via Bari, Alessano, LE, PUG, 73031, Italia	39.88866	18.3308149	0.101
49217075	Studio legale Marra e associati, 27, Via I Maggio, Presicce, LE, PUG, 73054, Italia	39.9034607	18.2630205	0.101
18647721	Studio medico Dott. Luigi Cazzetta, Via Giuseppe Parini, Palmariggi, LE, PUG, 73036, Italia	40.1314631	18.3821895	0.101
