15502527	Viale Porta Adige, Commenda, Rovigo, RO, VEN, 45100, Italia	45.0853935	11.7833668	0.001
10729954	Banca Intesa San Paolo, Via Giovanni Amendola, San Pio X, Rovigo, RO, VEN, 45100, Italia	45.0728118	11.7803736	0.001
10091792	Poste Italiane, Via Giovanni Amendola, San Pio X, Rovigo, RO, VEN, 45100, Italia	45.0735268	11.7783875	0.001
47723452	Sparkasse, Viale Porta Adige, Commenda, Rovigo, RO, VEN, 45100, Italia	45.0770306	11.7849087	0.001
10059433	Viale Oroboni, San Bortolo, Rovigo, RO, VEN, 45100, Italia	45.0646463	11.7952168	0.001
21120254	Banca Antonveneta, Via Girolamo Savonarola, San Sisto, Rovigo, RO, VEN, 45100, Italia	45.0406569	11.7908297	0.001
26400981	Via Antonio Gramsci, Papozze, RO, VEN, Italia	44.988239	12.031398	0.001
