18104451	Poste Italiane, Via Livorno, Paltana, Padova, PD, VEN, 35141, Italia	45.3955557	11.8630495	0.001
45826971	Via Salboro, Crocifisso, Padova, PD, VEN, 35124, Italia	45.3585358	11.8936249	0.001
15734827	Postamat, Viale Felice Cavallotti, Guizza, Padova, PD, VEN, 35125, Italia	45.386856	11.868042	0.001
19166950	FriulAdria, Via Livorno, Paltana, Padova, PD, VEN, 35141, Italia	45.3953495	11.8630833	0.001
15991563	Banco Popolare di Marostica, Via Roberto Marin, Madonna Pellegrina, Padova, PD, VEN, 35122, Italia	45.398612	11.8716294	0.001
16152866	Via Alessandro Prosdocimi, Forcellini, Padova, PD, VEN, 35128, Italia	45.3969943	11.9005883	0.001
18643395	Via Egidio Forcellini, Forcellini, Padova, PD, VEN, 35128, Italia	45.3971377	11.8982911	0.001
45404617	Via Moncenisio, Albignasego, PD, VEN, 35020, Italia	45.3403244	11.9029098	0.001
