14449695	Unicredit, Viale Armando Diaz, Angarano, Bassano del Grappa, VI, VEN, 360612, Italia	45.7663232	11.725485	0.001
4527154	Banca San Giorgio Valle Agno, Viale Venezia, Quartiere San Marco, Bassano del Grappa, VI, VEN, 31061, Italia	45.7701887	11.7522603	0.001
26791229	Banca Popolare di Vicenza, Via Carlo Alberto Dalla Chiesa, Quartiere Firenze, Bassano del Grappa, VI, VEN, 360612, Italia	45.7416168	11.7285907	0.001
14438064	Popolare Marostica, Piazza Giuseppe Garibaldi, Quartiere Largo Parolini, Bassano del Grappa, VI, VEN, 360612, Italia	45.7670233	11.7351184	0.001
4474902	Viale Alessandro Manzoni, Quartiere Spin, Romano d'Ezzelino, VI, VEN, 36022, Italia	45.7733506	11.7723082	0.001
14315185	Popolare di Marostica, Via San Gian Battista La Salle, Quartiere Spin, Romano d'Ezzelino, VI, VEN, 36022, Italia	45.77127	11.7631124	0.001
4389954	Cassa di Risparmio del Veneto, Via Roma, San Zenone degli Ezzelini, TV, VEN, 36065, Italia	45.7789322	11.8380933	0.001
