28504621	Bar Centrale, Via IV Novembre, Vigo di Cadore, BL, VEN, Italia	46.4997824	12.471178	0.101
104330766	All'Amicizia, SR355, Sappada - Plodn, BL, VEN, 32047, Italia	46.5686606	12.7215191	0.001
104653721	Albergo Sorgenti del Piave, 321, Sappada - Plodn, BL, VEN, 32047, Italia	46.56924365	12.7207837789006	0.001
105031762	Green House Pub, SP30, Santo Stefano di Cadore, BL, VEN, Italia	46.5669981	12.5557541113834	0.001
20270925	Union Pub, Via San Candido, Santo Stefano di Cadore, BL, VEN, Italia	46.559041	12.5487879	0.001
39428954	Lataria, Via Venezia, Santo Stefano di Cadore, BL, VEN, Italia	46.5566675	12.5494055	0.001
28084772	Borgo San Nicolò, Vigo di Cadore, BL, VEN, Italia	46.4961697	12.4790236	0.001
8485828	Caffè Commercio, 96, Via Roma, Lozzo di Cadore, BL, VEN, Italia	46.4842518	12.4435781	0.001
8221877	Via Roma, Lozzo di Cadore, BL, VEN, Italia	46.4843612	12.4429994	0.001
