13254956	bar, Via Roma, Cartura, PD, VEN, 35025, Italia	45.2673169	11.8632486	0.111
13205032	bar, Via Antonio Vivaldi, Cartura, PD, VEN, 35025, Italia	45.2681967	11.8606646	0.111
50793932	Cremisi - bar pasticceria gelateria, Via Carboni, Condominio Bellavista, Monselice, PD, VEN, 35043, Italia	45.239813	11.7522594	0.101
7970310	Bar Carlo, 16, Via Principe Amedeo, Este, PD, VEN, 35042, Italia	45.2247457	11.6615974	0.101
9456698	Bar Totoricevitoria, 29a, Via San Fermo, Este, PD, VEN, 35042, Italia	45.2262291	11.6485766	0.101
8129021	Bar Carla, Via Chiesa Schiavonia, Este, PD, VEN, 34042, Italia	45.2104178	11.7117417	0.101
8795577	Bar Roma, 37, Via Giacomo Matteotti, Este, PD, VEN, 35042, Italia	45.2278181	11.6547835	0.101
48132823	Bar Centrale, Via Masotto, Noventa Vicentina, VI, VEN, 36025, Italia	45.2898371	11.5373598	0.101
50324456	Bar Borsa, Corso Matteotti, Noventa Vicentina, VI, VEN, 36025, Italia	45.2890533	11.5368339	0.101
49223828	Bar Stazione, Via Porta, Noventa Vicentina, VI, VEN, 36025, Italia	45.2920244	11.5433752	0.101
47410624	Bar San Vito, Corso Matteotti, Noventa Vicentina, VI, VEN, 36025, Italia	45.2909036	11.5379219	0.101
49282611	Bar Ai Portici, Piazza 4 Novembre, Noventa Vicentina, VI, VEN, 36025, Italia	45.290734	11.5404072	0.101
2599155979	Bar Alla Loggia, Via Velleselle, Arquà Petrarca, PD, VEN, 35032, Italia	45.2701083	11.7163054	0.101
95076563	Bar  Al Centro, 5, Piazza Francesco Petrarca, Arquà Petrarca, PD, VEN, 35032, Italia	45.26883125	11.7195752104599	0.101
18152866	Hotel Bar Ristorante L'incontro, Via Valeggia, Galzignano Terme, PD, VEN, 35038, Italia	45.3076894	11.7312378	0.101
19445375	Bar Blu Cafe, 5, Via Alcide de Gasperi, Maserà di Padova, PD, VEN, 35020, Italia	45.3190214	11.8642781	0.101
46797485	Due a Bar Ambaradan, 10, Via dei Granatieri, Due Carrare, PD, VEN, 35020, Italia	45.2914633	11.8192057	0.101
4200577	Via San Bortolo, Monselice, PD, VEN, 35047, Italia	45.2152945	11.7594054	0.001
75525102	Via Riviera, Baone, PD, VEN, 35042, Italia	45.2462903	11.64253975	0.001
45541390	Pub 2014, 15, Via 20 Settembre, Saletto, PD, VEN, 35046, Italia	45.2261595	11.5333625	0.001
16939909	Il Secchio delle Streghe, Via Guglielmo Marconi, Facchin, Vo', PD, VEN, Italia	45.3234539	11.6376033	0.001
6297909	Caravanserrai, 1, Via Isidoro Alessi, Este, PD, VEN, 35042, Italia	45.227954	11.6517567	0.001
6393980	Brendan, Via Salute, Este, PD, VEN, 35042, Italia	45.2281587	11.6481205	0.001
76069135	Dillon's, 43, Via Principe Amedeo, Este, PD, VEN, 35042, Italia	45.22304195	11.6619977476354	0.001
8796824	La Picadita, Via San Rocco, Este, PD, VEN, 35042, Italia	45.2277225	11.6561179	0.001
16315221	Birerria San Marco, 1, Viale dell'Industria, Este, PD, VEN, 35042, Italia	45.2203221	11.6796691	0.001
8139871	27, 13b, Via Padana Inferiore, Este, PD, VEN, 35042, Italia	45.2233747	11.6494748	0.001
76683857	Zebbra Pub, 94, Via Deserto, Este, PD, VEN, 35042, Italia	45.2091658	11.6760722042507	0.001
8645388	Al Curvone, Via Chiesa Prà, Este, PD, VEN, 35042, Italia	45.2098001	11.6505347	0.001
8281855	Fisher, 77, Via Rovigo, Este, PD, VEN, 35042, Italia	45.2189403	11.6664778	0.001
8747283	20 10, 30, Via Giacomo Matteotti, Este, PD, VEN, 35042, Italia	45.2276714	11.6549853	0.001
17582036	DolceVita Caffè, Via Guido Negri, Este, PD, VEN, 35042, Italia	45.2287252	11.6568425	0.001
8436508	9, Via Padana Inferiore, Este, PD, VEN, 35042, Italia	45.2231144	11.6525796	0.001
17143963	Isola Caffè, Via Padana Inferiore, Este, PD, VEN, 35042, Italia	45.2249567	11.6381239	0.001
8628001	Victory Caffè, 18b, Via Atheste, Este, PD, VEN, 35042, Italia	45.2217558	11.6709196	0.001
96960983	Via Atheste, Este, PD, VEN, 35042, Italia	45.22404055	11.665102744797	0.001
75770810	Via Giovanni 23°, Este, PD, VEN, 3042, Italia	45.2292021	11.6653884872527	0.001
17144065	Via Pilastro, Este, PD, VEN, 35042, Italia	45.2260402	11.641687	0.001
47642593	Foxy Fox, Via Masotto, Noventa Vicentina, VI, VEN, 36025, Italia	45.2914136	11.5362272	0.001
46426455	Via Garibaldi, Noventa Vicentina, VI, VEN, 36025, Italia	45.2884259	11.538002	0.001
49465068	Gelateria Schioppetto, Largo Rezzonico, Noventa Vicentina, VI, VEN, 36025, Italia	45.2916558	11.5393293	0.001
49442080	Laterale Via Capo di Sopra, Noventa Vicentina, VI, VEN, 36025, Italia	45.2977368	11.5337572	0.001
49430718	Gelateria, Corso Matteotti, Noventa Vicentina, VI, VEN, 36025, Italia	45.2893929	11.5370259	0.001
47637791	Café Chalet, 30, Via Broli, Noventa Vicentina, VI, VEN, 36025, Italia	45.2882013	11.5348009	0.001
141299276	SP25, Battaglia Terme, PD, VEN, 35041, Italia	45.2923987	11.774659	0.001
2602922662	Via Roma, Pojana Maggiore, VI, VEN, 36026, Italia	45.2889605	11.5007617	0.001
18062995	Via Fontanon, Bellone, Lozzo Atestino, PD, VEN, 35034, Italia	45.2815992	11.6236397	0.001
78042876	Via Bomba, Cinto Euganeo, PD, VEN, 3042, Italia	45.27195545	11.6561266434425	0.001
4058441	Area di Servizio San Pelagio Ovest, Due Carrare, PD, VEN, 35036, Italia	45.3158916	11.8253407	0.001
4347600	Area di Servizio San Pelagio Est, Due Carrare, PD, VEN, 35036, Italia	45.3155235	11.8273492	0.001
