21083288	Trattoria Bar Laura, Corso Risorgimento, Porto Viro, RO, VEN, 45014, Italia	45.0359533	12.2237248	0.101
50900609	Forum, 106, Via delle Nazioni Unite, Caserma, Chioggia, VE, VEN, 30015, Italia	45.1742889	12.3197197	0.001
12425896	Jamiro, Viale Mediterraneo, Brondolo, Chioggia, VE, VEN, 30015, Italia	45.196923	12.2892442	0.001
16025130	Kuadra Caffe`, Viale Mediterraneo, Brondolo, Chioggia, VE, VEN, 30015, Italia	45.1969584	12.2859577	0.001
24813451	Via Nettuno, Caserma, Chioggia, VE, VEN, 30015, Italia	45.1732902	12.324126	0.001
41165770	Via Trieste, Rosolina, RO, VEN, Italia	45.1337342	12.3249833	0.001
21374630	Orologio, Via Gorghi, Porto Viro, RO, VEN, 45014, Italia	45.0367564	12.2195506	0.001
20273864	Caffè e Vino, Piazza della Repubblica, Porto Viro, RO, VEN, 45014, Italia	45.026519	12.2200177	0.001
