27604225	Via Guglielmo Marconi, Baldassa, Camposampiero, PD, VEN, 35012, Italia	45.569412	11.9291374	0.001
52910872	Via Bosco III, Campodarsego, PD, VEN, 35010, Italia	45.5204108	11.9131083	0.001
20815810	Via Vittorio Alfieri, Gazzo, PD, VEN, Italia	45.5792253	11.6907927	0.001
38849916	Via Dante Alighieri, Gazzo, PD, VEN, Italia	45.5794715	11.6804268	0.001
45459715	Via Piave, San Giorgio in Bosco, PD, VEN, Italia	45.5756387	11.8217799	0.001
47163312	Via Ramusa, San Giorgio in Bosco, PD, VEN, 35016, Italia	45.5755909	11.8218112	0.001
