2338241	Cinema Teatro Pasubio, 81, Via Pietro Maraschin, Magrè, Schio, VI, VEN, 36015, Italia	45.7149542	11.3439244	0.101
1938245	Cinema Teatro Sociale, 46, Via Pasubio, Magrè, Schio, VI, VEN, 36015, Italia	45.7141677	11.3560869	0.101
15305030	Cinema Salesiani, Via San Giovanni Bosco, Magrè, Schio, VI, VEN, 36015, Italia	45.7118261	11.3593148	0.101
140123646	Cinema Marconi, Via Guglielmo Marconi, Isola Vicentina, VI, VEN, 36033, Italia	45.62954375	11.4420048242084	0.101
74920840	Patronato S.Gaetano, Via Santa Maria Maddalena, Thiene, VI, VEN, 36016, Italia	45.70922675	11.4749640328721	0.001
43690734	Aurora, Via Chiesa, Malo, VI, VEN, 36034, Italia	45.6564492	11.4043614	0.001
