80639537	Corso Cangrande, Lazise, VR, VEN, 37017, Italia	45.50664545	10.73469245	0.001
24018338	Sentiero dei Pangoni, Fumane, VR, VEN, 37022, Italia	45.5612069	10.899685	0.001
3759296	Lavatoi, Via Molini, Grezzana, VR, VEN, 3723, Italia	45.5360326	10.9872179	0.001
3986786	Via Cesare Betteloni, Grezzana, VR, VEN, 3723, Italia	45.5468894	10.9944019	0.001
137722409	Lungo Lago Lenotti, Bardolino, VR, VEN, 37011, Italia	45.5482692	10.717215	0.001
20718745	Borgo Cavour, Bardolino, VR, VEN, 37011, Italia	45.5470276	10.722108	0.001
20927341	Via Ca' del Ri, Affi, VR, VEN, 37013, Italia	45.5528311	10.7788069	0.001
7324860	Via Boldiera, Caprino Veronese, VR, VEN, 37013, Italia	45.5990035	10.7510716	0.001
93186195	Via Andrea Monga, San Pietro in Cariano, VR, VEN, 37029, Italia	45.5103159	10.8864989609379	0.001
