39724733	Via Guglielmo Marconi, Cortina d'Ampezzo, BL, VEN, 32043, Italia	46.5402089	12.1357246	0.001
29666898	Corso Italia, Cortina d'Ampezzo, BL, VEN, 32043, Italia	46.5390025	12.1351031	0.001
2598436940	Via Serdes, San Vito di Cadore, BL, VEN, 32046, Italia	46.4505904	12.2010739	0.001
4215253	Via Nazionale, San Vito di Cadore, BL, VEN, 32046, Italia	46.4636934	12.2045136	0.001
931245	SP251, Zoldo Alto, BL, VEN, Italia	46.3940023	12.1029608	0.001
879795	Pio Vanel, Zoldo Alto, BL, VEN, Italia	46.3932221	12.0974769	0.001
26662848	SP20, Salator, Zardin, Selva di Cadore, BL, VEN, 2020, Italia	46.451368	12.0344487	0.001
18539020	Via Peronaz, Selva di Cadore, BL, VEN, 2020, Italia	46.4360512	12.1005728	0.001
141331205	493, Vodo di Cadore, BL, VEN, Italia	46.4163262	12.1969729	0.001
