99222846	Viale Guglielmo Marconi, Commenda, Rovigo, RO, VEN, 45100, Italia	45.07670645	11.7835325471686	0.001
98469289	Fontana della Riconoscenza, Piazza Riconoscenza, Commenda, Rovigo, RO, VEN, 45100, Italia	45.0769066	11.781738142517	0.001
2597949680	Piazza 20 settembre, San Bortolo, Rovigo, RO, VEN, 45100, Italia	45.07132635	11.7946271136059	0.001
138605652	Via Statale, Stanghella, PD, VEN, 35048, Italia	45.14667655	11.7574527061078	0.001
24656173	Via dei Martiri, Quartiere Bisognero, Cavarzere, VE, VEN, 30014, Italia	45.1363057	12.0836617	0.001
44430417	Strada Statale 16 Adriatica, Polesella, RO, VEN, Italia	44.9794503	11.7575269	0.001
27918035	Piazza Libertà, Papozze, RO, VEN, Italia	44.9879792	12.0316759	0.001
