37096956	SP246 di Recoaro, Maglio di Sopra, Valdagno, Guasine, VI, VEN, 36078, Italia	45.6761219	11.2709741	0.001
24773344	Via Roma, Ala, TN, TAA, 38061, Italia	45.7566003	11.005654	0.001
35712261	Via Roma, Recoaro Terme, VI, VEN, 36076, Italia	45.7053661	11.2264017	0.001
1273037	Via Bruno Brandellero, Bise, Valli del Pasubio, VI, VEN, Italia	45.7411509	11.2602771	0.001
23805344	Biblioteca Comunale, 6, Via Spiazzi, Creci, Bosco Chiesanuova, VR, VEN, 37021, Italia	45.6221746	11.0285641	0.001
23584445	Ferrara di Monte Baldo, VR, VEN, Italia	45.6763837	10.8530173	0.001
