17978611	Farmacia Rigodanzao, Via Giuseppe Mazzini, Gambellara, VI, VEN, 36053, Italia	45.4571916	11.3444118	0.001
7940447	Via Municipio, Fojanesega, Longare, VI, VEN, 36020, Italia	45.4789605	11.6091036	0.001
19657589	Via Benedetto Croce, I Casoni, Brendola, VI, VEN, 36077, Italia	45.472475	11.4462474	0.001
44732531	Farmacia, Via Sabbadini, Contrà Via Masetto, Sarego, VI, VEN, 36054, Italia	45.4328719	11.4139987	0.001
29228659	Via Alcide de Gasperi, Sarego, Cà Ghetto, Sarego, VI, VEN, 36045, Italia	45.4066621	11.4048207	0.001
18648571	Via Garibaldi, Mestrino, PD, VEN, 35035, Italia	45.4406432	11.7613038	0.001
2596393980	Farmacia Centrale, 1, Via Tiro a Segno, Soave, VR, VEN, 37038, Italia	45.4211909	11.2474449	0.001
2596393981	Farmacia Frassoldati Vaccari, 9, Piazza San Matteo, Soave, VR, VEN, 37038, Italia	45.4192458	11.2478723	0.001
2596393982	Farmacia Rizzini, 22, Via Vittorio Veneto, Monteforte d'Alpone, VR, VEN, 37032, Italia	45.4218728	11.2863849	0.001
