88236877	Polizia Locale, Via Cesare Battisti, San Zeno di Cerea, Cerea, VR, VEN, 37053, Italia	45.1970637	11.2096113111994	0.001
108452501	Carabinieri, 12, Piazza Fratelli Sommariva, San Zeno di Cerea, Cerea, VR, VEN, 37053, Italia	45.19688165	11.2089909896165	0.001
107032274	Viale della Libertà, Bovolone, VR, VEN, 37051, Italia	45.25867265	11.1190555299088	0.001
109353706	Via 4 Novembre, Bovolone, VR, VEN, 37051, Italia	45.25641165	11.1211937282829	0.001
107363948	Via Cesare Battisti, Bovolone, VR, VEN, 37051, Italia	45.25619815	11.1212408113594	0.001
18044514	Comando Carabinieri Bovolone, Viale della Libertà, Bovolone, VR, VEN, 37051, Italia	45.2586374	11.1190866	0.001
127617425	Via Alcide De Gasperi, Casaleone, VR, VEN, 37053, Italia	45.16924225	11.200072181243	0.001
115756766	Via Bosco, Terrazzo, VR, VEN, Italia	45.1733079	11.398606518946	0.001
104857405	Via Donatori del Sangue, Isola della Scala, VR, VEN, 37063, Italia	45.2674055	11.0069014992065	0.001
