7903140	Greenwich Pub, Via Sant'Andrea, Curtarolo, PD, VEN, Italia	45.5334319	11.8395769	0.101
24581925	Wanted RockPub, 1, Piazza del Braio, Due Albere, Grantorto, PD, VEN, 35014, Italia	45.5980999	11.7313305	0.101
10760187	Cortivo Risto Wine Pub, Via della Fonda, Noale, VE, VEN, 30033, Italia	45.5532748	12.0719438	0.101
24369583	Birreria Al Pioniere, Via Straelle, Baldassa, Camposampiero, PD, VEN, 35012, Italia	45.5571513	11.965403	0.001
23869653	Faraone, Via Desman, Borgoricco, PD, VEN, Italia	45.5308209	11.9649337	0.001
18236872	Never Mind, Via Fogazzaro, Rasega, Grumolo delle Abbadesse, VI, VEN, 36043, Italia	45.512864	11.6656592	0.001
