4756462	Sir William Wallace Pub, 8, Contrà Giuseppe Apolloni, Barche, San Biagio, Vicenza, VI, VEN, 36100, Italia	45.5500405	11.5459134	0.101
32066459	Irish pub, Viale Trieste, Parco Città, Vicenza, VI, VEN, 36100, Italia	45.5647825	11.5666764	0.101
3683861	Miles Davis Pub, Strada di Polegge, Polegge, Vicenza, VI, VEN, 360100, Italia	45.5911082	11.5499586	0.101
16515016	Puddy's Pub, Largo Tiepolo, Creazzo, VI, VEN, 36051, Italia	45.5322312	11.4785951	0.101
15267176	Night Club Boys, Via dell'Oreficeria, Pomari, Vicenza, VI, VEN, 36057, Italia	45.5305665	11.5068439	0.001
5632933	Bar Carioca, Contra' dei Forti di San Francesco, Barche, San Biagio, Vicenza, VI, VEN, 36100, Italia	45.5541924	11.5424728	0.001
19556941	Mamma L'Oca, Via Giuseppe Mazzini, Costabissara, VI, VEN, 360100, Italia	45.5850367	11.4855794	0.001
22022765	Caffè Cubò, Via Alessandro Volta, Costabissara, VI, VEN, 360100, Italia	45.5895912	11.5003527	0.001
2596906419	The Drunken Duck, Via Monte Cengio, Villaggio Montegrappa, Quinto Vicentino, VI, VEN, 36050, Italia	45.5749049	11.6426515	0.001
