645047	Teatro La Fenice, 1965, Campo San Fantin, San Marco, Venezia, VE, VEN, 30124, Italia	45.4336851	12.33377	0.33543898169688
16907515	Goldoni, Calle del Teatro o de la Commedia, San Marco, Venezia, VE, VEN, 30124, Italia	45.436346	12.3352192	0.14748918685134
23713906	Teatro Marinoni Bene Comune, Lungomare Gabriele D'Annunzio, Venezia, VE, VEN, 30126, Italia	45.4195297	12.3809394	0.001
20634807	Virtuosi de Venezia, Piazza San Marco, San Marco, Venezia, VE, VEN, 30124, Italia	45.4347845	12.3391659	0.001
119328531	Teatrino Groggia, Fondamenta dei Riformati, Cannaregio, Venezia, VE, VEN, 30121, Italia	45.4477429	12.3274773139309	0.001
20506073	Musica A Palazzo, Ramo Barbarigo, San Marco, Venezia, VE, VEN, 30124, Italia	45.4319867	12.3322833	0.001
92941385	Malibran, Calle del Teatro, Cannaregio, Venezia, VE, VEN, 30131, Italia	45.4389628	12.338128046904	0.001
