2598685976	Mercato della Pignasecca, Piazza Pignasecca, Calata Porta di Massa, Miano, Napoli, NA, CAM, 80135, Italia	40.8463811	14.2475951	0.001
48086809	Via Achille Torelli, Fuorigrotta, Napoli, NA, CAM, 80121, Italia	40.8357985	14.2365351	0.001
119738729	Via Soprammuro, Calata Porta di Massa, Miano, Napoli, NA, CAM, 80142, Italia	40.8496044	14.2679588533267	0.001
17083053	Centro Commerciale LE PORTE DI NAPOLI, Strada Comunale Guerra, Afragola, NA, CAM, 80013, Italia	40.9331057	14.3516641	0.001
118190806	Mercato comunale Caivano, SP23, Caivano, NA, CAM, 80023, Italia	40.9566721	14.307738607471	0.001
92330745	Mercato rionale di Gricignano di Aversa, Via Casolla, Gricignano di Aversa, CE, CAM, 81032, Italia	40.98066355	14.2356369665925	0.001
