92616287	Tenenza Carabinieri, Via Guglielmo Oberdan, Scafati, SA, CAM, 84018, Italia	40.74654785	14.5259706579804	0.001
18291864	Carabinieri, Strada Statale Amalfitana, Positano, SA, CAM, 84017, Italia	40.6291109	14.4818361	0.001
18850245	Guardia di Finanza, Strada Statale Amalfitana, Positano, SA, CAM, 84017, Italia	40.6301489	14.4797392	0.001
17116028	Polizia di Stato, Via Sacra, Pompei, NA, CAM, 80045, Italia	40.7484797	14.5007364	0.001
50048488	Polizia Locale di Boscoreale, 12, Via Maria Montessori, Boscoreale, NA, CAM, 80041, Italia	40.7632795	14.4697883	0.001
15894694	Caserma dei Carabinieri, Corso Alcide de Gasperi, Annunziatella, Castellammare di Stabia, NA, CAM, 80053, Italia	40.7075582	14.4818442	0.001
16655929	Polizia di Stato, Corso Alcide de Gasperi, Annunziatella, Castellammare di Stabia, NA, CAM, 80053, Italia	40.708156	14.4816886	0.001
77911302	Polizia Municipale, Via Nuova Cirillo, Trecase, NA, CAM, 80058, Italia	40.76894455	14.4381867195475	0.001
85804398	Mare, Via Calastro, Torre del Greco, NA, CAM, 80056, Italia	40.78565705	14.3630516409516	0.001
