96221041	Via Vincenzo Loria, Salerno, SA, CAM, 84132, Italia	40.66272905	14.7997661158568	0.001
83114837	Circolo Didattico Salerno II - Barra, Lungomare Trieste, Salerno, SA, CAM, 84121, Italia	40.6778717	14.7532266382849	0.001
86977453	Via Girolamo Seripando, Salerno, SA, CAM, 84125, Italia	40.6869473	14.7673537391554	0.001
79309892	Scuola elementare Medaglie D'oro, Via Pietro da Acerno, Salerno, SA, CAM, 84126, Italia	40.683668	14.7736063182579	0.001
87666670	Scuola media Torquato Tasso, Via Costanzella Calenda, Salerno, SA, CAM, 84126, Italia	40.6850497	14.7733637783375	0.001
97836558	Via Belisario Corenzio, Salerno, SA, CAM, 84132, Italia	40.6625672	14.8010138513312	0.001
82632728	Via Etruria, Rione Sant'Anna, Battipaglia, SA, CAM, 84091, Italia	40.6091322	14.9951647861363	0.001
96905959	Via Dalla Chiesa, Battipaglia, SA, CAM, 84091, Italia	40.6095001	14.9884607463844	0.001
92403877	Scuola Materna Poliziano, Via Giusti, Rione Sant'Anna, Battipaglia, SA, CAM, 84091, Italia	40.60996055	14.9906049906602	0.001
102010346	Sandro Penna, Largo Tiepolo, Battipaglia, SA, CAM, 84091, Italia	40.60370565	14.9780681322485	0.001
93263962	Via Alcide De Gasperi, Battipaglia, SA, CAM, 84091, Italia	40.60971015	14.9892971498975	0.001
82311376	Piazza Amendola, Battipaglia, SA, CAM, 84091, Italia	40.60947875	14.9834989652522	0.001
93571081	Via Generale Gonzaga, Battipaglia, SA, CAM, 84091, Italia	40.61091455	14.9883605931624	0.001
92688736	Via Leopardi, Battipaglia, SA, CAM, 84091, Italia	40.60804355	14.9897117159574	0.001
83739706	Via Adriatico, Rione Serroni, Battipaglia, SA, CAM, 84091, Italia	40.61548595	14.9750138379267	0.001
83058509	Via Caserta, Battipaglia, SA, CAM, 84091, Italia	40.61442965	14.9841525122432	0.001
96055945	Via De Chirico, Battipaglia, SA, CAM, 84091, Italia	40.60494515	14.9761536570985	0.001
11154220	Via Belvedere, Rione Serroni, Battipaglia, SA, CAM, 84091, Italia	40.6132305	14.9742799	0.001
93135066	Via T. Capone, Rione Stella, Battipaglia, SA, CAM, 84091, Italia	40.6090136	14.9760697627672	0.001
82666556	Via Ravenna, Battipaglia, SA, CAM, 84091, Italia	40.61583415	14.9867812708561	0.001
22343714	Via Andrea Sabatini, Baronissi, SA, CAM, 33, Italia	40.7302288	14.7748606	0.001
110571099	Scuola Media Dante Alighieri, Via Pigno, San Potito, Casali, Roccapiemonte, SA, CAM, 84086, Italia	40.76284475	14.687485191848	0.001
93377872	Liceo Scientifico B. Rescigno, Via Viviano, San Potito, Casali, Roccapiemonte, SA, CAM, 84086, Italia	40.75957385	14.6917845373132	0.001
101181619	Via Trento, Pagani, SA, CAM, 84016, Italia	40.744387	14.6212242059222	0.001
4137305	Via Trento, Pagani, SA, CAM, 84016, Italia	40.744572	14.6206289	0.001
19244414	Piazza Sant'Alfonso, Pagani, SA, CAM, 84016, Italia	40.743547	14.6098225	0.001
65242211	Istituto Tecnico Industriale Statale, Via Antonio de Curtis, Nocera Inferiore, SA, CAM, 84014, Italia	40.74971005	14.6299970257775	0.001
67676242	Scuola S. Chiara, Via Leonardo Da Vinci, Nocera Inferiore, SA, CAM, 84014, Italia	40.7437076	14.632953254496	0.001
66774831	Liceo Ginnasio Statale G.B. Vico, Via Pietro Martinez y Cabrera, Nocera Inferiore, SA, CAM, 84014, Italia	40.74445565	14.643230863101	0.001
98986521	Via Vincenzo Virno, Rione Filangieri, Passiano, Cava de' Tirreni, SA, CAM, 84013, Italia	40.7042349	14.7026672180798	0.001
101875598	Via Casa Apicella, Epitaffio, Passiano, Cava de' Tirreni, SA, CAM, 84013, Italia	40.7108863	14.6995157700261	0.001
20636198	Scuola Secondaria di I grado  A. Balzico, Corso Guglielmo Marconi, Rione Filangieri, Passiano, Cava de' Tirreni, SA, CAM, 84013, Italia	40.7043631	14.7030216	0.001
94970982	Via Salvo D'Acquisto, Epitaffio, Passiano, Cava de' Tirreni, SA, CAM, 84013, Italia	40.70804065	14.6991413522044	0.001
107403136	Scuola dell'infanzia  Mamma Lucia, Via Settimia Spizzichino, Rione Filangieri, Passiano, Cava de' Tirreni, SA, CAM, 84013, Italia	40.7013463	14.7026748068543	0.001
96091570	Liceo delle Scienze Umane e Linguistico  De Filippis, Via Gaetano Filangieri, Rione Filangieri, Passiano, Cava de' Tirreni, SA, CAM, 84013, Italia	40.7017364	14.7021568861807	0.001
18702028	Scuola Media Statale  Giovanni XXIII, Via Rosario Senatore, Pianesi, Passiano, Cava de' Tirreni, SA, CAM, 84013, Italia	40.6990564	14.703484	0.001
20178772	Istituto Tecnologico Statale per Geometri  L. Vanvitelli, Via Papa Giovanni XXIII, Rione Filangieri, Passiano, Cava de' Tirreni, SA, CAM, 84013, Italia	40.7038792	14.7022655	0.001
93765576	Istituto d'Istruzione Superiore  Gaetano Filangieri, Via 24 Maggio, Rione Sala, Casaburi, Cava de' Tirreni, SA, CAM, 84013, Italia	40.69722755	14.7090189170258	0.001
104023749	Via Antonio Adinolfi, Sant'Anna, Santa Lucia, Cava de' Tirreni, SA, CAM, 84013, Italia	40.73035835	14.7018139345928	0.001
77018947	Scuola Elementare Don Bosco, Via Generale Sabato Martelli Castaldi, Rione Filangieri, Pregiato, Cava de' Tirreni, SA, CAM, 84013, Italia	40.70369425	14.7049052100713	0.001
107543227	Liceo Scientifico Statale  A. Genoino, Via Ernesto Di Marino, Rione Filangieri, Passiano, Cava de' Tirreni, SA, CAM, 84013, Italia	40.70085615	14.6984551962691	0.001
102494072	Via Raffaele Farano, Pianesi, Casaburi, Cava de' Tirreni, SA, CAM, 84013, Italia	40.6988168	14.7033874899852	0.001
98019139	Istituto Comprensivo  Trezza, Via Alberto Troisi, San Lorenzo, Casaburi, Cava de' Tirreni, SA, CAM, 84013, Italia	40.70185655	14.7124963442223	0.001
95755182	Istituto Tecnico Commerciale  Matteo Della Corte, Corso Guglielmo Marconi, Rione Filangieri, Passiano, Cava de' Tirreni, SA, CAM, 84013, Italia	40.70611625	14.7014162334944	0.001
18490642	IIS Publio Virgilio Marone, SS88, Mercato San Severino, SA, CAM, 84084, Italia	40.7873352	14.7611913	0.001
18379187	Scuola Media e Ginnasio San Tommaso D'Aquino, Via Municipio, Mercato San Severino, SA, CAM, 84084, Italia	40.7854723	14.7524866	0.001
7985826	San Giovanni Bosco (Materna), Via Pecorari, Pecorari, Nocera Superiore, SA, CAM, 84015, Italia	40.7394795	14.6865154	0.001
74849778	Scuola Media Statale Fresa-Pascoli, Viale Europa, San Clemente, Nocera Superiore, SA, CAM, 84015, Italia	40.74649775	14.6748138221582	0.001
75380878	Scuola Superiore I.T.G. Vanvitelli, Via Giovanni Nicotera, Materdomini, Nocera Superiore, SA, CAM, 84086, Italia	40.75397175	14.6863671514296	0.001
7626441	Edmondo De' Amicis, Viale Croce, Croce Malloni, Nocera Superiore, SA, CAM, 84015, Italia	40.7479303	14.6824183	0.001
