1292430	Unicredit, Via Giuseppe Mazzini, Bagnacavallo, RA, EMR, 48012, Italia	44.415594	11.9769428	0.001
45714542	Credito Cooperativo, Largo Alcide De Gasperi, Bagnacavallo, RA, EMR, 48012, Italia	44.4166018	11.9805097	0.001
26806513	Unicredit Banca, Via Vecchia Traversara, Bagnacavallo, RA, EMR, 48012, Italia	44.4128701	12.0250102	0.001
47308132	Credito Cooperativo, Largo Alcide De Gasperi, Bagnacavallo, RA, EMR, 48012, Italia	44.4166018	11.9805097	0.001
27693396	Unicredit Banca, Via Vecchia Traversara, Bagnacavallo, RA, EMR, 48012, Italia	44.4128701	12.0250102	0.001
1373245	Unicredit, Via Giuseppe Mazzini, Bagnacavallo, RA, EMR, 48012, Italia	44.415594	11.9769428	0.001
54622706	BCC Rom Occ, Piazza Garibaldi, Solarolo, RA, EMR, 48031, Italia	44.3603337	11.8443288	0.001
54624907	Unicredit, Via Sangiorgi, Solarolo, RA, EMR, 48031, Italia	44.3595913	11.8453944	0.001
