78348031	Maranello Cafè, Piazza della Libertà, Castello Messori, Maranello, MO, EMR, 41053, Italia	44.525445	10.8666215114851	0.001
19969819	Via Castellotti, Z.A.I Maranello Nord, Maranello, MO, EMR, 41053, Italia	44.5394963	10.8726399	0.001
51306671	Piazza Roma, Castello Messori, Maranello, MO, EMR, 41053, Italia	44.5258967	10.8663103	0.001
51679660	Piazza Roma, Castello Messori, Maranello, Unione dei comuni del Distretto Ceramico, MO, EMR, 41053, Italia	44.5258967	10.8663103	0.001
21622060	Via Castellotti, Z.A.I Maranello Nord, Maranello, Unione dei comuni del Distretto Ceramico, MO, EMR, 41053, Italia	44.5394963	10.8726399	0.001
81392795	Maranello Cafè, Piazza della Libertà, Castello Messori, Maranello, Unione dei comuni del Distretto Ceramico, MO, EMR, 41053, Italia	44.525445	10.8666215114851	0.001
