4732148	Tiffany, Largo Alcide De Gasperi, Bagnacavallo, RA, EMR, 48012, Italia	44.416098	11.9801655	0.001
5583601	Lele, Via Pieve Masiera, Bagnacavallo, RA, EMR, 48012, Italia	44.4216042	11.971163	0.001
11778785	SP67, Bagnara di Romagna, RA, EMR, 27, Italia	44.4033073	11.846289	0.001
4852251	Tiffany, Largo Alcide De Gasperi, Bagnacavallo, RA, EMR, 48012, Italia	44.416098	11.9801655	0.001
5952838	Lele, Via Pieve Masiera, Bagnacavallo, RA, EMR, 48012, Italia	44.4216042	11.971163	0.001
12225540	SP67, Bagnara di Romagna, RA, EMR, 48031, Italia	44.4033073	11.846289	0.001
