138259982	Ingresso 2°-3° giorno, Ravenna, RA, EMR, 48125, Italia	44.3360484	12.2653350327184	0.001
6266774	Via Brigata Ebraica, Ravenna, RA, EMR, 48121, Italia	44.414267	12.2081555	0.001
6037420	Via di Roma, Villaggio Anic, Ravenna, RA, EMR, 48121, Italia	44.4134083	12.2060667	0.001
39780141	Viale delle Nazioni, Ravenna, RA, EMR, 48023, Italia	44.482455	12.2819449	0.001
16883051	Piazza Monsignor Vantagoli, Fusignano, RA, EMR, Italia	44.4675803	11.9592595	0.001
139767974	Viale Orsini, Lugo, RA, EMR, 48022, Italia	44.41510545	11.9108649436359	0.001
11583979	Funtana de' Bafiòn, Via Nuova Selice, Conselice, RA, EMR, 48017, Italia	44.5121922	11.8256118	0.001
