83448415	Casa dell'Ariosto, Via Ludovico Ariosto, Centro cittadino, Circoscrizione 1, Ferrara, FE, EMR, 44121, Italia	44.844611	11.6168665078685	0.13061965013967
687406	Biblioteca Comunale Ariostea, Via Giuoco del Pallone, Centro cittadino, Circoscrizione 1, Ferrara, FE, EMR, 44121, Italia	44.8326967	11.621702	0.13061965013967
97390993	Biblioteca  Giorgio Bassani, Via Angelica, Barco, Circoscrizione 3, Ferrara, FE, EMR, 44121, Italia	44.8639188	11.604465908407	0.001
22127950	Biblioteca Ragazzi, Piazza Martiri della Libertà, San Pietro in Casale, BO, EMR, 40018, Italia	44.7002668	11.4043531	0.001
4065228	Biblioteca Comunale  Mario Luzi, Via Giacomo Matteotti, San Pietro in Casale, BO, EMR, 40018, Italia	44.7009714	11.4043661	0.001
16059287	Via Provinciale Galliera, San Pietro in Casale, BO, EMR, 40015, Italia	44.7334601	11.4401641	0.001
102362171	Biblioteca Comunale  Mario Soldati, 35/c, Strada Marcavallo, Ostellato, FE, EMR, 44027, Italia	44.74326315	11.9393925648965	0.001
