49898398	Piazza Unità D'Italia, Castello Messori, Maranello, MO, EMR, 41053, Italia	44.528811	10.8653414	0.001
51878703	Piazza Giovanni Amendola, Castello Messori, Maranello, MO, EMR, 41053, Italia	44.5255582	10.8725835	0.001
50635596	Piazza Vasco de Gama, Castello Messori, Maranello, MO, EMR, 41053, Italia	44.5268682	10.8674738	0.001
52267469	Piazza Unità D'Italia, Castello Messori, Maranello, Unione dei comuni del Distretto Ceramico, MO, EMR, 41053, Italia	44.528811	10.8653414	0.001
51521521	Piazza Giovanni Amendola, Castello Messori, Maranello, Unione dei comuni del Distretto Ceramico, MO, EMR, 41053, Italia	44.5255582	10.8725835	0.001
51536815	Piazza Vasco de Gama, Castello Messori, Maranello, Unione dei comuni del Distretto Ceramico, MO, EMR, 41053, Italia	44.5268682	10.8674738	0.001
