46766674	Scuola Primaria  R. Romagnoli, 22, Via Gianni Rodari, San Giovanni in Persiceto, BO, EMR, 40017, Italia	44.6288043	11.1914203	0.001
46143267	Asilo Infantile e Fondazione Amici dei Bimbi, Viale Gandolfi, San Giovanni in Persiceto, BO, EMR, 40017, Italia	44.6388477	11.1840279	0.001
5952076	Media Statale Mameli, Via Enrico Fermi, San Giovanni in Persiceto, BO, EMR, 40017, Italia	44.6323659	11.1874331	0.001
49076700	Scuola Primaria  Quaquarelli, Viale Gandolfi, San Giovanni in Persiceto, BO, EMR, 40017, Italia	44.6393428	11.184705	0.001
48194779	Scuola Primaria  Quaquarelli, Viale Gandolfi, San Giovanni in Persiceto, BO, EMR, 40017, Italia	44.6393428	11.184705	0.001
47575945	Scuola Primaria  R. Romagnoli, 22, Via Gianni Rodari, San Giovanni in Persiceto, BO, EMR, 40017, Italia	44.6288043	11.1914203	0.001
158566035	Scuola Secondaria di I grado  Goffredo Mameli, Via Enrico Fermi, San Giovanni in Persiceto, BO, EMR, 40017, Italia	44.632015	11.187137967837	0.001
47832098	Asilo Infantile e Fondazione Amici dei Bimbi, Viale Gandolfi, San Giovanni in Persiceto, BO, EMR, 40017, Italia	44.6388477	11.1840279	0.001
