6902282	Modena, Via Giovanni Galvani, Circoscrizione 1: CENTRO STORICO, Modena, MO, EMR, 41121, Italia	44.6545492	10.9297206	0.32301894165642
667608	Modena Piazza Manzoni, Piazzale Manzoni, Circoscrizione 3: BUON PASTORE-SANT’AGNESE-SAN DAMASO, Modena, MO, EMR, 41100, Italia	44.6344293	10.9311678	0.16095925177046
47485309	Modena Fornaci, Strada Stradella, Circoscrizione 3: BUON PASTORE-SANT’AGNESE-SAN DAMASO, Modena, MO, EMR, 41126, Italia	44.6139581	10.8898268	0.001
6750144	Modena, Via Giovanni Galvani, Addizione Erculea, Centro Storico, Modena, MO, EMR, 41121, Italia	44.6545492	10.9297206	0.32301894165642
678298	Modena Piazza Manzoni, Via Domenico Cucchiari, Buon Pastore-Sant'Agnese-San Damaso, Modena, MO, EMR, 41100, Italia	44.6344293	10.9311678	0.16095925177046
47144987	Modena Fornaci, Strada Stradella, Baggiovara, Saliceta San Giuliano, Modena, MO, EMR, 41126, Italia	44.6139581	10.8898268	0.001
6750144	Modena, Via Giovanni Galvani, Addizione Erculea, Centro Storico, Modena, MO, EMR, 41121, Italia	44.6545492	10.9297206	0.32301894165642
678298	Modena Piazza Manzoni, Via Domenico Cucchiari, Buon Pastore-Sant'Agnese-San Damaso, Modena, MO, EMR, 41100, Italia	44.6344293	10.9311678	0.16095925177046
47144987	Modena Fornaci, Strada Stradella, Baggiovara, Saliceta San Giuliano, Modena, MO, EMR, 41126, Italia	44.6139581	10.8898268	0.001
