17144817	BLS, Viale Cappuccini, Contrada Torre Marino, Lanciano, CH, ABR, 66034, Italia	42.2243805	14.3857019	0.001
28325932	Strada dell'Anello, Piana San Bartolomeo, Guardiagrele, CH, ABR, 66016, Italia	42.1988833	14.2185102	0.001
18185222	Banca Popolare di Lanciano e Sulmona, Corso Umberto I, Crecchio, CH, ABR, 66014, Italia	42.2970221	14.3266368	0.001
50379952	Corso Adriatico, Villalfonsina, CH, ABR, 66021, Italia	42.1643003	14.5740874	0.001
50255886	Via Alcide De Gasperi, Villalfonsina, CH, ABR, 66021, Italia	42.1645919	14.5742597	0.001
26918893	Banca Monte dei Paschi di Siena, Via Duca degli Abruzzi, San Salvo, CH, ABR, Italia	42.0475429	14.7296643	0.001
7010643	BCC Sangro Teatina, Corso Italia, Giuliano Teatino, CH, ABR, Italia	42.2954822	14.2746513	0.001
