19487198	Carabinieri, Via del Verde, Contrada Iconicella, Lanciano, CH, ABR, 66034, Italia	42.2253451	14.3981476	0.001
18008898	Polizia Municipale, Via Filippo Stella Maranca, Contrada Torre Marino, Lanciano, CH, ABR, 66034, Italia	42.2182126	14.382965	0.001
94128535	Polizia, Via Vittorio Bachelet, Vasto, CH, ABR, 66054, Italia	42.12339235	14.7076912627682	0.001
26430677	Polizia Municipale, Piazza Gabriele Rossetti, Vasto, CH, ABR, 66054, Italia	42.1107809	14.7080269	0.001
119885252	Carabinieri, Circonvallazione Histoniense, Vasto, CH, ABR, 66054, Italia	42.12706655	14.7008673498148	0.001
16106588	Comando Polizia Urbana Comune di Atessa, Salita Castello, Atessa, CH, ABR, Italia	42.0675671	14.4427781	0.001
33294403	Corpo Forestale Dello Stato, Viale Maiella, Fara San Martino, CH, ABR, 66015, Italia	42.0870736	14.2069884	0.001
