18600220	Desmond Brew Pub, Via Cavaticchio, Spoltore, PE, ABR, 66013, Italia	42.416088	14.1449362	0.101
7897178	The Underground Pub, Viale Alcione, Francavilla al Mare, CH, ABR, 66023, Italia	42.43656	14.263974	0.101
633891	Temple Bar, 2,4, Piazza dei Martiri Pennesi, Rione Ospedale, Pescara, PE, ABR, 65123, Italia	42.4733057	14.2036167	0.001
659804	Tilly, Viale Guglielmo Marconi, Portanuova, Pescara, PE, ABR, 65126, Italia	42.4527456	14.2271272	0.001
16262616	Bi-jou, Piazza Umberto I, Villa Carmine, Montesilvano, PE, ABR, 65015, Italia	42.4915506	14.1393357	0.001
650048	Batch, 176/4, Via Giuseppe Verrotti, Villa Verrocchio, Montesilvano, PE, ABR, 65015, Italia	42.4982823	14.1679841	0.001
3728836	Mix, Via Iseo, Villa Verlengia, Montesilvano, PE, ABR, 65015, Italia	42.4959394	14.1719297	0.001
4017653	Siren's Corner, Lungomare Aldo Moro, Francavilla al Mare, CH, ABR, 66023, Italia	42.420173	14.2925386	0.001
7919875	Stozza'n'Beer, Viale Alcione, Francavilla al Mare, CH, ABR, 66023, Italia	42.443996	14.253499	0.001
