13778098	Murphy's Irish Pub, Via Taranto, Silvi, TE, ABR, 64028, Italia	42.5665623	14.1043536	0.101
64469067	Pin Palace, 420, Corso Umberto I, Villa Verrocchio, Montesilvano, PE, ABR, 65015, Italia	42.5031177	14.1654866179218	0.001
3319536	Anni 60, 9, Via Vestina, Colonnetta, Montesilvano, PE, ABR, 65015, Italia	42.5155848	14.1491976	0.001
633157	St. Pauli, 6, Via Isonzo, Villa Verrocchio, Montesilvano, PE, ABR, 65015, Italia	42.5064274	14.1709024	0.001
663240	One & Co., 97, Piazza Alfredo Beni, Colonnetta, Montesilvano, PE, ABR, 65015, Italia	42.5159515	14.1510953	0.001
1267523	Rincon Latino, 91bis, Via Lanciano, Villa Verrocchio, Montesilvano, PE, ABR, 65015, Italia	42.5086505	14.1667272	0.001
646595	Utopia, 28, Via Giuseppe Verrotti, Villa Canonico, Montesilvano, PE, ABR, 65015, Italia	42.5088013	14.1550914	0.001
