25430604	Liceo Scientifico A. Bafile, Via Muratori di Pizzoli, L'Aquila, AQ, ABR, 67100, Italia	42.3569657	13.4140345	0.001
142117401	Circolo Didattico 'Amiternum'dell'Aquila, Via Pasquale Ficara, L'Aquila, AQ, ABR, 67100, Italia	42.36529035	13.3630437048012	0.001
1356904	ITG Giuseppe colecchi, Via Giuseppe Mezzanotte, L'Aquila, AQ, ABR, 67100, Italia	42.355917	13.4144374	0.001
1310964	ITIS, Via Acquasanta, L'Aquila, AQ, ABR, 67100, Italia	42.3552084	13.413225	0.001
141114403	Gianni rodari, Via Salaria Antica Est, L'Aquila, AQ, ABR, 67100, Italia	42.35681795	13.3738441463585	0.001
100135811	Via dell'Industria, Paganica, L'Aquila, AQ, ABR, Italia	42.34269795	13.4655768007472	0.001
115348127	Via Monte Pizzillo, L'Aquila, AQ, ABR, 67100, Italia	42.36229555	13.3887128739125	0.001
