6729675	Avezzano, Via Monte D'Oro, Borgo Via Nuova, Avezzano, AQ, ABR, 67051, Italia	42.0395619	13.4265006	0.22367496645424
7686212	Celano-Ovindoli, Viale Stazione, Celano, AQ, ABR, 67043, Italia	42.0769989	13.543388	0.12027225158296
39508957	Cappelle Magliano, Via Tiburtina Valeria, Scurcola Marsicana, AQ, ABR, 67068, Italia	42.0593593	13.3725254	0.10803387666472
14905485	Cerchio, Via Umberto I, Cerchio, AQ, ABR, Italia	42.0610962	13.598399	0.093055316314571
18254152	Villa San Sebastiano, SR5qtr, Tagliacozzo, AQ, ABR, 67069, Italia	42.049281	13.3081091	0.001
46319838	Fagnano Campana, SR261, Fontecchio, AQ, ABR, Italia	42.2505863	13.5627358	0.001
6548828	San Demetrio Ne' Vestini, SR261, San Demetrio ne' Vestini, AQ, ABR, 67026, Italia	42.2943965	13.536536	0.001
10718979	Scurcola Marsicana, Via della Stazione, Scurcola Marsicana, AQ, ABR, Italia	42.0530759	13.3443862	0.001
