15151022	Castel di Sangro, Via della Stazione, Castel di Sangro, AQ, ABR, Italia	41.7778646	14.1119757	0.18611063262914
821896	Rivisondoli - Pescocostanzo, Ex Strada Statale 84 Frentana, Rivisondoli, AQ, ABR, Italia	41.8772996	14.0792842	0.10803387666472
15339523	S. Ilario Sangro, Strada Statale 17 dell'Appennino Abruzzese e Appulo Sannitico, Castel di Sangro, AQ, ABR, Italia	41.7867293	14.0857954	0.10803387666472
6854154	Alfedena-Scontrone, Via Alboreto, Alfedena, AQ, ABR, Italia	41.7382038	14.0447151	0.093055316314571
36357673	San Pietro Avellana, SP87, San Pietro Avellana, IS, MOL, Italia	41.7697694	14.1998104	0.093055316314571
6628015	Roccaraso, Strada della Zona Rurale, Roccaraso, AQ, ABR, Italia	41.850804	14.0793485	0.07374459342567
15179961	Montenero Valcocchiara, SS83, Alfedena, AQ, ABR, Italia	41.750051	14.0895159	0.001
118551808	S. Ilario Sangro, Strada Statale 17 dell'Appennino Abruzzese e Appulo Sannitico, Castel di Sangro, AQ, ABR, Italia	41.78672715	14.0859908714035	0.001
46715027	San Pietro Avellana, SS652, San Pietro Avellana, IS, MOL, Italia	41.831745	14.1833544	0.001
