27572325	Poste Italiane, Via Carducci, Pratza Ballus, Mòguru/Mogoro, OR, SAR, 09095, Italia	39.6846385	8.7750781	0.001
20514246	Banca Intesa, Via Su ponti nou, Terraba/Terralba, OR, SAR, 09098, Italia	39.7230747	8.6373421	0.001
19401014	Banca di Arborea, Via Marceddì, Terraba/Terralba, OR, SAR, 09098, Italia	39.7223298	8.6369133	0.001
20741066	Banco di Sassari, Via Porcella, Terraba/Terralba, OR, SAR, 09098, Italia	39.721598	8.6374406	0.001
20048764	Poste Italiane, Via Marceddì, Terraba/Terralba, OR, SAR, 09098, Italia	39.722922	8.6367041	0.001
19909486	Unipol Banca, Viale Sardegna, Terraba/Terralba, OR, SAR, 09098, Italia	39.7212321	8.6389218	0.001
20062757	Banco di Sardegna, Piazza Italia, Marrùbiu/Marrubiu, OR, SAR, 09094, Italia	39.7526798	8.6406076	0.001
37695293	Via Vespucci, Arbus, VS, SAR, 09031, Italia	39.6809502	8.4508233	0.001
