25505270	Cinema Odissea, 84, Viale Trieste, Tuvixeddu-Tuvumannu, Casteddu/Cagliari, CA, SAR, 09121-09131, 09134, Italia	39.2196973	9.1036361	0.101
14840280	UCI Cinemas, Via Flumendosa, Sant'Avendrace-Santa Gilla, Casteddu/Cagliari, CA, SAR, 09121-09131, 09134, Italia	39.2273538	9.0976506	0.101
63601744	The Space Cinema, Viale Guglielmo Marconi, Quartu Sant'Aleni/Quartu Sant'Elena, CA, SAR, 09045, Italia	39.24505065	9.16272289709466	0.101
25512832	Greenwich d'essai, 55, Via Sassari, Stampace, Casteddu/Cagliari, CA, SAR, 09121-09131, 09134, Italia	39.2171694	9.110896	0.001
15573623	Multisala Cineworld, Via del Fangario, San Michele, Casteddu/Cagliari, CA, SAR, 09121-09131, 09134, Italia	39.2437453	9.0959299	0.001
7980402	Warner village The space, Viale Guglielmo Marconi, Quartu Sant'Aleni/Quartu Sant'Elena, CA, SAR, 09045, Italia	39.2450135	9.1627933	0.001
