21715049	Polizia Municipale, Piazza Carlo Alberto, Cùllieri/Cuglieri, OR, SAR, 09073, Italia	40.1895127	8.5681235	0.001
98299535	Stazione Forestale, Corso Umberto I, Cùllieri/Cuglieri, OR, SAR, 09073, Italia	40.18725905	8.56741752288772	0.001
24452006	Via Roma, Tresnuraghes, OR, SAR, 09079, Italia	40.2564195	8.5243606	0.001
20869090	commissariato di PS, Via Emilio Lussu, Macumere/Macomer, NU, SAR, 08015, Italia	40.2644535	8.761613	0.001
19558319	Carabinieri, Via Umberto I, Bortigale/Bortigali, NU, SAR, 08012, Italia	40.2823456	8.8375776	0.001
27307117	Via Dessi, Sune/Suni, OR, SAR, 08010, Italia	40.2784056	8.5507663	0.001
18776744	Carabinieri, Piazza Montrigu de Reos, Iscanu/Scano di Montiferro, OR, SAR, 09078, Italia	40.2169239	8.5844129	0.001
