42647694	Republik, Via Manno, Marina, Casteddu/Cagliari, CA, SAR, 09121-09131, 09134, Italia	39.2163077	9.1142787	0.101
41399716	Il Vespaio, Via Savoia, Marina, Casteddu/Cagliari, CA, SAR, 09121-09131, 09134, Italia	39.2157117	9.1131555	0.001
25695333	Beer Garden, 49, Via Giovanni Maria Angioy, Stampace, Casteddu/Cagliari, CA, SAR, 09121-09131, 09134, Italia	39.2165229	9.1117234	0.001
26121748	Donegal, 7, Via Caprera, Stampace, Casteddu/Cagliari, CA, SAR, 09121-09131, 09134, Italia	39.2182779	9.1078906	0.001
24827684	Birroteca Al Merlo Parlante, 69, Via Portoscalas, Stampace, Casteddu/Cagliari, CA, SAR, 09121-09131, 09134, Italia	39.2186071	9.1104594	0.001
46473513	Rex Fox, 400/E, Via San Giovanni, Sant'Alenixedda, Casteddu/Cagliari, CA, SAR, 09121-09131, 09134, Italia	39.2249925	9.1198039	0.001
24645471	Birra e dintorni, 5, Via Santa Margherita, Castello, Casteddu/Cagliari, CA, SAR, 09121-09131, 09134, Italia	39.2182289	9.1136846	0.001
