769337	Cagliari, Via Roma, Stampace, Casteddu/Cagliari, CA, SAR, 09121-09131, 09134, Italia	39.215923	9.1082267	0.35697998354854
46421995	Monserrato, Via Pompeo, Paùli/Monserrato, CA, SAR, 09042, Italia	39.2647208	9.1446562	0.29497837370268
3118398	Dolianova, Via Giovanni Battista Tuveri, Patiolla/Dolianova, CA, SAR, 09041, Italia	39.3766192	9.1688551	0.29330015574966
1328501	Settimo San Pietro, Via Stazione, Sètimu/Settimo San Pietro, CA, SAR, 09040, Italia	39.2897415	9.1767815	0.29244504582027
13702315	Cagliari Santa Gilla, Via dei Giornalisti, Sant'Avendrace-Santa Gilla, Casteddu/Cagliari, CA, SAR, 09121-09131, 09134, Italia	39.2264335	9.0975741	0.154561534822
136660078	Monserrato, Via Pompeo, Paùli/Monserrato, CA, SAR, 09042, Italia	39.2648177	9.14454189999999	0.001
1229074	Soleminis, Via Stazione, Solèminis/Soleminis, CA, SAR, 09040, Italia	39.3458408	9.1762923	0.001
